"COP","country","ID","title","date","source","text"
"COP25","Ireland","COP25_Ireland1","Spain to host COP25 climate talks after Chile withdraws","November 1, 2019 Friday 6:26 PM GMT","RTE News","Spain will host the COP25 climate summit in December, the UN said, after Chile abandoned plans to hold it due to deadly anti-government protests.""We are pleased to announce the COP Bureau has agreed that COP25 will take place from 2-13 December in Madrid,"" United Nations climate chief Patricia Espinosa said on Twitter.We are pleased to announce the COP Bureau has agreed that #COP25 will take place from 2-13 December in Madrid, Spain. HYPERLINK https://t.co/4XZBBLOd15 pic.twitter.com/YI12XRaroj Patricia Espinosa C. (@PEspinosaC) November 1, 2019After more than 10 days of street protests, Chilean President Sebastian Pinera said his country was not in a position to host either the 2-13 December climate convention as well as the 16-17 November Asia Pacific Economic Cooperation (APEC) summit.""This has been a very difficult decision, a decision that has been deeply painful because we know exactly how important APEC and COP are for Chile and the world,"" said Mr Pinera.""When a father has problems, he must always prioritise his family over other options. The same goes for a president, he must always put his own compatriots first, ahead of any other considerations,"" he added.He said Spanish Prime Minister Pedro Sanchez had ""made a generous offer to host the COP25 summit in Madrid"" on the originally scheduled dates which the Spanish government promptly confirmed.\l"
"COP25","Ireland","COP25_Ireland2","COP25 climate summit unravelling, facing failure","December 14, 2019 Saturday 1:07 PM GMT","RTE News","A UN climate summit in Madrid is on life support after marathon negotiations between countries left them more divided than ever over on how to fight global warming and pay for its ravages.Diplomats from rich nations, emerging giants and the world's poorest countries, each for their own reasons, found fault in a draft agreement put forward by host Chile in a botched attempt to strike common ground. But the 12-day talks, now deep into overtime, had retreated even further from this goal today.Marshall Islands climate envoy Tina Stege said:""It appears that we are going backwards on the issue of ambition when we should be calling for a quantum leap in the other direction.""""I need to go home and look my children in the eye and say we got an outcome that is going to ensure their future, and the future of all of our children,"" she added, a catch in her voice.Veteran observers of UN climate talks were stunned by the state of play nearly 24 hours after the negotiations had been set to close. \l"
"COP25","Ireland","COP25_Ireland3","Pelosi tells COP25 summit they can still count on US","December 2, 2019 Monday 5:15 PM GMT","RTE News","US Congressional leader Nancy Pelosi has told the ""COP25"" conference that the world could still count on the United States despite President Donald Trump's decision to pull out of the Paris Agreement.Speaking in Madrid on the first day of a two-week global climate summit, Ms Pelosi said states and cities which are home to two-thirds of the US population are committed to the targets set by the 2015 agreement, as are all the Democratic candidates for president, according the US research groups.""We're here to say to all of you, on behalf of the House of Representatives and the Congress of the United States, we're still in it, we're still in it,"" Ms Pelosi said to applause at a forum of heads of state from climate-vulnerable nations.The United Nations launched the summit this morning amid growing pressure on world leaders to prove they can muster the political will to avert the most catastrophic impacts of global warming.Leading the 15-strong Congressional delegation, Ms Pelosi came to Madrid even as her colleagues in the House consider articles of impeachment against the US President.Mr Trump has dismissed global warming as a hoax, and dismantled many of the climate and environmental protection policies set in place by his predecessor Barack Obama.Last month he gave formal notice of the US withdrawal from the 196-nation Paris climate treaty, which calls for capping global warming at well below 2 degrees Celsius, and 1.5 degree Celsius if possible.\l"
"COP25","Ireland","COP25_Ireland4","Cop25: Who will be there, and what will they agree?","December 3, 2019 Tuesday","The Irish Times","Cop25: What is it? The annual ""conference of the parties"" (Cop) is the gathering of almost every country on earth under the auspices of the UN Framework Convention on Climate Change to consider how best to respond to the growing climate crisis.This year is the 25th gathering and it had to be relocated from Chile to Madrid due to civil unrest. The blueprint for decarbonising the world and arresting global heating is the landmark 2015 Paris Agreement. What's different about this climate-change meeting? This gathering has to sign off on a ""Paris rulebook"" as the agreement kicks in on January 1st. It heralds the end of non-legally binding targets in reducing carbon emissions and adopting renewable energy. The era of wealthy countries, including Ireland, having to step up ambition on climate action is imminent.Since Cop24, people across the world have raised their collective voice in demanding politicians address the climate issue with much more urgency, and end domination of fossil fuels in their economies.Nations are equipped with the knowledge and resources to confront changes; ""what's lacking is political will to tax and limit coal, fossil fuels, and carbon""- is Guterres's verdict. Who will be there? Leaders of almost 200 countries will attend Cop25. The notable absentee will be supreme climate denier US president Donald Trump. Last year, he sent low-level public servants to a make a case for ""clean coal""- it provoked protests. The US will leave the Paris Agreement in November, if Trump is re-elected.Other big emitters such as China, Russia, India and Brazil will be present. Countries headed by climate sceptics such as Brazil (Jair Bolsonaro) and Australia (Scott Morrison) and those with big fossil fuel outputs, such as Saudi Arabia, represent the biggest block to progress.What is Ireland's stance? Ireland comes to the Cop25 table with more credibility than its ""laggard"" status last year, confirmed by the latest rankings in the Climate Change Performance Index.This is primarily because of cross-party agreement on ways forward and the Government's climate action plan. Ireland is supporting greater international ambition, though rowing in a European green new deal to be unveiled shortly would be hugely demanding.Transport, agriculture and poor-quality buildings pose an immense challenge for the Republic, which will say a booming economy means the emissions curve is going in the wrong direction. What are the big decisions? Signing off on the Paris rulebook is the big one. It would level the playing field and ensure watertight monitoring of emissions including how ""carbon credits"" are measured and applied, notably in forestry.A deal of sorts will be forged; the question is how significant. It is essential to secure more ambitious national commitments - particularly from the main emitters - to immediately start reducing emissions at a pace consistent to reaching carbon neutrality by 2050. Regardless, many countries will join the higher ambition club. EU member states will back efforts to make Europe the first carbon-neutral continent. Ireland has yet to fully commit in that regard. \l"
"COP25","Ireland","COP25_Ireland5","Chile withdraws from hosting summits after protests","October 30, 2019 Wednesday 3:38 PM GMT","RTE News","Chile has withdrawn as host of the APEC trade summit in November and the COP25 climate summit in December after several weeks of violent unrest.Under-fire Chilean President Sebastian Pinera made the announcement this afternoon.The APEC summit was scheduled to bring together 20 world leaders, including US President Donald Trump and Chinese President Xi Jinping, over 16-17 November.The COP25""This has been a very difficult decision, a decision that causes us a lot of pain, because we fully understand the importance of APEC and COP-25 for Chile and for the world,"" Mr Pinera said in a brief statement from La Moneda palace in Santiago.Riots, arson and protests over inequality this month have left at least 18 dead, 7,000 arrested and Chilean businesses hit with losses of around $1.4 billion.The capital city's metro public transport suffered nearly $400 million in damages.With Mr Pinera's popularity at an all-time low, Chileans were calling for new protests and the United Nations was sending a team to investigate allegations of human rights abuses.The cancellation of the trade summit caught the Trump administration by surprise, a White House official said.The official said the US learned about the decision from news reports and was seeking more information.\l"
"COP25","Ireland","COP25_Ireland6","Climate talks Five things we learned from the COP25 talksKevin O'Sullivan","December 16, 2019 Monday","The Irish Times","2 Science shows last six years are hottest on record Almost as if timed to concentrate negotiator minds at , a series of reports confirmed the hardening science in the days beforehand. As 2019 concludes, this has been a decade of exceptional global heat, retreating ice and record sea levels driven by greenhouse gases (GHGs) from human activities. We are facing an intolerable 3.2-degree temperature rise as is. The past six years have been the hottest in the Arctic; Greenland's ice melt is accelerating. Earlier this year, it was confirmed sea level rise this century is likely to be at least 1.1 metres.Johan Rockstr\'f6m of Potsdam Institute for Climate Impact Research, in a climate emergency debate, distilled those trends: ""The red thread in science over the past 20 years is that we have underestimated the pace of change and the risks we are facing."" 1 There is a profound disconnect between people and politicians As the UN climate talks moved into crunch phase, almost 200 global leaders landed in Madrid to push for a final deal. A palpable gloom, however, did not lift. In the past it has done so when political pragmatism was applied.This summit aimed to hammer out the final implementation details of the landmark 2015 Paris climate accord, and expectations were high of a collective political call for raising climate targets. It was also hoped to set rules for an international carbon trading system and a method to provide money for poor countries that suffer most from climate catastrophes.This year was different. Politicians arrived with the voice of young people ringing in their rings, after a year when millions took to the streets across the planet fired up by the stark, science-based rhetoric of Greta Thunberg. Everywhere they turned there were young, highly-committed climate activists, who know their climate science, to remind them of what was urgently needed and demanding higher ambition, namely net-zero emissions by 2050. But it served to underl"
"COP25","Ireland","COP25_Ireland7","Amazon countries sign forest pact","September 7, 2019 Saturday 11:02 AM GMT","RTE News","Seven Amazonian countries have signed a pact to protect the world's largest tropical forest via disaster response coordination and satellite monitoring, amid recent fires that torched thousands of square kilometres of the jungle.The presidents of Colombia, Bolivia, Ecuador and Peru, the vice-president of Suriname and the natural resource minister of Guyana attended yesterday's one-day summit in the jungle city of Leticia in southern Colombia.""This meeting will live on as a coordination mechanism for the presidents that share this treasure - the Amazon,"" Colombian President Ivan Duque said at the signing, adding the countries will meet again at the United Nations in December.""Goodwill alone is not enough anymore,"" Peruvian President Martin Vizcarra added.The countries will create a natural disaster network so they can better cooperate in the face of events like large-scale fires, the pact said.The group will also work on reforestation initiatives, increase efforts to monitor deforestation activity via satellite, develop education initiatives and increase the role of indigenous communities in sustainable development, it added.The countries also agreed to share information on activities like illegal mining that hurt conservation, the pact said.\l"
"COP25","Ireland","COP25_Ireland8","'Non-binary' recognised as word by Collins Dictionary","November 7, 2019 Thursday 9:36 AM GMT","RTE News","Collins Dictionary has recognised the word ""non-binary"", whilst also naming ""climate strike"" as its Word of the Year 2019.The dictionary said it added the term ""non-binary"" in recognition of ""changes in how people relate to each other and define themselves"".A person who identifies as non-binary does not define themselves exclusively as mascul"
"COP25","Ireland","COP25_Ireland9","Jules Kortenhorst: US institutions defying Trump to abide by climate accords","December 12, 2019 Thursday","Irish Examiner","<strong>By Junes Kortenhorst and Andrew Steer</strong>Non-federal US actors - from state governments to private businesses - have laid a strong foundation for effective climate action, says Jules Kortenhorst and Andrew SteerThe United NationsClimate Change ConferenceCOP25) currently taking place in Madrid is supposed to prepare the ground for more ambitious national climate commitments. Nowhere is this more important than in the country where national leadership on climate change is least likely: The US.But a new report should give the world hope it's not too late to keep the US on a path in l"
"COP25","Ireland","COP25_Ireland10","Default sees Wallace lose Dublin house","December 13, 2019 Friday","The Irish Times","Ireland South MEP and former Wexford TD Mick Wallace is to hand back the keys to his Dublin home next spring after he spends Christmas there. A sitting of Dublin Circuit Civil Court heard Mr Wallace had defaulted on an EUR 825,000 mortgage. The court heard he told a bank official he was unwilling to surrender the property on Clontarf Road, Dublin 3, which is his principal private residence. Judge Jacquel"
"COP25","Ireland","COP25_Ireland11","Still no UN agreement on credits to cut emissions; Delegates at Cop25 unable to agree a new market instrument to rein in pollution","December 17, 2019 Tuesday","The Irish Times","After two weeks of talks, envoys from almost 200 countries shelved work on adding market mechanisms as a tool to curb greenhouse gases, settling on a more limited set of measures to rein in climate change.Delegates at Cop25 The result left open how key sections of the landmark 2015 Paris Agreement will work when that deal comes into force next year. Many envoys said that the decision to express an ""urgent need"" to make more ambitious cuts in fossil fuel emissions represents a step backward from previous deals.""It's not what the world had hoped for and what Europe would've hoped for,"" said Karsten Sach, an official speaking for Germany at the meeting in Madrid. ""We couldn't agree on a market mechanism. The process was sometimes a little bit cumbersome and slow.""The delegates from environment and energy ministries stumbled over the details for a new market instrument to rein in pollution. They were trying to work out how to prevent double counting of credits and integrate into the new system an existing mechanism that funnels at least $138 billion into green projects.Carbon trading The impasse leaves companies that encouraged carbon trading, including the oil major Royal Dutch Shell Plc and the Spanish utility Iberdrola SA, with fewer price signals showing how quickly the cost of pollution is rising.""This is a huge disappointment,"" said Dirk Forrister, chief executive officer of the International Emissions Trading Association. ""The fact is that countries' ability to deliver stronger targets in l"
"COP25","Ireland","COP25_Ireland12","Time for the rich world to step up; Madrid climate conference","December 9, 2019 Monday","The Irish Times","A disconnect between the latest scientific warnings and political action in addressing the climate crisis was all too evident as the annual UN negotiations opened in Madrid last week. There was understandable disarray given COP25 - attended by leaders from almost 200 countries - had to be hastily relocated to Spain due to civil unrest in Chile. But the latest scientific evidence stood out above all that and has never been clearer.Global temperatures are on track to rise by an intolerable 3.2 degrees, and sea levels are set to increase by more than one metre this century, that'sif the world continues with half-hearted commitments to reduce emissions, persists in enabling expansion of the fossil fuel sector and allows carbon polluters to continue in business-as-usual mode.Emissions may be growing at a slower rate but the world is far from achieving the drastic reductions needed to avert catastrophic global warming, according to the Global Carbon Project. The European Environment Agency's five-year report on the state of Europe put it starkly as far as wealthy countries - which generate by far the most emissions - are concerned. Current responses to biodiversity loss combined with global heating risk undermining the continent's prosperity. ""Pursuing growth at the expense of the environment is no longer an option. Marginal efficiency gains are not enough,"" it declared.UN secretary general Ant\'f3nio Guterres warned at the opening session it is ""almost too late"", and asked: ""Do we want to be remembered as the generation that buried its head in the sand and fiddled as the planet burned?""COP25 is moving into the business end of the two-week talks. A rulebook on implementing the Paris Agreement from next year needs to be signed off, reinforced by transparency on how the world measures emissions and trades in carbon. Developed countries need to step up and help poor countries already suffering due to climate disruption. Most importantly, big emitting countries have to commit to climate actions that will force their emissions trajectories downwards. Guterres will need to apply much guile and diplomatic clout in demanding China, Russia, India and Japan take the lead - the US under president Donald Trump is in effect outside the Paris process but no less culpable.COP25 has to end the shocking lack of urgency.\l"
"COP25","Ireland","COP25_Ireland13","Climate summit ends without consensus","December 16, 2019 Monday","The Irish Times","The UN's longest-ever climate summit drew to a close in Madrid yesterday after two additional days and nights of negotiations, with agreement only on the ""urgent need"" for countries to make deeper cuts to carbon emissions. Aims to reform carbon trading markets to eliminate loopholes and increase supports for developing countries most exposed to climate disruption were not realised despite participating nations having seen unprecedented protests by climate activists in their countries this year. Environmental organisations expressed dismay at the weak outcome of COP25, while UN secretary-general Ant\'f3nio Guterres said: ""The international community lost an important opportunity to show increased ambition on mitigation, adaptation and finance to tackle the climate crisis. But we must not give up, and I will not give up."" There was some progress, however, after a ""high-ambition coalition"" made up of the EU and smaller developing countries pressed for a resolution to ask all governments to formulate stronger plans on cutting carbon next year.It is envisaged that political pressure - within the talks process, in behind-the-scenes meetings in world capitals, and from increasingly concerned civil society - will prompt governments to recommit to the 2015 Paris Agreement through updated national plans.Brazil, Australia and Saudi Arabia repeatedly sought to retain loopholes in the use of carbon credits - a system supposedly designed to help reduce CO2 emissions. Other big emitters such as China and India insisted on delivery of financial supports promised by rich countries before next year as a precondition to any discussion on enhancing their targets. 'Urgency' COP25She called on countries to ""strengthen political will"" and to accelerate climate action at the pace that the world needs. ""The new generations are waiting for more from us, we have the obligation of being up to this task."" Countries were ""so very close"" to achieving an agreement on carbon markets, Ms Schmidt said, expressing her disappointment the issue would have to be addressed again at COP26 in Glasgow in 2020. Push-back from rich countries on commitments to provide long-term finance to the most vulnerable further crystallised the tension between the needs of developing countries to scale-up efforts and the rebuke of a few major economies. Environmental NGOs said world leaders at COP25 had failed to step up action as global temperatures and emissions continued to rise. ""The window of opportunity to achieve the 1.5-degree objective of the Paris Agreement is closing rapidly,"" said Wendel Trio, director of Climate Action Network Europe.\l"
"COP25","Ireland","COP25_Ireland14","Declaration would seek to safeguard right to healthy environment","December 10, 2019 Tuesday","The Irish Times","An international declaration which, if adopted, would legally recognise the right of children to a healthy environment has been unveiled at the COP25 climate change gathering in Madrid. The Intergovernmental Declaration on Children, Youth and Climate Change is ""a historic step towards accelerating inclusive, child-responsive climate policies"", according to Unicef, its main proposer.The declaration will require climate policies that ""protect, respect and fulfil the rights of society's most vulnerable, and enhance the participation of young people in decisions that affect them"", said Paloma Escudero, Unicef global director of communication.Nine countries have signed the declaration, with many more expected to do so by the conclusion of COP25The declaration received support from Mary Robinson, former Irish president and UN commissioner for human rights. The State is understood to be considering whether to endorse it. Mrs Robinson said the climate crisis was a children's rights issue yet the majority of commitments to address global warming set out by member states ""do not mention children or young people"". She told an event highlighting young people's role in responding to the impact of climate change that when she was growing up she did not have the shadow of an uncertain future that is over children today.Mrs Robinson hosted an intergenerational dialogue between five young climate activists and five ministers from Chile, Costa Rica, Fiji, Spain and Nigeria. She said such conversations needed to happen in every country as the world moved away from fossil fuels and became a safer, healthier place to live.At the launch of the declaration, member states were urged to include measures to enhance youth participation in decision-making in their national climate plans. The case for the declaration on behalf of young people was made by 17-year-old climate activist Theo Cullen-Mouze from Clare Island in Co Mayo, who said he was already experiencing climate shocks in the form of wilder winter storms and longer summer droughts. Climate striker He outl"
"COP25","Ireland","COP25_Ireland15","Little to show as UN climate summit limps to end","December 15, 2019 Sunday 7:50 PM GMT","RTE News","A marathon UN summit has wrapped up with little to show, squeezing hard-earned compromises from countries over a global warming battle plan that fell well short of what science says is needed to tackle the climate crisis.The COP25""Today the citizens of the world are asking for us to move ahead faster and better, in financing, adaptation, mitigation,"" Carolina Schmidt, Chilean environment minister and President of COP25, told the closing plenary. Following a year of deadly extreme weather and weekly strikes by millions of young people demanding action, negotiations in Madrid were under pressure to send a clear signal that governments were willing to double down.""Based on the adopted text, there is a glimmer of hope that the heart of the Paris Agreement is still beating,"" said Mohamed Adow, Director of Power Shift, referring the treaty inked in the French capital. ""But its pulse is very weak.""Negotiators from nearly 200 nations came to Spain's capital with the aim of finalising the rulebook for the 2015 agreement, which enjoins nations to limit global temperature to below two degrees Celsius.\l"
