"COP","country","ID","title","date","source","text"
"COP22","Canada","COP22_Canada29","Deputy Secretary of State Blinken: US-Moroccan Partnership is Key","July 21, 2016 Thursday","Marketwire (Canada)","WASHINGTON, DC--(Marketwired - July 21, 2016) - US Deputy Secretary of State Antony Blinken was in Morocco Wednesday and Thursday to meet with government officials as well as university students, entrepreneurs, and NGOs to discuss the fight against violent extremism and the 22nd Conference of the Parties to the UN Framework Convention on Climate Change (COP 22), which is scheduled to take place in Marrakesh in November.""The US-Moroccan partnership is key, not only to address common challenges, including security and climate, but also to benefit from available opportunities,"" said Mr. Blinken at a joint press briefing on Wednesday with Morocco's Minister of Foreign Affairs and Cooperation Salaheddine Mezouar.""We greatly appreciate the leadership of the Kingdom, host country of the 22nd Conference of Parties to the UN Framework Convention on Climate Change, on a large number of issues related to environment and climate,"" he noted.Minister Mezouar stressed that ""the US commitment to the climate issue is crucial to accelerating the implementation of the Paris Agreement, the fight against climate change, capacity building, mobilization of funding and technology transfer.""On security, the two officials reviewed ""several issues of common interest, particularly the threat of Daesh, the issue of terrorism, religious leadership and the importance of promoting the value of tolerance advocated by Islam,"" according to Moroccan press reports. Minister Mezouar ""noted a convergence of views in relation to the Middle East and Libya,"" and that the fight against Daesh in Libya, Iraq and Syria ""is beginning to bear fruit."" Mr. Blinken praised the role played by Morocco in the fight against extremism and terrorism, which includes participating in the US's anti-ISIS coalition, co-chairing with the Netherlands the Global Counterterrorism Forum, and an oft-lauded strategy of promoting religious tolerance and moderation throughout the region.In addition to his meetings with government officials, Mr. Blinken also met with international relations and political science students from the International University of Rabat as well as with green entrepreneurs and innovators. Tweeting on these encounters, Mr. Blinken said he was ""inspired> by [meetings] today highlighting Morocco's bright future"" and ""bowled over> by eco-entrepreneurs,"" whose ""Innovative ideas/solutions [are especially] critical ahead of #OurOcean & @COP22 this fall.""Mr. Blinken will next travel to Tunisia and Algeria.The Moroccan Amercan Center for Polcy (MACP) is a non-profit organization whose principal mission is to inform opinion makers, government officials, and interested publics in the United States about political and social developments in Morocco and the role being played by the Kingdom of Morocco in broader strategic developments in North Africa, the Mediterranean, and the Middle East.Ths materal s dstrbuted by the Moroccan Amercan Center for Polcy on behalf of the Government of Morocco. Addtonal nformaton s avalable at the Department of Justce n Washngton, DC.Image Available: http://www.marketwire.com/library/MwGo/2016/7/21/11G107576/Images/mezouar_and_blinken-b15290265b2994368239895a8ecbad14.jpghttp://www.marketwire.com/library/MwGo/2016/7/21/11G107576/Images/mezouar_and_blinken-b15290265b2994368239895a8ecbad14.jpgJordana Merran 202.470.2049\l"
"COP22","Canada","COP22_Canada30","UN offers The Rebel press accreditation for climate conference after environment minister's intervention","October 31, 2016 Monday","Postmedia Breaking News","The United Nations has bowed to pressure from Environment Minister Catherine McKenna and three Canadian journalist advocacy groups, offering The Rebel - the right-wing news and opinion platform published by political commentator Ezra Levant - media accreditation at next week's Conference of the Parties (COP 22) in Morocco.Earlier this month, the UNFCCC rejected an application by The Rebel to send three journalists to cover the conference, which takes place from November 7 to 18, on the grounds that ""advocacy media outlets do not qualify for accreditation.""In an e-mail sent Monday, a representative of the United Nations Framework Convention on Climate Change (UNFCCC) secretariat informed the media outlet that it could offer two slots to cover COP22.The UNFCC explicitly cited letters it received from Environment Canada, Canadian Journalists for Free Expression (CFJE), PEN Canada and the Canadian Association of Journalists (CAJ) as motivation for the reversal of its decision.RelatedOttawa willing to intervene on behalf of The Rebel after journalists banned from UN climate conference( http://business.financialpost.com/news/ottawa-willing-to-intervene-on-behalf-of-the-rebel-after-journalists-banned-from-un-climate-conferencehttp://business.financialpost.com/news/ottawa-willing-to-intervene-on-behalf-of-the-rebel-after-journalists-banned-from-un-climate-conference )Ezra Levant seeks Trudeau's intervention after UN bars The Rebel from climate conference( HYPERLINK http://business.financialpost.com/news/united-nations-bars-ezra-levants-the-rebel-from-climate-conferencehttp://business.financialpost.com/news/united-nations-bars-ezra-levants-the-rebel-from-climate-conference )CJFE, PEN and CAJ raised concerns with the UNFCC, arguing it used the term ""advocacy"" - which was not mentioned anywhere in the media accreditation application - in a broad and arbitrary manner which was potentially harmful to speech and press freedoms.""Opinion pages, special reports, indeed advocacy journalism appears in many of the world's great news sources, including The Guardian and The New York Times,"" wrote Grace Westcott, executive director of PEN Canada, in an Oct. 5 letter to the UNFCCC.Environment Minister McKenna first expressed her willingness to intervene last week, after the accreditation ban became a media controversy earlier this month.Levant suggested that the The Rebel - which publishes coverage of environment issues that often exhibits or promotes climate change skepticism - had been rejected by the UNFCCC because of its specific editorial outlook, not because it was an advocacy outlet. ""We're not being excluded because we have an opinion,"" he said in interview. ""We're being excluded because we have the wrong opinion.""But despite the UNFCC's willingness to grant The Rebel two spots at the conference, the organization is demanding it be granted the three spots it initially applied for.""In order to do its job, Rebel Media requires a reporter, a cameraman and a producer,"" reads a Monday letter to the UNFCCC from lawyer Stuart M. Robertson, acting on behalf of the company. ""Any lateness in making this decision is entirely caused by delays you underwent in the process... It is false to say this matter has just been brought to your attention and that it is too late to accept all those who applied for accreditation. The decisions to deny accreditation were made on the false premise that Rebel Media is an £dvocacy media outlet.'"" !@COPYRIGHT=\£9 2016 Postmedia Network Inc. All rights reserved.\l"
"COP22","Canada","COP22_Canada31","Alberta updates world on Climate Leadership Plan","November 9, 2016 Wednesday","Canadian Government News","Edmonton: The Government of Alberta has issued the following news release: Minister Phillips, joined by Blood Tribe Chief Charles Weaselhead, will represent Alberta at the Conference of the Parties () United Nations Framework on Climate Change Nov.10-17.  Alberta\' s participation at COP22 shows the world what is possible from an energy-producing jurisdiction. Our Climate Leadership Plan protects the environment and Albertans\' health while also diversifying the economy and creating jobs. We look forward to showcasing our progress on an international stage and continuing to share with, and learn from, others. Shannon Phillips, Minister Responsible for the Climate Change Office  We have a responsibility to stay informed about climate change and to work collectively to safeguard and protect the environment for the generations to come and for the well-being of the Earth. Chief Charles Weaselhead, Blood Tribe The team will showcase the steps the province has taken to carry out the Climate Leadership Plan, share perspectives with representatives from governments and businesses, create international partners in innovation, technology and program implementation, and show that Alberta can be both an energy producer and a world leader on climate action. Alberta has recently begun a process of engagement with First Nations and Metis organizations on the joint development of Indigenous Climate Leadership initiatives. The estimated international mission cost for Minister Phillips, Chief Weaselhead, one political staff and two department staff is approximately $32,000. In case of any query regarding this article or other content needs please contact: HYPERLINK mailto:editorial@plusmediasolutions.comeditorial@plusmediasolutions.com\l"
"COP22","Canada","COP22_Canada32","Ottawa willing to intervene on behalf of The Rebel after journalists banned from UN climate conference","October 26, 2016 Wednesday","National Post's Financial Post & FP Investing (Canada)","Environment Minister Catherine McKenna says she is willing to intervene after a United Nations department rejected an application for media accreditation from a Canadian news company on the grounds that it is an ""advocacy media outlet.""The Rebel, the right-wing news and opinion platform published by political commentator Ezra Levant, received the rejection notice earlier this month from the United Nations Framework Convention on Climate Change (UNFCCC) secretariat after it applied to send three journalists to cover next month's Conference of the Parties (COP 22) in Morocco.A spokesperson for McKenna told the Financial Post that the minister supports freedom of speech, and that she is happy to intervene on behalf of any media outlets accredited by the parliamentary press gallery.COP22 takes place November 7 to 18.On Tuesday, lawyers acting on behalf of the Rebel sent a letter to McKenna, Foreign Minister St\'e9phane Dion and Prime Minister Justin Trudeau requesting the government provide assistance so that it ""can gain access to the UNFCCC in the same manner as other accredited media.""Included with that letter were copies of messages to the UNFCC from three of the country's leading journalism advocacy groups, all in support of The Rebel. PEN Canada, Canadian Journalists for Free Expression and the Canadian Association of Journalists previously raised concerns with the UNFCC, arguing its application of the term ""advocacy"" - which was not mentioned anywhere in the media accreditation process - was broad, arbitrary and potentially harmful to speech and press freedoms.""Opinion pages, special reports, indeed advocacy journalism appears in many of the world's great news sources, including The Guardian and The New York Times,"" wrote Grace Westcott, executive director of PEN Canada, in an Oct. 5 letter to the UNFCCC.Levant believes The Rebel was rejected not because it could be perceived as advocacy media - much of its coverage of environment issues exhibits climate change skepticism - but because of its editorial stance. ""We're not being excluded because we have an opinion,"" said Levant in an interview. ""We're being excluded because we have the wrong opinion.""Last week, the UN's Nick Nuttal told CBC Radio's As It Happens that the decision to decl"
"COP22","Canada","COP22_Canada33","Party in paris!; Politicians racked up whopping $1M bill","August 24, 2016 Wednesday","24 Hours Toronto","The federal Liberals apparently need a lot of green to be green.Documents obtained by Postmedia Network show the government's massive delegation to last fall's global climate change conference in Paris racked up a bill just shy of $1 million.That included about $130,000 on food alone for the 155 members, each of whom spent anywhere from a few days to a two weeks in Paris at the United Nations that ran from Nov. 30 to Dec. 12.One government delegate alone racked up $4,600 for meals. That's about $330 a day - just for food.It's unknown if the big eater was even a politician - identified in documents only as ""Delegate 13.""Environment Minister Catherine McKenna spent more than $6,000 for a French freelance photographer to follow her around and take pictures.McKenna, in Ottawa Tuesday, defended the use of the photographer and said previous governments had done the same thing. Nonetheless, she said she asked her department's officials to review the practice.""Pictures are an important part of how we transmit our message, but we need to do it in a way that is mindful of taxpayers,"" McKenna told reporters. ""Previous governments used photographers as well but we can do better, and that's something I'm committed to personally. I think there are ways that we can reduce costs.""A briefing note prepared earlier for Foreign Affairs Minister Stephane Dion, however, was far less apologetic about the total $1-million bill.""This government will not apologize for its position on climate change. COP21 (the climate conference) was a critical demonstration of Canada's collaborative commitment to strengthening its leadership globally in addressing climate change,"" Dion is advised to say by the bureaucrats who prepared the briefing note, obtained by Postmedia through a federal Access to Information request. ""The size of the Canadian delegation points to the priority placed on the issue of climate change.""The conference produced the Paris Agreement, in which countries agreed to keep the change in global temperature below 1.5 C, though has been roundly criticized for coming away little planned action to make it happen.This is the intermediate tally prepared by Global Affairs Canada as of late January. It warned that more invoices might push some of those figures higher.\l"
"COP22","Canada","COP22_Canada34","Cap and trade gains global momentum ahead of COP 22 climate conference","September 26, 2016 Monday 9:00 AM GMT","CBC News","There's a global momentum for carbon pricing, says the European Commission, with the number of schemes more than tripling since 2012 and with China, Ontario and Mexico set to launch their cap-and-trade systems in upcoming months. But more than a decade of emissions trading in Europe paints a complex, problem-ridden picture of politics and market failure.The European Union's 11-year-old emissions trading system (ETS), the world's first and largest international cap-and-trade scheme, has served as an exemplary tale of both successes and failures for all new systems, including the one in China set to launch in early 2017.""The EU and China have been working together and sharing experience on market measures for the past five years,"" says Anna-Kaisa Itkonen, a spokeswoman for the European Commission. ""China is keen \'e2\€ \£6 to learn from what the EU has got right and wrong.""Learning from EuropeCap and trade, also known as emissions trading, incentivizes reductions by making businesses pay for their emissions \'e2\€  the more they emit, the more they pay. The ""cap,"" lowered periodically, places a maximum limit on all emissions, and pollution allowances that allow businesses to emit various amounts are then ""traded"" on the carbon market.Experts say the EU's ETS suffers from unambitious reduction targets, an over-allocation of pollution allowances, low carbon prices and a lack of political will to substantially amend the system despite ongoing revisions following COP 21.The power and industry sectors are supposed to decarbonize by 2040 to keep the global temperature rise below 1.5 C, or by 2050 to keep it below 2 C, but at the current rate that won't happen until 2058, according to Femke de Jong, of Brussels-based Carbon Market Watch.""That's too late,"" says de Jong. ""These are symptoms of the failings of the ETS. The revisions aren't enough. It's a very clear sign that the way emissions trading is working now, it's not bringing emissions reductions.""Carbon prices, currently between four to five euros per ton, are supposed to be around 30-40 euros per ton to really incentivize a low-carbon transition, according to de Jong and University College London professor Michael Grubb.""The caps we set were a hell of a lot easier to meet than we thought,"" says Grubb, who teaches international energy and climate change policy. ""As a result, it cost very little to meet them, so those who'd been hoping this carbon price would be a significant driver of change and a good guide to low-carbon investment \'e2\€  it didn't work.""Last year, the EU met its 2020 emissions targets, but many experts including Grubb and de Jong say other policies have likely helped cut emissions, meaning the ETS has not been the ""cornerstone"" of European climate policy, as termed by the Commission \'e2\€  but could still be.""It's been a steep learning curve, and Europe has been making huge strides,"" says Misato Sato, assistant professorial research fellow at the London School of Economics. ""In terms of capping emissions, it's been a success, and the EU's 'learning by doing' approach means it's a work-in-progress that has allowed other countries to improve their own systems.""As a market-based approach, cap and trade is seen as easier and cheaper to implement than carbon tax \'e2\€  imposed on the carbon content of fuels such as coal, petroleum and natural gas \'e2\€  which has been politically controversial in the EU as well as in Canada.Meanwhile command-and-control, which typically makes emitters take specific actions or install specific technologies to reduce emissions, has been seen as too rigid.Jeff Swartz, director at the International Emissions Trading Association, says more than 38 million tons of greenhouse gases are permanently removed annually thanks to the EU's ETS, and that politics is to blame for failures rather than the cap-and-trade approach to climate policy.""Emissions trading is not a bad concept, it's not flawed, it's just a reflection of how much political ambition our leaders are putting on the table,"" says Swartz. ""The more they put on, the stronger the policy will be. The system has the real potential to be the future driver of emissions reductions, not just in Europe but internationally.'Emissions trading internationallyCOP 21 saw emissions trading put back on the global agenda after being discredited due to the ETS's failures and the collapse of COP 15 negotiations in Copenhagen, according to Grubb.The Paris climate change conference emphasized market-based approaches to emissions reductions, which includes cap and trade, says the European Policy Centre's senior policy analyst Annika Hedberg. ""Article 6 in the agreement gave more of a push and bigger momentum for market-based mechanisms,"" Hedberg says. ""It was a step forward in co-ordinating emissions-trading systems worldwide, and this is a good time to look into and try to further develop these systems.""The world's largest polluter, China, which ratified the Paris climate accord alongside the United States last month, is expected to launch its national cap-and-trade system in early 2017 with a three-year first phase.The Chinese ETS is expected to cover about 70 per cent of emissions, compared to the EU's 45 per cent, but will include similar businesses to those covered in Europe, such as electricity generation and heavy industry. Future of cap and tradeOntario's cap-and-trade scheme came into effect on July 1, 2016, with the first compliance period beginning on January 1, 2017.The province plans to link with Quebec and California in 2018.Gary Wheeler, a spokesman for the Ontario's Ministry of the Environment and Climate Change, says the province studied the European carbon market closely before finalizing its ETS rules.""We learned from the EU and incorporated additional measures to address price volatility, including the establishment of a minimum price for allowances sold at auction and the establishment of an allowance reserve to provide additional allowances to capped emitters if needed during periods of high demand for allowances.""Turkey, Ukraine and Washington state are also currently designing cap-and-trade schemes, among many other regions and cities around the world. The COP 22 conference in Marrakesh, Morocco, in November will build on the commitments made in the Paris agreement.""We're entering a new phase in carbon pricing and emissions trading,"" says Grubb.\l"
"COP22","Canada","COP22_Canada35","In Brief","November 16, 2016 Wednesday","The Hamilton Spectator (Ontario, Canada)","CalgaryTurkish-Canadian heldThe wife of a Calgary imam jailed in Turkey says he is being held in solitary confinement and she's worried about his well-being. Davud Hanci, who has Canadian and Turkish citizenship, was arrested in July shortly after a failed coup attempt. Rumeysa Hanci says she has not been able to speak to her husband in more than three months and says it's been like torture for her and their two young sons. She adds Canadian government officials have not had access to him and he has only been able to see his lawyer twice.WINNIPEGRemote reserve in crisis, needs PM's help: chiefMARRAKECH, MoroccoBattle to fight climate change 'irresistible'United Nations in Morocco, Catherine McKenna tried to minimize the effects of the United States election result on the international fight against global warming.OTTAWASpray-painted swastika, slur shock rabbiAn Ottawa rabbi says she was shocked to find a red swastika and anti-Semitic slur spray-painted on her front door in the dead of night. Anna Maranta, who runs a Jewish faith centre from her home, says she has never experienced anything like the vandalism that left her shaken. Maranta reported the incident to the Ottawa police hate crimes unit, which sent an officer to investigate Tuesday. Ottawa Liberal MP David McGuinty condemned the attack in the House of Commons.HALIFAXMan who beat wife, her daughter gets life termNews services\l"
"COP22","Canada","COP22_Canada36","Peel residents invited to Mississauga town hall on national climate change strategy","July 24, 2016 Sunday","The Mississauga News","The temperature next Tuesday is forecast to dip just below 30C for the first time in days, but it's still perfect weather for Peel residents to get out to a town hall on climate change.The federal government is conducting public consultations to gather citizen input for a national strategy.Mississauga MPs Omar Alghabra, Sven Spengemann, Peter Fonseca, Navdeep Bains, Gagan Sikand and Iqra Khalid have organized the town hall to raise awareness about the issues and get local residents to help formulate the country's plan to address climate change.The event is scheduled for July 26 at 6:30 p.m. on Sheridan College's Hazel McCallion Campus, 4180 Duke of York Blvd., room A145.Matt Hunter is a local spokesperson with People's Climate Plan, a national organization encouraging Canadians to take an active role in consultations and shaping the national strategy.The 36-year-old father of three daughters under the age of seven has a personal stake in this plan to address global warming.""I'm concerned about the future for my daughters,"" he said.""It's really important for everyone to come out and tell their own unique stories because in every community the local impacts of climate change are going to be different,"" Hunter said.The organization wants to see a strategy based on science, a move to 100 per cent renewable economy and justice for indigenous peoples and workers who would have to transition to a new clean economy.Prime Minister Justin Trudeau and his Liberal government have made a concrete commitment to map out an action plan to combat climate change, put carbon pricing policies in place, and lower greenhouse gas emissions.The Liberals have pledged to work with provincial and global partners to move towards clean economic growth and transition the country and world to a low carbon economy.That transition would be bolstered by government investment in public transit, green infrastructure and clean technologies to create new jobs, the Liberals have promised.""The world gathered in Paris to fight climate change and its devastating impacts on our earth, our health, our economy, and our very way of life,"" Trudeau said in a statement after last year's United Nations in Paris. ""We also gathered with a common vision to leave a sustainable planet for our children and grand children.""Canada and 194 other countries agreed to a long-term goal of keeping the increase in global average temperature to ""well below"" 2 C and aim to limit the increase to 1.5 C.\l"
