"COP","country","ID","title","date","source","text"
"COP23","South.Africa","COP23_South.Africa30","Developing world says rich nations shirking on climate pledges","November 13, 2017 Monday","Bizcommunity.com (South Africa: Other industries)","The failure of wealthy nations to deliver on short-term climate commitments could hinder the rollout of a landmark treaty...""If we do not respect decisions that we have made, then how can we build trust among the parties?"" said Chen Zhihua, China's senior negotiator, referring to long-standing pledges by rich nations to enhance financial support and ""revisit"" targets for curbing greenhouse gas emissions before 2020.""And how can we lay a good foundation for the implementation of the Paris Agreement?"" he added at a press conference Thursday, 9 November, flanked by diplomats from India, Iran, Nicaragua and Ecuador.The treaty, inked outside the French capital in 2015, calls on the world to cap global warming at ""well below"" 2\'b0C, and even 1.5\'b0C if possible.With one degree of warming so far, the planet has already seen an increase in drought, deadly heatwaves and superstorms engorged by rising seas.The pact rests on voluntary carbon-cutting pledges from virtually every country in the world.But those pledges are not enough to keep Earth in the safe zone, and would still see global temperatures rise a devastating 3\'b0C by century's end.Moreover, they don't kick in until 2020, and developing nations say that's too long to wait to ramp up action.""The science is clear: if we don't get our act together before 2020, you can forget about the 2\'b0C and 1.5\'b0C targets,"" said Paul Oquist, Nicaragua's chief negotiator at the talks.""There has been a failure to comply with existing commitments,"" he added.Under the terms of the UN's core climate convention, the burden for action before 2020 falls mainly on wealthy countries historically responsible for the rapid rise of greenhouse gases.China is the world's top carbon polluter, followed by the United States, the European Union, India and Russia.Developing countries sought to have a ""pre-2020 agenda"" formally added to the negotiating process, but the move was shelved at the start of the 12-day talks. Efforts to resolve the issue have so far been fruitless.""It would be a bad thing if this hangs over into the second week and becomes a political issue for ministers,"" said Alden Meyer, director of strategy and policy for the Union of Concerned Scientists in Washington DC.""It has been a pretty sterile debate that has degenerated into a finger-pointing exercise,"" he told AFP.Some 20 heads of state, including French President Emmanuel Macron and German Chancellor Angela Merkel, are scheduled to appear at the UN climate forum next week.The European Union, Australia and the United States - which continues to participate in the talks despite President Donald Trump's decision to pull out of the Paris pact - have balked at training a spotlight on the issue, but are looking for a middle ground.""There is no disagreement about the pre-2020 urgency,"" Elina Bardram, head of the EU's delegation for COP23, told AFP.""But we must find solutions that ... do not compromise progress on the agreed negotiations programme"" for the Paris Agreement.For Teresa Ribera, director of the Institute for Sustainable Development and International Relations in Paris, the stand-off also reflects the negotiating process.""It is in part tactical positioning to deflect mounting pressure"" on some emerging economies - China and India, in particular - to deepen their own carbon-cutting pledges, she said.Both countries are projected to easily meet their Paris targets. But the poor nation-rich nation split that bedevilled these talks for many years has not entirely disappeared.""This is creating a trust deficit,"" said Mohamed Adow, international climate lead for Christian Aid. ""How can developing countries trust these very same countries that haven't taken seriously their previous commitments?""Source: AFP\l"
"COP23","South.Africa","COP23_South.Africa31","UN climate talks resume with wary eyes on Trump","November 7, 2017 Tuesday","Bizcommunity.com (South Africa: Other industries)","Nations that adopted the Paris Agreement with champagne two years ago regroup this week amid grim omens of climate peril and with an anxious eye on Donald Trump's America...The November 6-17 meeting in Bonn, Germany, is the first for UN climate envoys since the US president announced he will extricate Washington from the deal, carefully crafted over many years and helped over the finish l"
"COP23","South.Africa","COP23_South.Africa32","Washington seeks out like minds on climate change","November 17, 2017","Mail & Guardian","Washington has spent the week seeking out like minds at a climate-change conference that ended last night in Germany.COP 23 - the 23rd United Nations ""conference of parties"" to the Paris Accord on global warming - took place in Bonn, one-time capital of Germany, with close on 20 000 delegates from governments along with NGOs and journalists.US chief representative at the meeting, David Banks, who serves as an advisor on energy to the White House said there was no going back on his country pulling out of the deal on climate change.""President Trump still intends to withdraw from the Paris agreement, but in good faith we will continue to work with parties to the accord,"" he said. ""There are 1 600 new coal plants being built around the world, and demand for coal and gas is growing. It's in the global interest that, if these fuels are going to be used anyway, it must be done as cleanly as possible.""America, he said, wanted to remain a ""global player"" on energy, citing plans for a ""clean coal alliance"" that would share the best technology to lower emissions.The US delegation named Australia, India and Japan as possible ""partner countries"" along with Tanzania, Nigeria, South Africa, Bangladesh and the Philippines.""Keeping gas and coal in the ground robs poor countries of their natural wealth,"" Mr Banks said. ""And universal access to affordable energy is the way to lift people out of poverty,"" he said.He said migration and young people drifting into militia groups were largely a product of joblessness in Africa, ""and having no electricity and therefore no industry is far more of a problem in people's lives right now than climate change.""He said more than 1.2 billion people around the world lived without power, half of them in Africa and an estimated 300 million across India.""The United States would like to see the World Bank policy on coal changed,"" he said. The bank will not lend for projects that generate electricity from coal, a ban criticised by Nigeria, India and South Africa.A spokesperson for Eskom at COP 23 said South Africa would ""be using fossil fuels for a very long time to come.""A rival US group that called itself ""We're Sill In"" held a reception for delegates, opposing Mr Trump's stand on global warming and on leaving the Paris Accord.And most of the other exhibits, set across halls, tents and walkways along the banks of the Rhine River that flows through Bonn, dealt with wind and solar power.Anti-coal protestors disrupted the only public event staged by the US, singing songs and drowning out speakers.Discussions between countries took place in closed session, and while negotiators -- including the USA and South Africa -- were happy to provide background to journalists, they had collectively agreed not to speak on the record.A member of the Indian team said the meeting reminded him of the Organization of Petroleum Exporting Countries or OPEC.""The oil sellers come together every now and then and agree how much they will produce to keep (the oil price) stable, then they cheat on each other. This might be the same protocol. Nations talk here about greenhouse (gas) and cutting emission and they pledge this and that but I wonder how many will stick to it.""In the South African delegation, deputy energy minister Thembisile Majola - a qualified engineer - said it was ""important to get past the sounds bites when it comes to issues like fracking or fossil fuel. I think you need to get on the ground and speak with communities,"" she said.David Banks said the White House was ""still formulating its global energy policy,"" but that Washington was determined to ""remain engaged with other coal-dependent economies.""\l"
"COP23","South.Africa","COP23_South.Africa33","Zuma expresses SA commitment to co-operate in tackling climate change","September 21, 2017 Thursday","Cape Times (South Africa)","President Jacob Zuma attended the Meeting of the Committee of African Heads of State and Government on Climate Change at the UN headquarters in New York on Monday.""Climate change is a global challenge that requires no one to be left behind,"" said Zuma at the conclusion of the session.""The whole world affirmed this in Paris and Marrakech when the Paris Agreement entered into force on November 4 last year.""He urged the Africa Group to work together to ensure that the implementation of the Paris Agreement was a success.""In this regard,"" he said, ""negotiations on the Paris rule-book must remain on track and ensure that there is sufficient clarity on the parties' commitments under their Nationally Determined Contributions (NDCs) on mitigation, adaptation and means of implementation.""Developing countries should be provided with adequate support for their mitigation, and adaptation actions and progress should be made on a post-2020 finance goal that should be more significant than the 2020 goal of $100 billion (R1.3trillion) per year in climate finance,"" the president said, adding: ""The efforts of developing countries to adapt to climate change with their own resources should also be recognised as a contribution to the global effort to address climate change.""Speaking about the Bonn Climate Change Conference in Germany, Zuma said: ""We should make progress on the Global Stocktake at the upcoming Bonn Climate Change Conference.""The Global Stocktake, which has the objective of tracking commitments and progress in implementation, must inform parties' future Nationally Determined Contributions. It should, therefore, take account of all the elements of climate action, namely mitigation, adaptation and the means of implementation.""He said it was important for the Africa Group, particularly in the time of global uncertainty, to emphasise adherence to the principles of the convention, in particular the common but differentiated responsibility and respective capabilities, equity and the need for developed countries to take the lead in combating climate change.Those principles, he said, remained applicable to the Paris Agreement.""The Africa Group should not allow any renegotiation of the Paris Agreement. It was a landmark achievement of the international community. It presents us with the best vehicle to address climate change, which is a monumental challenge of our time, in a manner that is fair and that takes into account countries' national circumstances.""Zuma said climate change posed a threat and an opportunity to development.""The pursuit of a low-carbon and climate resilient development opens up opportunities for not only achieving our development goals, but also achieving the Sustainable Development Goals and the goals set out in Agenda 2063.""We need to ensure that Africa's key sectors are prioritised in the Implementation of Nationally Determined Contributions (NDCs). We are confident that international solidarity will prevail at the UNFCCC (UN Framework Convention on Climate Change) COP23. We should also ensure that the implementation of the NDCs also enhances efforts towards poverty alleviation.""Zuma said infrastructure investment was key to development, and the Programme for Infrastructure Development in Africa, provided a blueprint for such collaboration. The Africa Group needed to explore the appropriate blend of public, multilateral and private finance to accelerate investment.Renewable energy investment, as part of an energy mix, provided an investment opportunity in Africa's electricity sector.""The African Renewable Energy Initiative and the Africa Adaptation Initiative should focus on identified synergies and funding opportunities, while encouraging best-practice sharing, peer learning and tapping into technical skills available on the continent.""We should also focus on building partnerships with the aim of building capacity low-carbon planning and improving the relevant institutions in the energy, transport and the water sectors.""We should also exploit opportunities in solar and wind power as well as gas, hydro, biofuels as alternatives energy sources.""Zuma said Africa's continental strategies should be based on long-term adaptation scenarios to inform optimal use of the continent's natural resources in development.There were two keys to mobilising the means of implementation as enshrined in the UNFCCC and its associated mechanisms, and further anchored in the Paris Agreement.""First, it is the development of the necessary capacity to plan effectively for mitigation and adaptation policies and programmes, and to monitor their implementation.""Second is to develop the capacity within Africa to access the resources within these mechanisms.""Zuma expressed his hope that working together as the Africa Group, the African Heads of State and Government on Climate Change could move a step forward in addressing the massive challenge of our time.l Ngqulunga is head of the private office of the president and spokesperson.Dr Bongani Ngqulunga\l"
"COP23","South.Africa","COP23_South.Africa34","President Jacob Zuma attends African Heads of State and Government Meeting on Climate Change in New York","September 19, 2017 Tuesday","South African Official News","President Zuma attends African Heads of State and Government Meeting on Climate Change in New YorkPresident Jacob Zuma has today, 18 September 2017, attended the Meeting of the Committee of African Heads of State and Government on Climate Change (CAHOSCC) at the United Nations (UN) Headquarters in New York, United States of America.""Climate change is a global challenge that requires no one to be left behind. The whole world affirmed this in Paris and Marrakech when the Paris Agreement entered into force on the 4th November last year,"" said President Zuma at the conclusion of the session.President Zuma has urged the Africa Group to work closely together to ensure that implementation of the Paris Agreement was a success.""In this regard,"" he said, ""negotiations on the Paris rule-book must remain on track and ensure that there is sufficient clarity on Parties' commitments under their Nationally Determined Contributions (NDCs) on mitigation, adaptation and means of implementation.""""Developing countries should be provided with adequate support for their mitigation and adaptation actions and progress should be made on a post-2020 finance goal that should be significant more than the 2020 goal 100 billion US dollars per year in climate finance,"" the President said, adding that ""the efforts of developing countries to adapt to climate change with their own resources should also be recognised as a contribution to the global effort to address climate change.""Speaking about the Bonn Climate Change Conference in Germany, President Zuma said: ""We should make progress on the Global Stocktake at the upcoming Bonn Climate Change Conference. The Global Stocktake, which has the objective of tracking commitments and progress in implementation, must inform Parties' future Nationally Determined Contributions (NDCs). It should, therefore, take account of all the elements of climate action, namely mitigation, adaptation and the means of implementation.""The President said it was important for the Africa Group, particularly in the time of global uncertainty, to emphasise adherence to the principles of the Convention, in particular the common but differentiated responsibility and respective capabilities, equity and the need for developed countries to take the lead in combatting climate change. Those principles, he said, remained applicable to the Paris Agreement.""The Africa Group should not allow any renegotiation of the Paris Agreement. It was a landmark achievement of the international community. It presents us with the best vehicle to address climate change, which is a monumental challenge of our time, in a manner that is fair and that takes into account countries' national circumstances,""President Zuma said climate change posed both a threat and an opportunity to development. ""The pursuit of a low-carbon and climate resilient development opens up opportunities for not only achieving our development goals, but also achieving the Sustainable Development Goals (SDGs), and the goals set out in Agenda 2063.""The President said ""We need to ensure that Africa's key sectors are prioritized in the Implementation of Nationally Determined Contributions (NDCs). We are confident that international solidarity will prevail at the UNFCCC COP23. We should also ensure that the implementation of the NDCs also enhances efforts towards poverty alleviation.""President Zuma said that Infrastructure investment was key to development, and the Programme for Infrastructure Development in Africa (PIDA), provided a blue print for such collaboration. The Africa Group needed to explore the appropriate blend of public, multilateral and private finance to accelerate investment.The President said that Renewable energy investment as part of an energy mix provided an investment opportunity in Africa's electricity sector.""The African Renewable Energy Initiative and the Africa Adaptation Initiative should focus on identified synergies and funding opportunities, while encouraging best practise sharing, peer learning and tapping into technical skills available in the Continent,"" he said.""We should also focus on building partnerships with the aim of building capacity low-carbon planning and improving the relevant institutions in the energy, transport and the water sectors. We should also exploit opportunities in solar and wind power as well as gas, hydro, biofuels as alternatives energy sources,"" the President emphasized.President Zuma also pointed out that Africa's continental strategies should be based on long term adaptation scenarios to inform optimal use of Africa's natural resources in development and that there were two keys to mobilising the means of implementation as enshrined in the UNFCCC and its associated mechanisms, and further anchored in the Paris Agreement:""First, it is the development of the necessary capacity to plan effectively for mitigation and adaptation policies and programmes, and to monitor their implementation. Second is to develop the capacity within Africa to access the resources within these mechanisms,"" said the President.President Zuma expressed his hope that working together as the Africa Group, the African Heads of State and Government on Climate Change could move a step forward in addressing the massive challenge of our time.Enquiries:Dr Bongani NgqulungaCell: 082 308 9373E-mail: bongani@presidency.ov.za\l"
"COP23","South.Africa","COP23_South.Africa35","Time to act on climate change","June 26, 2017 Monday","Pretoria News (South Africa)","With the\'c2\~Paris Agreement, the world\'c2\~decided to take responsibility for its present and future by committing to preserve the very source of life: our planet and its environment.The climate change deal is an unprecedented multilateral partnership between nearly 200 countries, supported by companies and communities across the world, to address a problem facing all of us. It's a challenge we can only tackle together and, since the beginning, Europe has been at the forefront of this collective engagement.And there is a growing acknowledgement that there is no other way than acting together. Today, more than ever, Europe stands by this landmark agreement and leads the way on its implementation, through effective climate policies and strengthened co-operation to build strong partnerships. Also through continued support to the poorest and most vulnerable: we see more and more people on the move, or exposed to extreme poverty, due to droughts or floods linked to climate change. For Europe, dealing with climate change is a matter of political responsibility and multilateral engagement, and a matter of security, prevention of conflicts and even radicalisation.That is why the EU will not renegotiate the Paris Agreement. We have spent 20 years negotiating. Now it is time for action, the world's priority is implementation. And as we address climate change with an eye on the future, we create countless opportunities for the present, by setting up new and better ways to produce and consume, invest and trade and protect lives, assets and livelihood opportunities, for the benefit of all people as well as the planet.To accelerate the global transition to a low-emission, climate-resilient future, we have started to strengthen our existing partnerships and to seek and find new alliances, from the world's largest economies to the most vulnerable island states. Because from the Arctic to the Sahel, climate change is a reality today, not a remote concept of the future.We expect all countries to uphold the Paris Agreement and put words into action by implementing their national climate plans and strengthening their efforts over time. Plans must be turned into concrete, actionable policies and measures - now.The EU is already working towards completion of the legislative and regulatory framework necessary to deliver our Paris target, to reduce emissions by at least 40% by 2030 compared to 1990. Our legislative actions cover all sectors of the economy and we are putting energy efficiency first and boosting uptake of renewable energy across the bloc.Taking action on climate change goes hand-in-hand with economic growth. Take the EU's case: our emissions have fallen by 22% since 1990, while total EU GDP has grown by 50%.During this period, we have created new jobs, businesses and technologies. We are preparing our economies for the future and investing in making our societies more resilient to climate change, to reduce current and future risks.We have more than two decades of experience in developing and implementing ambitious climate policies and we are ready to share our experiences and lessons learnt. It's not by chance that we have established extensive climate policy co-operation with key partners across the globe.We will also continue to provide substantial funding to support climate action in partner countries. In 2015 alone, EU support totalled close to R260\'e2\ \fbillion.In November, countries will gather in Bonn for the next UN climate conference - COP23 - to continue to flesh out the work programme for implementing the Paris Agreement.Next year, the facilitative dialogue to be held as part of the UN climate process will be the first opportunity since Paris to look at our collective efforts to limit global warming and assess what we have done concretely to deliver on the commitments made. These are key steps for turning the political agreement reached in Paris into reality.Yet this is a challenge we can only overcome with the greatest possible involvement of civil society, businesses, local communities, cities and regions in parallel. And we are seeing an unprecedented breadth and scale of action by all of these actors.As institutions, we can plan and support the strategies needed to save our environment, but it is they that have the crucial role of turning policies into action and results on the ground.\'c2\~Our new EU Consensus on Development actively promotes this role. Enhanced co-operation and co-ordination among all stakeholders are key - we would say the key. The world, the planet, can count on the EU.Mogherini is High Representative of the Union for Foreign Affairs and Security Policy/Vice-President of the Commission and Ca\'c3\'b1ete is the Commissioner for Climate Action and Energy.\l"
