"COP","country","ID","title","date","source","text"
"COP23","South.Africa","COP23_South.Africa20","Minister Edna Molewa on meeting with European Union ambassadors on environment-related matters","October 11, 2017 Wednesday","South African Official News","Minister of Environmental Affairs, Dr Edna Molewa, meets European Union ambassadors on environment-related mattersThe Minister of Environmental Affairs, Dr Edna Molewa, on Tuesday 10 October 2017, met the Ambassadors of the European Union member states in Pretoria on environment-related matters.The meeting builds on the good relations that exist between South Africa and the EU with regard to, amongst others, the development of the Circular Economy, wildlife crime and climate change adaptation and mitigation.""The EU and South Africa are strategic partners and engage on a number of issues bilaterally, as well as in multilateral fora,"" said Minister Molewa.The Minister and EU Commission member for the Environment, Maritime Affairs and Fisheries, Mr Karmenu Vella, in 2016 signed a revised Terms of Reference for the Forum on Environment, Climate Change, Sustainable Development and Water.The first meeting of the dialogue took place in May this year and a number of key issues including Climate Change, Marine Litter, the Circular Economy, and the outcomes of 17th Conference of Parties (CoP) to the Convention on International Trade in Endangered Species of Wild Fauna and Flora (CITES) and the illegal wildlife trade, were discussed.A Circular Economy mission took place on the margins of the World Economic Forum for Africa (WEF Africa) in Durban in May 2017 providing an opportunity for both South African and European business, and other stakeholders, to engage on opportunities presented by the Circular Economy.Minister Molewa acknowledged the invitation from the EU to participate in a side event during the Third United Nations Environmental Assembly (UNEA-3) on the Circular Economy in Kenya in December.The participation in UNEA-3 follows the development during the Chemicals and Waste Economy Phakisa in September 2017 of more than 20 business plans for the sector in order to grow the contribution to the economy, job creation and the waste diversion targets set by government.""South Africa has been involved in beneficiation of waste for many years the scaling up of these initiatives has always been a challenge,"" said Minister Molewa.Referring to preparations for the upcoming 23rd Conference of the Parties to the United Nations Framework Convention on Climate Change (UNFCCC) in Bonn, Germany, in November, Dr Molewa emphasized that climate change action has to be integrated into development initiatives. The Partnership for Action on the Green Economy (PAGE) is aimed at facilitating scaled up, economy-wide implementation of green, low carbon and climate resilient sustainable development interventions.""We will continue to work with the EU in the coming COP23 to ensure that we make progress on the Paris Agreement Work Programme. It is our view that we should leave COP23 with some clear elements that can be converted into negotiation text early in 2018. At COP22 in Marrakech we had set ourselves a target of completing the Paris Work Programme during COP24. We have also committed to clarifying the modalities for the 2018 Facilitative Dialogue aimed at increasing ambition in the pre-2020 and post-2020 years through the revisions on Nationally Determined Contributions where possible,"" said the Minister.With regarding the 17th Conference of the Parties to the Convention on the International Trade in Endangered Species of Wild Fauna and Flora (CITES), held in Johannesburg in 2016, the Minister said it was imperative that South Africa and the EU continue to collaborate in a number of areas, including trophy hunting and the protection of species, the development of livelihood opportunities for rural communities from hunting, and the development of incentives for habitat conservation.Minister Molewa said it would be prudent for South Africa and the EU to discuss matters related to the consultation process initiated by the EU to gather information and evidence on the extent of legal and illegal trade in ivory in the EU, as well as on possible evolution of EU rules in that respect, which seem to include the import of ivory as part of hunting trophies, particularly since the Bloc and South Africa's cooperation at CITES COP17 had resulted in the adoption of a Resolution on the Trade in Hunting Trophies. South Africa is also implementing strict regulations and norms and standards to ensure the conservation and sustainable use of the African elephant.""We are concerned that further restrictions on hunting trophies could potentially have a significant impact on the conservation of the species and hold socio-economic implications,"" said the Minister emphasizing that the 2016 Great Elephant Census had shown that the South African population of African elephant is stable.The Minister had also stressed that the international trade in rhino horn for commercial purposes.""International trade in rhino horn for commercial purposes will remain prohibited and that South Africa will continue to enforce the CITES provisions in this regard. We are in the process of finalising the set of regulations that will introduce further restrictions and requirements to regulate the domestic trade in rhino horn,"" said the Minister. ""South Africa would like to assure the EU Member States that it remains committed to ensuring the effective and strict regulation of the legal, domestic trade in rhino horn. The implementation of the integrated strategic approach to address poaching of rhino and the illegal trade in rhino horn remains a priority for all government departments and entities involved.""For media inquiries contact:brZanele MngadibrCell: 082330 1148\l"
"COP23","South.Africa","COP23_South.Africa21","ISS: Climate change is feeding armed conflict in Somalia","April 6, 2018 Friday","defenceWeb","The blast that killed over 350 people and the double car bombing in Mogadishu last October have frustrated Somalia's efforts to build stability. For almost 30 years, the country has been tackling a combination of civil war, famine, desertification, piracy, political fragmentation and terrorism. Although the conflict has many underlying causes, one factor that remains poorly understood is climate change. In a country where, alongside war, six million people face starvation, understanding the role of climate change and its impact on patterns of drought - and developing innovative responses - is urgent. Since the resilience to climate consequences by government and society is limited, the ability of around 70% of Somalis to meet their basic needs depends heavily on a regular climate pattern. However, over the past decade climate change-related desertification has expanded in Somalia, making the local population even more vulnerable. Climate change feeds armed conflict in Somalia in three ways: by exacerbating tensions between clans; boosting the ranks and role of terrorist groups, including al-Shabaab; and increasing migration. First, climate change sharpens disputes over already-scarce resources between warlords. While al-Shabaab has conquered large pieces of the country's territory, clan elders still wield considerable power, dominating the political system. In this sense, the severe droughts cause disruptions to water access, high rates of malnutrition, disease outbreaks and food insecurity. This leads to tension and even open disputes between clans. In a country facing such challenges, resources like food and water are not only a basic need, but also a source of power. Second, the relationship between the proliferation of illegal armed groups and the severe droughts in Somalia is evident in the case of al-Shabaab. The group has been successful in attracting young people who are affected by famine and food insecurity and who face no job prospects. Those youth end up joining al-Shabaab in a bid to survive, finding no other option than to get involved with the extremist group. Third, migration has become more complex due to climate change. In 2016, at least one million Somalis were internally displaced, exposed to protection risks, discrimination and gender-based violence. Making the situation even worse, around 300 000 Somali refugees living in the Dadaab refugee complex - the world's largest refugee camp, located in neighbouring Kenya - have faced heightened uncertainty since Kenya announced the compound will close. Although desertification perpetuates and expands the levels of violence in Somalia - with possible spill-overs into neighbouring states, as is already the case in Kenya - climate change has received relatively little attention when compared to anti-terrorism and security sector reform. Global and regional powers and international organisations have focused on fighting terrorism and piracy in the Horn of Africa. Most of the international community recognises the influence of human activity on the climate system and its severe consequences. These include shifts in rain patterns, increasing desertification, higher frequency and severity in tornados and hurricanes, temperature disturbance and frequent heat waves. But neither the Paris Agreement nor last November's United Nations Climate Change Conference in Bonn, Germany, have addressed the links between climate change and armed conflicts. They also haven't offered recommendations on how to build resilience in this area in fragile states. This is particularly worrisome because even a slight change in the global temperature is enough to provoke a set of weather calamities. Many developing and developed countries are implementing public policies to prevent, mitigate and adapt to climate change consequences. In most cases, governments and other stakeholders are able to tap into technical expertise, new technology, and relatively or highly stable societies. But conflict-affected countries, which are socially, politically and economically vulnerable, encounter considerable obstacles in addressing the effects of climate change. Instability, low state capacity and prioritising more immediate goals tend to sidel"
"COP23","South.Africa","COP23_South.Africa22","Climate change speaker ready to turn up heat","November 11, 2017 Saturday","The Star (South Africa)","Maesela Kekana doesn't like coffee. But as South Africa's chief negotiator at the Bonn climate change talks, he knows he's going to be drinking a lot of it.""Man, we work long hours,"" he said, speaking by phone from Germany yesterday. ""Sometimes, you work three days non-stop. There are no weekends, it's just work. And lots of coffee. I don't like coffee but I have to drink it.""Still, Kekana would not be anywhere else. ""I love my job, representing my country and my people and making sure we have a fair outcome at the talks.""What I don't like is people who say something, but mean something different.""As South Africa's lead negotiator at the 23rd UN Framework Convention on Climate Change Conference of Parties (COP23), which kicked off this week, Kekana and his colleagues know they have their work cut out.""We've had five days of intense preparations in Bonn before (this week's) sessions started. We have to transition now to text-based negotiations and we're hoping by the end we'll have actual text.""Last week, the UN stated that countries ""were not doing enough to save hundreds of millions from a miserable future"" with a temperature increase of 3C looking ""very likely"" by 2100.National pledges, it said, only brought a third of the reduction in emissions required by 2030 to meet climate targets, with private sector and sub-national action ""not increasing at a rate that would help close this worrying gap"", and pledges needed to be stronger when revised in 2020.Kekana explained that the annual talks were expected to advance work on the implementation guidel"
"COP23","South.Africa","COP23_South.Africa23","Economic Development Vs. Climate Action - Rebutting Deniers and Wafflers","November 12, 2017","Inter Press Service (Johannesburg)","As negotiators meet in Bonn to put together a deal to implement the Paris Agreement, John Holdren, a professor of environmental policy at the John F. Kennedy School of Government, Harvard University, stressed that economic development and climate change mitigation and adaptation are not 'either-or' but must be pursued together.Addressing science journalists a week before the Bonn climate talks, Professor Holdren said among climate change skeptics, ""wafflers' are the most dangerous, because their arguments to postpone aggressive climate action now in favor of economic progress has the potential to increasingly influence debate and government policy.""According to Professor Holdren, the wafflers claim to favor research and development on better technologies so emissions reductions can be made more cheaply in the future, and further argue for accelerating economic progress in developing countries as the best way to reduce their vulnerability as well as counting on adaptation as needed.However, it is ironic, he says, that the current US administration ""with climate deniers and wafflers occupying top positions"" are cutting support for the same approaches they propose.""Of course, the deniers and the wafflers in the top positions in the Trump administration are, with surpassing cynicism, busy cutting support for all of these approaches,"" he said, referencing the numerous reversals that the Trump administration has made even to the 'win-win' adaptation-preparedness resilience measures adopted under Obama.Apart from drastic domestic spending cuts to climate related programmes, President Trump earlier this year decided to pull the US out of the Paris Agreement--a move that has left the global community wondering what's next.Africa's DismayDespite its negligent contribution to global emissions, Africa is one of the most vulnerable regions to climate change - already suffering droughts, floods, affecting the predominantly rain-fed agricultural productivity and production. And Professor Holdren's address titled: Why the Wafflers are Wrong - Addressing Climate Change is Urgent--and a Bargain delivered to the 10th World Conference of Science Journalists (WCSJ2017) in San Francisco, California, held 26-30th October 2017, is music to the ears of the African Group of Negotiators (AGN) who have been pushing urgent climate action at the UNFCCC negotiating table.According to Professor Seth Osafo of AGN, ""The slow progress by developed country parties towards reaching the US$100 billion goal of joint annual mobilization by 2020 is not in Africa's interest."" And in the words of Emphraim Mwepya Shitima, Chief Environmental and Natural Resources Officer at Zambia's Ministry of Lands and Natural Resources, the developing country community needs financial resources now more than ever. ""We are at a critical stage where we need all the financial resources we can get to effectively implement our NDC which is off course now in sync with the recently launched Seventh National Development Plan running up to 2021,"" he told delegates at a COP23 preparatory meeting.With the US pullout meaning the loss of a major financial contributor, there are fears that the resource mobilization process might even get slower. Mithika Mwenda, Secretary General of the Pan African Climate Justice Alliance (PACJA), a consortium of African civil society organisations, is also concerned and is pushing for industrialised countries to set more ambitious goals in terms of their emission cuts.""Coming from the region that suffers the most due to climate change, we have watched with utter dismay President Trump's continued efforts at dismantling the former President's Barrack Obama's climate legacy, and wish to reiterate that this is the time to classify the global community into two: those for the people and planet, and those for Trump and profit,"" says Mwenda.He questioned the presence of the official US delegation, saying it may be a bad influence on other states that are already reluctant to take serious action on climate change. ""The US withdraws from the Paris Agreement, yet they still want to show that they can negotiate the implementation framework,"" complained Mwenda, ""That's why we are calling in delegates here to sign our petition to kick Trump and his government out of these negotiations... ""Scientifically, climate change is a serious complex issue - it requires well-developed research systems especially on how it impacts different sectors of development, or at least in the spirit of the WCSJ2017 theme, to bridge science and societies. Unfortunately, as compared to the developed world, Africa's scientific research and development still lags behind such that most often than not, it relies on the developed world for data, a concern that South Africa's Minister of Science and Technology, Naledi Pandor raised during a session on Who will do Science at the WCSJ2017.Pandor believes private companies which drive scientific innovations in the developed world must stop seeing the developing world just as a mass clientele--where research and development is done just for corporate interests and not for the benefit of the people.""A number of private companies only have commercial relationships but do not have innovation relationships with the developing world; so the nature of partnerships between my continent Africa and other parts of the developing world must change,"" she said. ""If we are to do science in the 21st century... the way we perceive Africa and scientists in Africa has to fundamentally alter.""She further lamented the sidelining of women in science whom she said are doing a lot of tremendous work, and her plea is for Africa to embrace and give space to women scientists amidst the challenge of climate change in a continent that contributes less than 4 percent to global emissions. ""The next generation of scientists must be women - and black people have to be a part of that.""The High Cost of InactionAgreing that research and development are important steps in tackling climate change, Professor Holdren, who is former Assistant to President Obama for Science & Technology, argues that even if implemented, the wafflers' favoured economic approaches would be grossly inadequate because while clean energy is essential to provide options for the next stage of deep emissions reductions, the global community needs to be reducing now with the available technologies.He says climate change is already causing serious harm around the world with increases in floods, drought, wildfires, heat waves, coral bleaching, among others, all of which are ""plausibly linked to climate change by theory, models, and observed 'fingerprints'; most growing faster than projected"".The global community has three options: mitigation, adaptation - or suffering. Therefore, minimizing the amount of suffering in the mix can only be achieved by doing a lot of mitigation and a lot of adaptation.In arguing for adaptation specifically, Professor Holdren believes that many adaptation measures would make economic sense even if the climate were not changing because there have always been heat waves, floods, droughts, wildfires, powerful storms, crop pests, and outbreaks of vector-born disease, and society has always suffered from being underprepared.Additionally, he says, virtually all reputable studies suggest that the economic damages from not adequately addressing climate change would far exceed the costs of adequately addressing it.""The idea that society cannot afford to address climate change is wildly wrong,"" he said, calling for urgent climate action now and not laterCOP22 produced the Marrakech Partnership for Global Climate Action which called for all to go further and faster in delivering climate action before 2020. The global community now eagerly awaits COP23 Bonn declaration. \l"
