"COP","country","ID","title","date","source","text"
"COP22","UAE","COP22_UAE37","UAE launches research for climate initiative","November 17, 2016 Thursday","Emirates News Agency (WAM)","UAE / climate initiativeMARRAKECH, 17th November, 2016 (WAM) -- As a participant at the United Nations Framework Convention on Climate Change (UNFCCC) in Marrakech, Morocco, the United Arab Emirates (UAE) on Thursday launched a research programme to reduce the impact of climate change.Marrakech is hosting this year's conference which began on 7th November and concludes on 18th November. During the UNFCCC's 22nd 'Conference of the Parties' (COP 22), countries set a road map to implement last year's Paris Agreement. Cop 22 follows last year's landmark Cop 21 agreement in Paris in December, during which 196 parties signed to pledge progressive policy actions to tackle climate change.The 'Research for Climate' initiative is a joint partnership between the UAE and the University of Maryland.'The initiative provides a fitting opportunity to create an ambitious international network for research on mitigation of climate change,' said Dr. Thani bin Ahmed Al-Zeyoudi, UAE Minister of Climate Change and Environment.The aim of the initiative, he stated, is to team up with the academia and research centres to advance government efforts aimed at reducing consequences of the climate change by finding better solutions to this challenge.'At the COP 22In May 2016, we formed the Emirates Committee for Sustainable Environment Research, which comprised representatives from a range of different organisations, entities and universities across the public and private sectors to oversee the development of a research strategy and integrated work streams on environmental sustainability and climate change; key national priorities of the UAE Government, he added.\l"
"COP22","UAE","COP22_UAE38","Global Summit of Women Speakers of Parliament issues Abu Dhabi Declaration","December 13, 2016 Tuesday","Emirates News Agency (WAM)","Global Summit ABU DHABI,13th December, 2016 (WAM) \- The Global Summit Of Women Speakers Of Parliament concluded today in Abu Dhabi issuing Abu Dhabi Declaration with a commitment to contribute to the realisation of the UN 2030 Sustainable Development Goals, the Paris Agreement, the results of the United Nations in Marrakech and the Sendai Framework for Disaster Risk Reduction.The conference also stressed its willingness and duty to work together to address the challenges as well as conviction of the parliamentarian, that they must form a united front and work towards a better future with the other branches of power, the private sector, civil society and the community at large.Below is the full text of the Declaration:""We, women Speakers of Parliament from more than 30 countries, met on 12 and 13 December 2016 in Abu Dhabi, United Arab Emirates, for the Global Summit of Women Speakers of Parliament, organized by the Inter-Parliamentary Union (IPU) and the UAE Federal National Council for the purpose of shaping the future of parliaments for a better world.(i) Affirming the 38 provisions of the Declaration of the Fourth World Conference of Speakers of Parliament entitled Placing democracy at the service of peace and sustainable development: Building the world the people want; and reiterating the principles and recommended actions of the summary report of the Tenth Meeting of Women Speakers of Parliament entitled Innovating for Gender Equality: Making development, peace and democracy a reality for women and men, (ii) Cognizant of the challenges our world is facing today, and of the geopolitical, socio-economic, environmental and technological megatrends, which are accelerating the pace of change, and which are likely to affect quality of life for generations to come, (iii) Committed to contributing to the realization of the UN 2030 Sustainable Development Goals, the Paris Agreement, the results of the United Nations in Marrakech and the Sendai Framework for Disaster Risk Reduction, (iv) Also committed to contributing to the implementation of the Beijing Declaration and Platform for Action, as well as to addressing all forms of discrimination and violence against women and girls, (v) Emphasizing that today's megatrends are intertwined and interdependent, and that tackling them requires a holistic approach, which encompasses geopolitical, socioeconomic, environmental, demographic and technological responses, (vi) Stressing our willingness and duty to work together to address the challenges we face, as well as our conviction that parliamentarians must form a united front and work towards a better future with the other branches of power, the private sector, civil society and the community at large, (vii) Asserting that solutions to the challenges that our world faces cannot be realized without democratic governance, respect for human rights and the achievement of gender equality at all levels throughout the world; and recalling that the attainment of gender equality is not only a question of human rights but also a matter of efficiency that would harness all the potential and talent required for innovation and transformation, (viii) Recognizing that young people should be included as active participants in the decisions we make, (ix) Convinced of the need to take account of the interests and aspirations of future generations in our parliamentary work, and committed to working for change through collective action, We stand: (1) ""United for Shaping the Future"" by committing to work together and forge partnerships across government, the private sector and society at large in order to address the challenges that our world faces; We agree that: (2) Peace and security. Our parliaments are crucial in the promotion and maintenance of peace and security. As representative institutions, through their legislative and oversight functions, they can take effective measures to prevent violence and conflict as well as to promote conflict resolution through peaceful means, including dialogue and reconciliation, with full respect for international law. Inter-parliamentary dialogue and cooperation can advance peace across nations. Winning the war on terrorism will require parliaments to come together and work with governments, civil society - including youth -, religious groups and leaders. Promoting peace and security is underpinned by democratic governance and institutions, the protection and promotion of human rights and the values of tolerance, inclusiveness, diversity, equality and dialogue.(3) Inclusive society. Regardless of gender, age, race, class, geography or religion, inclusive societies should empower their members. Marginalization can lead to violent extremism and even terrorism. While the world has made progress, much work remains to be done on every front, especially in the critical area of gender equality. To achieve a more inclusive society, parliaments must be more proactive in addressing discrimination and eliminating violence against women and girls. They should ensure that every woman, child and adolescent across the world survives, thrives and reaches their full potential. They should promote girls' education. Parliaments must also advance tolerance, economic equity, equal access to education and employment, women's economic empowerment, and equal participation in the political process, including decision-making institutions.(4) Economic prosperity and well-being. Megatrends across many sectors affect economic prosperity and well-being. Such trends include transformative innovation in science and technology, changing geopolitical landscapes, resource scarcity, insecurity, hyper-urbanization and aging populations. Major challenges for the global economy continue to include: high and persistent unemployment rates, especially among young people; high indebtedness in developed and developing countries; slow growth; and rising inequality. As such, parliaments need to develop holistic frameworks and action plans that tackle these challenges, address inequalities, take advantage of the opportunities created by the megatrends mentioned above and promote equitable and sustainable economic growth across and within nations.(5) Climate change and resource scarcity. Our parliaments can and should promote the ratification of the Paris Agreement and take all necessary action to implement it. They should implement the IPU Parliamentary Action Plan on Climate Change. Parliaments must enact practical and appropriate legislation and establish regulatory frameworks to progressively reduce their nations' carbon footprints, while continuing to grow their economies and to create opportunities for all, including the most marginalized. Through their legislative and oversight work, parliaments must promote the innovation needed to provide clean energy on a massive scale. They must contribute to protecting and ensuring the rational use of water resources. Parliaments must also consider legislation that will protect natural habitats, biodiversity and the overall ecosystem. Internationally, parliaments need to ensure funding that will preserve and rehabilitate the carbon sinks of the world.(6) Citizen participation. Parliaments now have tremendous opportunities to dramatically increase citizen participation through mobile communication platforms and social media; but they also need to enact appropriate legislation and work with governments and the judiciary to limit the abuse of mobile communications for criminal purposes or by terrorist organizations for political gain.(7) Advancing tolerance. Intolerance leads to violence, discrimination and terrorism. Parliaments can and should contribute to promoting tolerance through: legislation, policy-making and parliamentary debates; and by working with governments, the judiciary, civil society and religious leaders. Parliaments should lead by example, by acting with propriety as representative and inclusive institutions in their composition, processes and procedures.(8) Innovations in science and technology. Our quality of life could improve significantly as a result of scientific and technological innovation. However, this could come at a significant cost, unless parliaments begin to find ways of addressing the ethical and moral implications of technological advances, including: human rights such as privacy; global issues such as security; economic issues such as the digital divide leading to a larger knowledge divide; and employment such as humanoid robots replacing humans.We commit to:(9) Placing the well-being of our people, peace, prosperity, and the integrity of both our planet and humanity at the core of our parliamentary strategic objectives, and making them central to our development efforts;(11) Using the opportunities offered by the digital era to open up parliaments, engaging citizens in parliamentary processes and increasing international cooperation so as to narrow the digital divide between developed and developing countries.(12) Proposing to the IPU to consider an international parliamentary declaration on tolerance aiming at promoting and upholding human values and the principle of tolerance to advance peace and security and combat terrorism and violent extremism;(13) Working with all stakeholders, executive bodies, private sector and civil society representatives, especially young people, in order to implement the Sustainable Development Goals, which is our agenda for the future;(14) Sharing knowledge and experiences so as to promote democratic standards, tolerance and mutual respect, and to prepare for the future;Action imperatives:(15) Focusing on the future. (a) Encourage the IPU to consider establishing a structure on the future which would assess future changes and global trends as well as their impact on people's live, and which would mobilize efforts of parliaments and stakeholders in responding to these challenges; (b) Consider establishing in every parliament an appropriately resourced structure for horizon-scanning, such as a committee on the future and/or administrative unit on the future, which would inform parliament's legislative and oversight work regarding the implications of megatrends that affect our world, and which would act as a means to ensuring a better quality of life for future generations.(16) Strategic planning. (a) Develop new or modify existing strategic plans to better meet the challenges of the future, in light of the megatrends and challenges that we face today and are likely to face in the future. Strategic planning efforts should include measures to ensure that parliaments are fit for purpose and able to contribute to achieving the Sustainable Development Goals; (b) Encourage parliaments to review existing strategic plans to reflect the conclusions of our Summit; (c) Encourage the IPU to consider developing a global Code of ethics for parliaments in order to address the ethical implications of technological advances.(17) Promoting youth empowerment. (a) Develop regulations, mechanisms and processes within every parliament to increase youth representation and facilitate youth contribution to legislation and policymaking; (b) Promote youth economic empowerment through legislation, policies and action plans that create opportunities for education and employment; (c) Promote youth cultural empowerment through relevant policies and strategies including education; (d) Contribute to bridging the technology gap among young people.(18) Advancing gender equality and women's empowerment. (a) Increase and accelerate women's participation in every aspect of legislative and oversight work with a view to attaining gender equality in politics and in parliaments by 2030, including by using electoral gender quotas where applicable; (b) Review the functioning of our parliaments to ensure that they are gender-sensitive institutions and that they provide family friendly facilities; (c) Take action to eliminate all forms of discrimination and violence against women and girls; (d) Address pay gaps, inequality of access to economic opportunities and harassment in the work place; (e) Ensure that women and girls have access to health and education in all instances, including in times of war and conflict; and (f) Work in partnership with women and men to those ends.(19) Following-up to the Abu Dhabi Declaration. Urge the IPU to follow-up on the proposals and commitments included in the Abu Dhabi Declaration and accommodate them in its work programme in such a manner as to promote continued and strategic partnerships with government authorities, scientists, academia, youth and representatives from the private sector and civil society.(20) Institutionalizing our united efforts. (a) Within 3 months of this Declaration submit proposals for establishing a coordination mechanism within the IPU for discussion at the IPU Executive Committee meeting and at the Forum of Women Parliamentarians during the 136th IPU Assembly (Dhaka, Bangladesh, April 2017), in order to set timel"
"COP22","UAE","COP22_UAE39","Environment Ministry and GGGI bring students together on innovation and climate change","December 4, 2016 Sunday","Emirates News Agency (WAM)","Environment Ministry and GGGIWith the UAE having recently concluded its participation in climate talks held at COP22 in Marrakech, the seminar titled 'Building on the UAE Innovation Week', was attended by over 45 students from various academic backgrounds who took the opportunity to engage with local and international experts on innovation and to hear the latest trends both in the UAE and around the world on the fight against climate change.In the face of global climate change, resource scarcity and environmental degradation, the government of the UAE has begun the transition to an environmentally, economically and socially sustainable development model by adopting a national green growth plan that emphasises opportunities for a prosperous, inclusive and climate-resilient future. The environment ministry is in the final phases of drafting the National Climate Change Plan, which will chart the path of climate change mitigation and adaptation.""The UAE recognises the importance of students and young people in coming up with innovative responses to climate challenges,"" said Dr. Thani Al-Zeyoudi, Minister of Climate Change and Environment. ""Engaging with young people and hearing from them is a priority for our leadership. They are creative and tech-savvy and we must harness their energy to achieve our goals of a sustainable economic and environmental future for our nation.""The seminar comes as part of the Green Growth Youth Programme, which kicked off in 2015 with an introductory workshop and continued in 2016 with a number of student internships at GGGI's office in Masdar City, Abu Dhabi.""Engaging the youth in green growth and climate change subjects is one of the most important aspects of the GGGI programme in the UAE,"" said Dr. Frank Rijsberman, Director General, GGGI. ""We are very happy to achieve concrete progress since the launch of the youth programme last year. Building on the accumulated efforts, GGGI UAE will continue to invest in the coming years in youth training and internships,"" he said.\l"
"COP22","UAE","COP22_UAE40","UAE supports Mission Innovation's initiatives","November 14, 2016 Monday","Emirates News Agency (WAM)","UAE / Marrakech MARRAKECH, 14th November, 2016 (WAM) -- The United Arab Emirates (UAE) joined the Mission Innovation countries which came together today here at the UN climate change conference, COP22, in Marrakech, Morocco, to report on developments one year on from its launch.Mission Innovation, a consortium of 20 countries each pledging to double their research and development (R&D) spending on clean energy technologies. It aims to reinvigorate and accelerate global clean energy innovation with the objective to make clean energy widely affordable.In addition, a number of innovation challenges were launched to target development of energy technologies that will accelerate the clean energy transition. Innovation Challenges are global calls to action aimed at accelerating research, development, and demonstration (R&D) in technology areas where MI members believe increased international attention would make a significant impact in shared fight against climate change.Dr. Mattar Al Neyadi, Undersecretary of the Ministry of Energy, said the UAE backed the Mission Innovation's initiatives which would contribute to employ innovation in clean energy through a public-private partnership on research and development (R&D).He stated that last year seven challenges were defined, notably Affordable Heating and Cooling of Buildings Innovation Challengewith the objective to make low-carbon heating and cooling affordable for everyone.'Globally, buildings account for almost a third of final energy consumption, with space heating and cooling, and the provision of hot water, accounting for approximately half of this consumption. The ultimate goal of the affordable heating and cooling of buildings Innovation Challenge is to develop core building heating and cooling systems and measures to improve building envelopes that deliver affordable heating and cooling without the carbon emissions,' he said.Cooling currently represents a smaller proportion of global energy demand, though it is an area of significant future growth, with an 80 percent increase in space cooling demand anticipated by 2050 in emerging and developing economies. Increasing global temperatures resulting from the effects of climate change will also contribute significantly to this growth, he noted.Outlining the UAE's efforts in this respect, he explained that Estidama, an Abu Dhabi building design methodology for constructing and operating buildings and communities more sustainably, has reduced gas emissions by up to 35 percent.He added that Al Safat, a Dubai green building rating system, aims to reduce the consumption of electricity by 20 percent, water consumption by 15 per cent, carbon dioxide emissions by 20 per cent and waste by as much as 50 per cent.\l"
"COP22","UAE","COP22_UAE41","Jordan takes part in Marrakech Climate Change Conference","January 14, 2017 Saturday 7:00 AM  EST","Jordanian News Agency","Amman, Nov. 14 (Petra) -- Jordan, along with 195 countries, is taking part in the 22nd Marrakech Climate Change Conference (COP22) in the Moroccan city of Marrakesh.According to a Ministry of Environment statement, Minister of Environment, Yassin Al Khayyat, is heading the Jordanian delegation to the 11-day conference.Moroccan Foreign Minister Salaheddine Mezouar and the COP22's president opened the conference by announcing that 103 Parties have now deposited their instruments of ratification of the Paris Agreement, constituting an important political signal in the fight against climate change.COP22's high-level meetings are scheduled to begin on Tuesday, as Al Khayyat is set to address the conference.//Petra// AF\l"
"COP22","UAE","COP22_UAE42","Generation Z Wants More Action for a Sustainable Future","November 27, 2016 Sunday","MediAvataarME.com","Climate change will be the world's biggest challenge over the next decade, according to a global survey of young people carried out by Masdar, the Abu Dhabi Future Energy Company.Unveiled at COP22Carried out earlier this year to coincide with Masdar's 10-year anniversary, the survey spoke to nearly 5,000 Post-Millennials in 20 countries across the Middle East & North Africa, sub-Saharan Africa, the Americas, Europe and Asia.The survey clearly illustrates the level of concern among young people about climate change, with 40% of those interviewed naming it among the biggest challenges facing the world in the next decade, ahead of the economy (34%), terrorism (32%), poverty & inequality (29%) and unemployment (29%).Eight in ten (83%) Post-Millennials also said governments need to listen more to young people about sustainability. A similar number (80%) believe current leaders have not done enough to protect the environment.Almost two in three (59%) said they are interested in working or studying in an area related to sustainability.Patricia Espinosa, Executive Secretary of the United Nations Framework Convention on Climate Change (UNFCCC), said: ""There is huge demand among our youth for corporate and public investment in clean technology and renewable energy. The winners in the green economy will be those who can harness this youthful idealism and combine it with regulations, long-term investment, cultural change and political action.""The survey found that around half of Generation Z (46%) have chosen to spend more money on products from a company that behaves sustainably, and 31% have boycotted a company that they perceived as following unsustainable practices.Mohamed Jameel Al Ramahi, CEO of Masdar, said: ""Over the last 10 years, the clean energy industry has become one of the world's most exciting and dynamic growth markets. As we look ahead, the findings of our global survey provide an important insight into the action required to accelerate the adoption of renewable energy and clean technologies."" HYPERLINK http://imgs.syndigate.info/434/1381/97/148023709861.jpghttp://imgs.syndigate.info/434/1381/97/148023709861.jpgGeneration Z Wants More Action for a Sustainable Future HYPERLINK http://imgs.syndigate.info/434/1381/28/148023710060.jpghttp://imgs.syndigate.info/434/1381/28/148023710060.jpg\l"
