"COP","country","ID","title","date","source","text"
"COP23","Ireland","COP23_Ireland12","Progress made on agriculture emissions, says key negotiator","November 18, 2017 Saturday","The Irish Times","The world's efforts to tackle climate change, directed by the Paris agreement, have achieved significant progress through the COP23 process, according to a member of the Irish negotiating team.Frank McGovern, the Environmental Protection Agency's chief climate scientist, said the talks had confronted ""tricky issues that had hung around for years"" - notably, from an Irish perspective, agriculture emissions.Food security There was now a greater understanding among EU and global partners on what was needed to reduce carbon emissions associated with farming, he said. In recent years, he said, Ireland had worked outside the UN Framework Convention on Climate Change process with New Zealand and Latin American countries with large farming sectors in assessing best approaches while maintaining food security and protecting food production. Technology While Ireland was facing a challenge in addressing its agricultural emissions, it had invested in technology and research, and accepted more needed to be done.The parties have agreed to work on mitigation approaches to reduce agricultural emissions and identify adaptation measures to counter climate change's impact on farming. These will be informed by a special report on land use and food production from the UN's scientific advisory body, known as the IPCC, in 2019.Land management would be the key element in reducing emissions, he said. That included improving livestock and managing manure appropriately. While forestry importance in providing carbon sinks was known, the issue of carbon in soils, and how it is measured, needed further work.As Ireland had committed to ""carbon neutrality"" in agriculture, it would have to look at use of land resources for food, energy and ""ecosystem services"" to store carbon - and ensure it had robust systems to quantify associated emissions.\l"
"COP23","Ireland","COP23_Ireland13","Climate talks failing vulnerable countries, says Robinson","November 17, 2017 Friday","The Irish Times","Not enough progress has been made at the current climate talks on securing the scale of funding necessary to help vulnerable developing countries, according to climate justice campaigner Mary Robinson.The former president cited the case of small island states which risked literally going under because of rising sea levels and countries threatened with mass migration caused by the impact of climate changes.Not enough progress had been made on the issue, but there was another round to go in December with a summit in France, she said.The intervention of French president Emmanuel Macron had been ""very strong"", similarly that of the German chancellor Angela Merkel, she said. Both had underl"
"COP23","Ireland","COP23_Ireland14","State action on climate change worst in Europe; Ireland ranked 49th out of 56 countries in the Climate Change Performance Index","November 16, 2017 Thursday","The Irish Times","in Bonn Ireland is the worst-performing country in Europe when it comes to taking action to combat climate change, a study has revealed. The State has fallen 28 places to 49th out of 56 countries ranked in the 2018 Climate Change Performance Index.The report, produced by Germanwatch and the New Climate Institute (NCI), says ""greater efforts have been made globally to reduce greenhouse gas emissions"" and highlights positive developments on switching to renewable energy sources and energy efficiency. However, it says ""no country is doing enough to prevent dangerous greenhouse gas emissions"".Progress on this front was was still not in l"
"COP23","Ireland","COP23_Ireland15","Key climate change updates after Bonn; Some pertinent answers to current climate change questions","November 30, 2017 Thursday","The Irish Times","An important international meeting about climate change took place in Bonn, Germany earlier this month. Attended by more than 10,000 delegates, it received relatively little attention in the world's press - with some exceptions - but it laid down an important marker in global politics. Climate change shows every sign of becoming the defining issue of our time. So what are the key updates?Yet another climate meeting - what was it all about? Bonn was the 23rd UN Conference of the Parties (COP23), an annual international meeting to agree plans to address climate change. Two years ago, the Paris meeting made history by establishing an agreement to prevent global warming of more than two degrees by the end of the century - and 1.5 degrees if at all possible. Bonn represents the next phase of the project. In what way? The purpose of the Bonn meeting was to draw up rules and guidel"
"COP23","Ireland","COP23_Ireland16","Prince meets hurricane victims","November 20, 2017 Monday","Belfast Telegraph","THE Prince of Wales has praised the ""resilience"" of the people of Dominica as he witnessed the damage caused to the Caribbean island by Hurricane Maria.Charles stood among the ruins of Pichelin village, which was battered by torrential flooding and high winds in September, and sympathised with the residents who have remained. With a mangled car behind him, the heir to the throne chatted to locals who were standing in front of the village general store. The front of the store was swept away by the deluge that brought trees, boulders and other debris down from hill tops. Marilyn Leatham (53), from a neighbouring village, said: ""The Prince told me 'you're resilient people - hold on'. It means the world to us to have him here and it means the world that he is thinking of us. The Prince makes us feel proud as people.""Charles, with international development secretary Penny Mordaunt, walked through the village shaking the hands of locals, stopping to chat briefly and watched a dance performance by local school children.Khalin Thomas (26), whose grandmother's store was washed away, said: ""We managed to survive the hurricane somehow, the village is between two rivers but luckily we're still here.""The car next to my grandmother's store was across the street and the water just picked it up and tossed it across the street.""Dominica's Prime Minister Roosevelt Skerrit met with Charles during the visit.Speaking last week at Cop 23, the UN's climate change talks, the PM said of the natural disaster: ""When dawn broke, the scenes of utter devastation across this once lush green island were heartbreaking.'' He told delegates at the global summit in Bonn, Germany: ""In some areas where houses once stood there lay mounds of dirt and debris, others had their roofs blown off, landslides scarred the landscape, trees were uprooted or laid bare and flood waters raged.Mr Skerrit added: ""Two months later 95% of the country remains without electricity, our water systems are compromised, and many citizens remain displaced and in shelters.''\l"
"COP23","Ireland","COP23_Ireland17","Climate change revolution is coming - it's up to us not to get let left behind economically","November 4, 2017 Saturday","Irish Independent","Adamage is still being cleared after Ophelia, the worst storm to hit us in 50 years.But the destruction caused by this extreme weather event should make us all sit up and realise that this was not extreme: unless we act, this will soon be normal.The other morning, I walked to work in Dublin and saw people dressed in T-shirts.It's the first week of November and winter has barely made a whimper, a scene that is beginning to fit a familiar pattern.We were also told last week that carbon dioxide in our atmosphere is at the highest levels in more than 800,000 years - that's according to a new report by the World Meteorological Organisation ( W MO) .We're literally in danger of losing the air that we breathe.That's why the 11 days of talks that begin in Bonn, Germany, next week matter.Ireland, along with 197 other parties to the historic 2015 Paris UN Framework Convention on Climate Change (Cop 21), will meet and try to work out how to implement that deal.Two years ago, the world agreed a plan that would limit global temperature increases to two degrees Celsius by the year 2100 compared to average temperatures at the start of the industrial era - with hopes to even limit the increase to 1.5 degrees, if possible.The 2C target means the world can produce 3.6 trillion tonnes of greenhouses gases annually and no more. And that's just to have a 66pc chance of hitting the 2C mark. The deal also aims to remove these gases from the atmosphere between 2050 and 2100.Can we do it? We must try to - and if we don't, we can expect more catastrophic storms, rising sea levels, devastation of food crops and huge pressures on the Earth's scarce resources such as fuel and water.We all know that Barack Obama, when he was president, pledged the US to meet these climate change targets.We also now know that Donald Trump is trying to reverse this by ramping up fossil fuel production in the US, just as the world moves away from these negative practices.So why does it matter to Ireland? board, is there any point trying to implement the Paris deal? The answer is an emphatic yes. Despite his pronouncements, corporate America and states such as California are part of a We Are Still In campaign.Indeed, among those present in Bonn will be dozens of America's climate champions including state governors, key business leaders and academics.They will stand in solidarity with nations including Ireland, showing the world that US leadership on climate change extends beyond federal policy.They are stepping up because their very future is at stake.In simple terms, to implement the Paris agreement, hard cash is required - and lots of it. There will be winners and those who will get left behind.Paris binds all countries to undertake economy-wide measures to reduce emissions. These efforts require significant finance to build and scale projects that can Relevant, recent examples that spring to mind include:  Finance: Dutch tech giant Philips has agreed a deal with banks that links its sustainability performance to the interest rate on a (EURO)1bn loan. Insurance giants Axa and Allianz are to stop financing companies whose businesses are based on coal. Energy efficiency: Bloomberg last week opened a new \£31bn European HQ in London, the world's most sustainable office building using 70pc less water and 40pc less energy than a typical office block. Innovation and Cleantech: Irish firms are world leaders. HUB Controls Ltd was this week named in the World's Top Three Cleantech companies at an event in London.So, regardless of how much progress is made in Bonn, the direction of travel to a sustainable, low-carbon economy is unstoppable, with or without US leadership.At home, up to (EURO)28bn in green financial activities, including (EURO)11bn in green bonds, is managed from, domiciled or listed in this country. That figure is growing as Ireland, in l"
