"COP","country","ID","title","date","source","text"
"COP24","Canada","COP24_Canada51","Canada to stiffen its emissions target by 2020; Minister concerned global politics may keep Paris deal rules at bay","December 5, 2018 Wednesday","Medicine Hat News","Canada will be ready to set tougher emissions-cutting plans when the Paris climate-change agreement kicks in by the end of 2020, Environment Minister Catherine McKenna says. McKenna is heading to Poland next week for the 24th annual United Nations climate-change meeting, where the nations of the world are supposed to decide how each country will be held accountable for its promised cuts to carbon emissions. A secondary discussion at the meeting is on demands that countries set more ambitious goals. This month's meeting, known as the Conference of the Parties (or "" COP24 ""), comes two months after climate-change scientists warned the world that without significantly deeper emissions cuts, the planet is on course for irreversible and devastating climate changes. Canada, that report said in October, needs to cut emissions almost in half to do its part. Canada's current target is to cut them by about 27 per cent. McKenna has been reluctant to look at setting tougher goals when the country's climate change plan is still not strong enough to meet the weaker ones. But, she acknowledged in an interview, ""in 2020 everyone has to come back and be more ambitious,"" and she said Canada will. McKenna said before then, the standards to be set in Poland are needed to help the world take stock of its progress and and ensure that everyone is measuring and reporting by universally understood rules. That will give confidence that when a country says its targets are being met, they actually are. Writing the rule book at the meeting this month is made all the more difficult after the election of several governments that are less enthusiastic about the Paris agreement. The U.S. under President Trump is preparing to withdraw at the earliest opportunity - which is in 2020 - and the newly elected government in Brazil campaigned on a promise to do the same thing. The Brazilian government also just cancelled its plans to host the annual COP meeting in 2019. McKenna said in the current global political environment, the Paris accord might never have been reached. ""I think it would be much harder,"" she said. The Paris agreement, which every country in the world has signed, aims to reduce the amount of greenhouse gases being spewed into the atmosphere enough to keep the increase in average global temperature to no more than 2 C, compared to pre-industrial times, and as close to 1.5 C as possible. The world's average temperature has already warmed up at least 1 C compared to the 19th century, and it is continuing to warm by about 0.2 C each decade. At the current rate of emissions, the planet will be 1.5 C warmer by 2052, scientists predict. After that, the impact on human health and ecosystems becomes far more problematic. \"
"COP24","Canada","COP24_Canada52","#ICYMI: Synagogue killings, Montreal's underworld, more news","October 30, 2018 Tuesday","The Gazette (Montreal)","In Case You Missed It (#ICYMI) is a daily feature highlighting news in and around Montreal. Two days after 11 of his fellow Jews were massacred in Pittsburgh( HYPERLINK https://montrealgazette.com/news/crime/active-shooter-multiple-casualties-after-shooting-near-pittsburgh-synagogue/wcm/9f887ecb-b5be-487b-bbc4-9de4218e159d https://montrealgazette.com/news/crime/active-shooter-multiple-casualties-after-shooting-near-pittsburgh-synagogue/wcm/9f887ecb-b5be-487b-bbc4-9de4218e159d ), Rabbi Mark Fishman arrived at his own synagogue on the West Island to find numerous messages of support from regular Montrealers and from the leaders of Muslim and Christian communities across the island. Katherine Wilton files this report: At Montreal synagogues, messages of solidarity transcend religious barriers( https://wp.me/p4Uzqt-5Ful https://wp.me/p4Uzqt-5Ful ) Few can deny that the ever-toxic rhetoric being spewed by some American politicians has not only led to an atmosphere of nearly unprecedented division in the U.S. but, more chillingly, has also emboldened and empowered hate-mongers to execute the sort of mass murder that resulted in the deaths of 11 Jews( HYPERLINK https://montrealgazette.com/news/world/shooting-victim-melvin-wax-remembered-as-sweet-sweet-guy/wcm/16983626-dd6d-44cb-b611-31ce274c8fa0 https://montrealgazette.com/news/world/shooting-victim-melvin-wax-remembered-as-sweet-sweet-guy/wcm/16983626-dd6d-44cb-b611-31ce274c8fa0 ) at Pittsburgh's Tree of Life synagogue. Columnist Bill Brownstein files this commentary: Actions speak as loudly - and as frighteningly - as words( HYPERLINK https://wp.me/p4Uzqt-5Frw https://wp.me/p4Uzqt-5Frw  On Aug. 20, 2015, organized crime investigators got a rare glimpse inside Montreal's underworld as three men alleged to be the most powerful gangsters in the city discussed business in a room they assumed could never be bugged. Paul Cherry files this report: Police recordings provide rare glimpse inside Montreal's underworld( HYPERLINK https://wp.me/p4Uzqt-5FCu https://wp.me/p4Uzqt-5FCu )  Snow-removal contractors are objecting to Montreal's plan to require side guards on heavy trucks used for city contracts. The Association des entrepreneurs de d\'c3\£9neigement du Qu\'c3\£9bec says side guards - metal bars mounted on the sides to prevent pedestrians and cyclists from being run over by the rear wheels - don't necessarily prevent deaths and injuries. Marian Scott files this report: Snow-removal contractors protest plans to require side guards( HYPERLINK https://wp.me/p4Uzqt-5Fvn https://wp.me/p4Uzqt-5Fvn )  Officials confirmed Monday that Premier Fran\'c3\£7ois Legault will not be attending the United Nations annual summit on the environment in Poland, prompting Interim Liberal leader Pierre Arcand to say Legault is not living up to his promises. Philip Authier files this report: Fran\'c3\£7ois Legault slammed for skipping COP24 climate summit( HYPERLINK https://wp.me/p4Uzqt-5FBW https://wp.me/p4Uzqt-5FBW  The start of this year's flu shot campaign in Quebec has been mired in confusion. Read more here: CAQ vaccination flip-flops leave trail of confusion in Quebec( HYPERLINK https://wp.me/p4Uzqt-5Fru https://wp.me/p4Uzqt-5Fru  A S\'c3\'bbret\'c3\£9 du Qu\'c3\£9bec investigator was convicted of fraud on Monday after a Quebec Court judge determined he lied in order to continue collecting a salary while claiming to be too depressed to do police work even though he was very busy running four travel agencies. Paul Cherry files this report: S\'c3\'bbret\'c3\£9 du Qu\'c3\£9bec investigator convicted of fraud after claiming depression( HYPERLINK ) !@COPYRIGHT=\£9 2018 Postmedia Network Inc. All rights reserved. \"
"COP24","Canada","COP24_Canada53","We can no longer afford to wait to tackle climate change","December 4, 2018 Tuesday","Peterborough This Week","As the world begins COP24 , the UN international conference in Poland to reduce greenhouse gases (GHGs), the need to act quickly underlies all negotiations. The urgency for action on climate change has ramped up enormously in the last two months; the crisis has gone from ""sometime in the future"" to action required immediately to avoid catastrophe, with several major reports saying that the world has only about ten years to make dramatic cuts in greenhouse gas emissions to avoid a catastrophe. An August article in the Proceedings of the National Academy of Sciences (USA) examined global tipping points that, once started, could fall like a row of dominoes affecting ""the Earth System for tens to hundreds of thousands of years and potentially lead to conditions that resemble planetary states that were last seen several millions of years ago, conditions that would be inhospitable to current human societies and to many other contemporary species."" It showed that the world had only ""one to two decades"" to act aggressively before we lose total control over climate change. This was followed by the October report of the UN's Intergovernmental Panel on Climate Change (IPCC) that showed that the world has only about 12 years to reduce its GHGs by 45 per cent and to zero by 2050, to keep the global temperature rise below 1.5 degrees. Above 1.5 degrees and the effects of climate change will be disastrous for the world. Bringing the problem closer to home, the prestigious Lancet health journal states in its November 2018 report that in 2015, Canada experienced 7,142 deaths from exposure to human-produced air pollution from fossil fuels in 2015 - resulting in a loss in economic welfare for Canadians valued at approximately $53.5 billion. This is almost three times Canada's predicted federal deficit of $19.4 billion in 2019. An August study shows that Canadians and Saudi Arabians are the worst per capita polluters in the G20, and among the worst in the world. It also shows that Canada is not on track to meet its international agreement on GHG reductions. Finally - and this is the good news - a September report commissioned by seven countries, including Norway, South Korea, Sweden and the United Kingdom, shows that acting aggressively to reduce greenhouse gases within the next three years will generate a $26 trillion economic global windfall, create 65 million new jobs, and avoid 700,000 early deaths linked to air pollution. All these reports show that aggressive action to reduce greenhouse gases must start immediately, but the benefits from quick action enormously outweigh any temporary economic costs. Canadians must push our governments at all levels to respond quickly: ten years to act is barely two electoral cycles. Alan Slavin is professor emeritus, physics and astronomy, at Trent University. \"
"COP24","Canada","COP24_Canada54","""Fridays for the Future"" come to Canmore","March 13, 2019 Wednesday","Bow Valley Crag & Canyon","Students from Canmore Collegiate High School will join counterparts from across Canada and around the world March 15, with a ""March on Climate"", calling for government action on climate change. Organized by CCHS's Green Club, the ""Friday for the Future"" action is inspired by Swedish student Greta Thunberg, whose solo strike before the Swedish Parliament in August 2018 to protest government inaction on climate change has gone viral. At the December 2018, 24 th Conference of the Parties ( COP24 ) to the United Nations Framework Convention on Climate Change, Thunberg demanded that world leaders tell the truth about our climate crisis and present policies that are consistent with the findings of climate scientists, rather than what seems politically ""realistic."" Her Friday strike action has become global, with March 15 events planned in 54 countries (FridaysForFuture.org). Students are demanding government policies to limit global warming to less than two degrees Celsius and pursue efforts to limit the rise to 1.5 degrees Celsius, in line with their commitments under the 2015 Paris Agreement on Climate Change Ali Gourley, leader of CCHS'Green Club, said in a recent interview, ""It is our responsibility as young people to create a future that is sustainable; to create positive change."" The CCHS action will focus on local concerns in the Bow Valley: composting and waste management that, on a large scale, contribute to climate change. Gourlay believes that residents living near and within national parks have a special responsibility to protect them. The region has become a popular tourist destination because of its immense beauty, she says, putting pressure on wildlife and the physical environment. At the same time, ""this creates impetus for town to do more, set a higher standard of environmental sustainability, greenness. Gourley doesn't believe in being pessimistic. A small group of determined people can take on something big, she says, and last year she decided to take on something big: make CCHS more environmentally sustainable. She and colleague Isobel Hendry succeeded in securing funds to install 78 solar panels at the collegiate and the base to support a further 201 panels. Once fully built out, solar panels will provide 14% of the school's annual energy usage. Fundraising continues to complete the project, with KCP Energy donating the 10 th panel for every nine the students raise. While she is ""hesitantly optimistic"" about the future, Gourley says, ""we are going to have to deal with the inevitability of 1.5 C warming. We need to think collectively to achieve a more balanced future. It is important to get people talking about climate change to inspire action."" \"
"COP24","Canada","COP24_Canada55","It's official: The climate change outlook is dire. So, what happens next?","October 10, 2018 Wednesday","Postmedia Breaking News","Now that the bad news has dropped, what is the world going to do? A report issued Sunday by 91 scientists painted a stark portrait of how quickly the planet is heating up and how serious the consequences are. In response, the UN secretary-general, Ant\'f3nio Guterres, warned world leaders, ""Do what science demands before it is too late."" The latest figures from the International Energy Agency don't suggest that many are listening: Carbon dioxide emissions from the energy sector continued to grow through 2017, with a projected rise for 2018, according to the agency. The next two months will be crucial. In December, experts and officials from around the world will gather in Katowice, Poland, for a new round of international climate negotiations. - What about the Paris Agreement? Every country agreed, nearly three years ago, to set its own targets to bring down its greenhouse gas emissions. That's the good news. The deal specifically aspired to keep warming well below 2 degrees Celsius (3.7 degrees Fahrenheit) from preindustrial levels. And, it was worded in such a way that countries would, over time, have to get more ambitious in their emissions reductions. That's not going well. And it's not just because the Trump administration announced its intention to pull out of that deal. The United States, history's largest polluter, is nowhere close to meeting its emissions reductions targets. Russia, one of the world's largest emitters, has not yet ratified the Paris Agreement. Brazil's greenhouse gas emissions have grown recently, mainly because large swathes of forest were converted to farmland, and the leading contender in Brazil's presidential election, Jair Bolsonaro, has suggested pulling his country out of Paris deal, too. Australia also appears unlikely to meet its targets under its new prime minister, Scott Morrison, a champion of the country's coal mining industry. Water escapes from pipework as a giant excavator operates at the open pit lignite mine, operated by RWE AG, in Hambach, Germany, on Friday, Oct. 5, 2018. With rich countries falling short, some developing countries are starting to balk. Where's the fund you promised to help us cope, they want to know. The United States, under President Donald Trump, has backed out of contributing what had been its share to the Green Climate Fund, designed to help poor countries deal with the effects of climate change. The Australian prime minister this week dismissed the fund, too, saying, ""I'm not going to spend money on global climate conferences and all that nonsense."" - What's the next step? The report Sunday, by the Intergovernmental Panel on Climate Change, looms over the December talks in Katowice, in the heart of Poland's coal belt. Whether and how the report shapes the content of the negotiations is being fought over. Some countries would prefer to keep the discussions limited to technical issues, like what kinds of rules should be established to implement the Paris accord. Others, led by small island countries like the Marshall Islands, want the meeting to go much further and consider tougher emissions targets. History will remember this @IPCC_CH( HYPERLINK https://twitter.com/IPCC_CH?ref_src=twsrc%5Etfw https://twitter.com/IPCC_CH?ref_src=twsrc%5Etfw ) report as the moment the world's leading experts alerted decision-makers to a fast-closing window of opportunity to avoid catastrophic climate change. pic.twitter.com/Dnn1dCnysY( \~ HYPERLINK https://t.co/Dnn1dCnysY https://t.co/Dnn1dCnysY ) - Dr. Hilda C. Heine (@President_Heine) October 9, 2018( HYPERLINK https://twitter.com/President_Heine/status/1049575031699849216?ref_src=twsrc%5Etfw https://twitter.com/President_Heine/status/1049575031699849216?ref_src=twsrc%5Etfw ) The European Union on Tuesday signalled that it may put higher ambitions on the table, saying the report made it ""a matter of extreme urgency to strengthen the global response to the threat of climate change."" - What would it take to avoid the worst? There is wide consensus among scientists that a few big things need to happen, and many policymakers know it, too. They include switching electricity supply systems from coal, weaning cars and trucks off gasoline, and saving forests, because they're a big carbon sink. There's also wide agreement that there should be a price on pollution, in the form of a carbon tax. All of that has been on the table for quite some time. As President Emmanuel Macron of France pointed out on Twitter, ""The IPCC brings scientific proof: We have everything we need to combat climate change. But everyone has to act now!"" The #IPCC( HYPERLINK https://twitter.com/hashtag/IPCC?src=hash&;ref_src=twsrc%5Etfw https://twitter.com/hashtag/IPCC?src=hash&;ref_src=twsrc%5Etfw ) brings scientific proof: we have everything we need to combat climate change. But everyone has to act now! #OnePlanetSummit( HYPERLINK https://twitter.com/hashtag/OnePlanetSummit?src=hash&;ref_src=twsrc%5Etfw ) @ COP24 HYPERLINK https://twitter.com/COP24?ref_src=twsrc%5Etfw https://twitter.com/ HYPERLINK COP24 ?ref_src=twsrc%5Etfw HYPERLINK https://twitter.com/UNFCCC?ref_src=twsrc%5Etfw https://twitter.com/UNFCCC?ref_src=twsrc%5Etfw ) \~ HYPERLINK https://t.co/IiEOVdrgt1 https://t.co/IiEOVdrgt1 HYPERLINK https://t.co/IiEOVdrgt1 https://t.co/IiEOVdrgt1 - Emmanuel Macron (@EmmanuelMacron) October 8, 2018( HYPERLINK https://twitter.com/EmmanuelMacron/status/1049290972230823937?ref_src=twsrc%5Etfw https://twitter.com/EmmanuelMacron/status/1049290972230823937?ref_src=twsrc%5Etfw ) Why is this hard? There are political headwinds of various kinds. In the United States, Charles and David Koch, libertarian billionaire brothers with deep interests in the fossil fuel sector, have handsomely funded efforts to block a carbon tax. In Brazil, the powerful agribusiness lobby, buoyed by global demand for soybeans, has pushed to convert more forest land into farmland. In Canada, Prime Minister Justin Trudeau's carbon tax proposal faces intense pushback from the provinces. And China, as the factory of the world, keeps burning coal to feed its manufacturing sector. Kelly McParland: Climate change measures not working? Blame the activists( HYPERLINK https://nationalpost.com/opinion/kelly-mcparland-climate-change-measures-not-working-blame-the-activists https://nationalpost.com/opinion/kelly-mcparland-climate-change-measures-not-working-blame-the-activists ) Stop using misleading images of polar bears and droughts to raise awareness of climate change, psychologists say( HYPERLINK https://nationalpost.com/news/world/scientists-should-stop-using-misleading-images-of-polar-bears-and-droughts-to-raise-awareness-of-climate-change-psychologists-say https://nationalpost.com/news/world/scientists-should-stop-using-misleading-images-of-polar-bears-and-droughts-to-raise-awareness-of-climate-change-psychologists-say ) The one difference with China is that, for the sake of domestic political stability, China's leaders are eager to clean up the air. China is expected to reach peak emissions in 2050. The question is when does that political tipping point come for other countries? And does the science matter at all? ""There's a big gap between what the science requires and what governments are delivering,"" said Mohamed Adow, who follows climate change for Christian Aid, a London-based development charity. He called the IPCC report ""a game changer."" ""There's no excuse for governments anymore,"" he said. !@COPYRIGHT=\£9 2018 Postmedia Network Inc. All rights reserved. \"
