"COP","country","ID","title","date","source","text"
"COP25","Bangladesh","COP25_Bangladesh20","COP25: Climate negotiations extended by one day","December 14, 2019 Saturday","United News of Bangladesh","Scheduled to end on December 13, the Climate negotiations were extended by one day as representatives of 200 countries failed to reach any decision over issues related to damage, finance and Article 6.The final meeting of ministers on Saturday evening will ultimately decide the outcome of this climate summit.The President for the conference, Ms Carolina Schmidt, Minister of Environment of Chile, started the consultation meeting on Thursday evening and listened to the objections countries had on particular issues.During the meeting that lasted till Saturday morning, it was found out that almost all the countries had their objections on the three main issues of this climate conference, namely Article 6, loss damage and finance.If none of the countries raise any objections at the last minute on those decisions, the announcement might be made on the summary of results of this Madrid climate conference.After talking with the members of Bangladesh delegation, it was learnt that a decision may be reached on loss and damage, the main issue for the affected countries including Bangladesh at the climate summit.However, the decision will only be on making the Warsaw International Mechanism effective and the developed countries will not take any responsibility for damage due to climate change, members of Bangladesh delegation said.According to Md Ziaul Haque, Director, Department of Environment and a negotiator of the Bangladesh team, the three main agendas of this climate conference are loss and damage, finance and Article 6.'Discussions on these issues are continuing till the last moment and ministers have been given the responsibility to reach a consensus. Issues that have not reached any consensus will be transferred to the next climate conference,' he explained.Md Ziaul Haque feels the biggest achievement of this climate conference will be in the context of loss and damage.'We wanted the developed countries to pledge a specific amount of fund for long-term financing. But those countries have not agreed on a specific amount,' he added.\l"
"COP25","Bangladesh","COP25_Bangladesh21","73 Countries Commit to Net Zero CO2 Emissions by 2050","January 15, 2020 Wednesday","Energy & Power","P#44#PThe Presidency announced additional commitments within the Climate Ambition Alliance. Chile's Minister of Environment Carolina Schmidt said 73 parties to the UNFCCC, 14 regions, 398 cities, 768 businesses and 16 investors are working to achieve netzero CO 2 emissions by 2050.The UN Secretary-General said he is 'deeply encouraged by the growth' in the Alliance, and major emitters will be a top priority between now and COP 26.The Chilean Presidency of the 25th session of the Conference of the Parties (COP 25) to the UNFCCC announced a renewed Climate Ambition Alliance, in which participating countries commit to accelerate action by 2020 and achieve net zero carbon dioxide (CO 2 ) emissions by 2050. UN Secretary-General Ant\'f3nio Guterres asked Chile to lead the Climate Ambition Alliance in the context of government's role as the original host of COP25. During the September 2019 UN Climate Action Summit, President of Chile Sebasti\'e1n Pi\'f1era launched the Alliance to accelerate the transformation needed to meet the goals of the Paris Agreement on climate change and stabilize the global average temperature rise at 1.5\'b0C above preindustrial levels. In addition to 73 UNFCCC parties, 14 regions, 398 cities, 768 businesses and 16 investors are working to achieve net-zero CO2 emissions by 2050.\l"
"COP25","Bangladesh","COP25_Bangladesh22","COP25 and climate-anxiety: What can be done?","January 29, 2020 Wednesday","The Financial Express (Bangladesh)","Bangladesh, Jan. 29 -- The recently held Madrid Climate Meeting marked 25 years of the Conference of the Parties (COP), a UN Framework Convention for Climate Change signed in 1992 by 165 signatory nations. Despite agreement that the planet Earth is facing a ""climate emergency,"" the COP25, which was billed as the Action COP, delayed any real climate action. Indeed, after the first few COPs that were constructive and hopeful, the fossil fuel producers such as the United States, Australia, Saudi Arabia, Kuwait, Brazil and Russia and the carbon-emitting countries captured the COP process. The apparent actions from the processes are more delays.The long-term goal of the Paris Agreement (COP2015) is to keep the increase in global average temperature well below 2 degree celsius above the pre-industrial level and to limit the increase to 1.5 degree celsius. This urgent action to combat climate change is intrinsically linked to the 2030 Agenda for Sustainable Development. The spirit of the Paris Agreement is now slowly eroding from one COP to another. With no tangible action, the planned extractions of coal, oil and gas are enough to blow past the 1.5 degree celsius target or even 2.0 celsius by 2030.The harsh truth is that the world is getting increasingly warmer, and extreme weather events such as glacier meltdown, forest fires, flood, cyclones etc., are on the rise globally. The climate impacts and anxiety are felt by all, particularly the world's most vulnerable and innocent people being at the receiving end as victims. Island countries like the Maldives, Tuvalu and Kiribati are sinking due to rising sea level. The Intergovernmental Panel on Climate Change has identified Kiribati as one of the six Pacific Island countries most threatened by rising sea level, and thus would likely become uninhabitable as early as 2050.Rising sea level, drought and crop failure are expected to force tens of millions of people to migrate within their countries as ""internal climate migrants"" by 2050. A2018 World Bank study found that 143 million people across South Asia, sub-Saharan Africa and Latin America are at risk of the effects of ""slow-onset"" of climate change. ""Every day, climate change becomes a more urgent economic, social, and existential threat to countries and their people,"" observes World Bank CEO Kristalina Georgieva in her introduction to the 2018 Study.With the climate crisis worsening and the declaration of climate emergency by the climate scientists, the climate-anxiety - for instance, the fear of sea level rise, the horrific forest fires in Australia, displacement due to disasters, loss of homes and livelihoods, stress, helplessness, a sense of loss of control and the potential for a catastrophic future - has become prevalent beyond the physical world into mental health and well-being, according to a recent report issued by the American Psychological Association (APA). The report urges to address the core causes of and solutions for the changing climate, and building and supporting psychological resilience.In Bangladesh, climate-anxiety is very evident in physical, economic, social and existential terms. Prime Minister Sheikh Hasina, in a recent statement in Parliament, said that some 40 million people from 70 upazilas and 19 districts of the country are at the risk of displacement due to climate change (recent revised estimates, however, put the figure between 15 and 20 million). The PM reiterated her commitments to fighting against climate disasters, giving vivid descriptions of the various impacts such as higher average temperature by one degree celsius in May and 0.5 degree celsius in November, increase in average rainfall and other weather events, outbreak of different insect-borne diseases, and increased salinity of river water up to 100 km from the coastl"
"COP25","Bangladesh","COP25_Bangladesh23","Create framework to address needs of climate migrants: PM at COP25","December 2, 2019 Monday","United News of Bangladesh","Prime Minister Sheikh Hasina on Monday urged the international community to initiate discussions on creation of an appropriate framework to address the needs of the people who got displaced due to climate change.'We must appreciate that migration could be an effective adaptation strategy, as we focus on enhancing adaptation capacities of affected communities. Hence, relocation and protection of displaced persons need due focus in global discourse to ensure their protection. We need to commence discussions on creation of an appropriate framework to address the needs of people displaced due to climate change,' she said.The Prime Minister made the call while addressing the Action for Survival: Vulnerable Nations COP25She said it is widely accepted that the gravest effect of climate change may be on human migration. Extreme weather events are already displacing many more people than violent conflicts. Slow-onset events like sea-level rise and desertification get even lower global focus. 'We must work towards correcting this imbalance.'Pointing at the leaders of Climate Vulnerable Forum (CVF), Sheikh Hasina said, 'We now have a situation where the most vulnerable countries, which deserve the highest level of priority, are failing to access whatever support that is being realized.'She said creation of a new CVF and V20 Trust Fund and possibility of having a new Special Rapporteur on climate change would be a great success.Noting that CVF and V-20 are great examples of South-South and Triangular cooperation, she said, 'We want to further build on the current accomplishments. The time is now to act as we're at the most important crossroad of human history confronting possibly the gravest global challenge of our time.'She said climate change has now become an existential threat for every country, especially for the climate vulnerable countries like Bangladesh.With more than 1.1 million Rohingyas from Myanmar causing all sorts of environmental havocs, Bangladesh already has the firsthand experience of the worst kind of environmental calamity, she said.'We must therefore establish a set of criteria to prioritize vulnerable countries based on their risks, impacts and lack of coping capacities. We also want to keep the climate change support and the regular development finance strictly separate,' she added.Hasina said major emitters show extreme reluctance on mitigation, which may wreck the international climate regime and put the climate vulnerable countries like Bangladesh at the risk of peril. 'Hence, we shouldn't hesitate to demand accountability for inaction.''We're also looking towards the 2020 Climate Adaptation Summit in the Netherlands to strengthen our adaptation efforts. And Bangladesh is ready to take the responsibility of the Presidency of the Forum if the Members kindly agree to honour us with this task,' she said.The Prime Minister said climate change is a stark reality for the world. It has now caused irreversible damages to human life and environment, ecology and natural resources, she said.Since the Earth Summit in 1992, it has not been able to secure much progress in the reduction of greenhouse gases and their emission is still on the rise, she said adding that this trend is now unsustainable for the Earth.'We, the vulnerable countries, suffer the most due to our limited coping capacities and specific geographical features. We're bearing the brunt of the damage though we made negligible or no contribution to the menace. This constitutes a serious injustice and must be acknowledged by the global community,' said the Prime Minister.Unfortunately, she said, the progress under the UNFCCC (United Nations Framework Convention on Climate Change) process is very slow and largely inadequate. There's still hardly any move to support nationally determined adaption initiatives undertaken especially by our vulnerable countries, the PM added.Different funds created for different purposes lack availability of the required capital, she pointed out.'Often direct and easy access to funds and technology along with conditions and criteria seem to favour mostly the countries that already have acquired greater capacities,' Hasina told her audience.UN Secretary General Antonio Guterres, Dutch Prime Minister Mark Rutte, Costa Rica President Carlos Alvarado Quesada, Marshall Islands President Hilda Heine, Executive Secretary of UNFCCC Patricia Espinosa and UN High Commissioner for Human Rights Michelle Bachelet Jeria, among others, spoke at the event.\l"
"COP25","Bangladesh","COP25_Bangladesh24","COP25: Climate crisis has reached the point of no return","December 16, 2019 Monday","The Financial Express (Bangladesh)","Bangladesh, Dec. 16 -- From the Editorial desk: Our columnist Muhammad Zamir's write-up on COP25 covers developments in climate negotiations up to Friday, December 13. BBC reports from Madrid on Sunday: ""The longest United Nations climate talks on record have finally ended in Madrid with a compromise deal. Exhausted delegates reached agreement on the key question of increasing the global response to curbing carbon. All countries will need to put new climate pledges on the table by the time of the next major conference in Glasgow next year. Divisions over other questions - including carbon markets - were delayed until the next gathering. After two extra days and nights of negotiations, delegates finally agreed a deal that will see new, improved carbon cutting plans on the table by the time of the Glasgow conference next year.""At the United Nations climate negotiations in Madrid have re-emerged old splits between rich polluters and developing nations over who should slash greenhouse gas emissions by how much, and how to pay the trillions needed to live in a climate-addled world.The specific aim of the Madrid negotiations was to finalise, if possible, the rulebook for the 2015 Paris climate accord, which enjoins nations to limit global temperature rises to ""well below"" two degrees Celsius. However this effort does not appear to have clearly succeeded. This failure in moving forward was denotated through a comment made by Spain's Minister for Energy and Climate change Teresa Ribera: ""There are those that want to move quicker and those that want to hide behind things which aren't working, so as not to advance."" The talks however received a shot in the arm on December 13 after the European Union (EU) pledged to make the bloc carbon-neutral by 2050. Nevertheless, this much-heralded decision was immediately undermined by the refusal of Poland-a major emitter-to sign on.This meeting in Madrid has however signalled the need to find least common denominators that would have to be agreed upon through frantic 12 months of negotiations that will culminate in Glasgow with COP26 in November 2020.The seriousness of the existing situation pertaining to climate change, adaptation and mitigation measures was outl"
"COP25","Bangladesh","COP25_Bangladesh25","Coal dilemma brings a bad name for Japan","December 20, 2019 Friday","Dhaka Courier","Dhaka, Dec. 20 -- In the 1990s Japan was seen as a pioneer country in the world on protecting the environment. Strict environment related laws were put into practice after a series of disastrous incidents due to random industrialization of 1960s caused widespread health problems; and the country played a crucial role in the conclusion of Kyoto Protocol, the first international agreement aimed at salvaging the mother earth from the salvo of random development initiatives without considering what impact that might have on the atmosphere and our surroundings. The Protocol was seen as a first major step in realizing the danger that our endless pursuit for economic growth poses to our own survival and outl"
"COP25","Bangladesh","COP25_Bangladesh26","COP25 Sees Launch of New pound 18m Hydropower Initiative","January 15, 2020 Wednesday","Energy & Power","P#38#PA major new energy innovation project to demonstrate how smart hydropower technologies can deliver a low-carbon, reliable and resilient power system was launched at the United Nations (COP25) in Madrid, Spain. The pound 18 million initiative was announced by the European Commission and a consortium of 19 partners, including the International Hydropower Association.The XFLEX HYDRO (Hydropower Extending Power System Flexibility) project is a four-year initiative by utilities, equipment manufacturers, universities, research centers and consultancies. It will demonstrate how modern hydropower plants can provide the vital power grid services required by variable renewables such as wind and solar power.The launch comes after a UN Emissions Gap Report looking at ways to reduce global carbon emissions said that greater power system flexibility was 'key' to integrating larger shares of variable renewable energy into the power supply.The project will conclude in 2023 by delivering a roadmap to increase adoption of the technologies across the hydropower fleet, with policy and market recommendations for governments, regulators and industry.\l"
"COP25","Bangladesh","COP25_Bangladesh27","\u8216 Work on Paris Agreement Implementation Can Be Completed in Madrid\u8217 ","December 15, 2019 Sunday","Energy & Power","The implementation of Paris Agreement is expected to start in 2020. For that to happen, all unresolved matters need to be resolved at COP25. I believe we can achieve those in Madrid, Spain.The world community with enabling political will can achieve this through negotiation. I think America has committed a mistake through walking out of the Paris Agreement. Rest of the world remains sincerely committed to the agreement. I believe America would also return to the negotiation. Dr. S.M. Munjurul Hannan Khan, Additional Secretary of the Ministry of Environment, Forest and Climate Change, said this in an exclusive interview with Energy and amp;amp; Power Editor Mollah Amzad Hossain.The Rules Book could be finalized during the extended time of COP24 at Katowice. What is Bangladesh \' s expectation from ? Please note that the Rules Book could not be finalized as yet in entirety. It is expected to be completed at the COP25. Here through negotiation, decisions would be taken about the modality of the NDC implementation, the limit of carbon emission of each party, whether or not carbon emission limit would be mandatory.The decision for getting the grant, not loan, for the countries impacted by climate change would be firmed up. The discussion about loss and damage started from the Warsaw Conference. This will be finalized in Madrid. It is worth mentioning that all unresolved issues need to be agreed at COP25 if implementation of Paris Agreement is to start from 2020. I am well and truly optimistic about the outcome of COP25. Bangladesh will continue its endeavor in different forum for achieving the success.The COP25COP25? Do you think present stand of America has put into challenge? Withdrawal of America means they cannot participate in any negotiation of COP25. But I think it is a wrong decision of America. We must bear in mind America is not the entire world. There is no other option for restricting global warming below I.5 Degree Celcius. Rest of the world is unanimous about this. I believe America would have to return. There is no other option but to implement Paris Agreement. Around US$100 billion was supposed to have been accumulated in Green Climate Fund (GCF). But till last year not much has been achieved. But in the UN climate summit, many countries have given fresh pledge for donating money. What kind of success you are expecting about this at COP25? Implementation of Paris Agreement cannot start till GCF becomes fully operational. GDF must come to light in full at COP25. I am optimistic that GDF would get US$100 billion by 2020. In subsequent years, US$100 billion would continue pouring in. On the other hand, rules and guidel"
"COP25","Bangladesh","COP25_Bangladesh28","TIB expresses concern","December 25, 2019 Wednesday","The Financial Express (Bangladesh)","Bangladesh, Dec. 25 -- The Transparency International, Bangladesh (TIB) expressed concern about uncertainty of climate financing in UN Climate Change Conference (COP25) in Madrid of Spain.There was no certain development in the long-run climate financing, addressing loss and damage caused by climate change effects, and initiatives to cut global warming, it added.It also added that there was no sign of meeting the commitments of 'Intended Nationally Determined Contributions - INDC' to reduce global temperature and the rulebook was not finalised to meet the draft Paris agreement that had been made in COP24.The anti-corruption watchdog mentioned those at a media statement on Tuesday.Besides, it also expressed concerns over the plan of expanding insurance and other profit oriented private enterprises to support the vulnerable countries affected by climate change effects.TIB Executive Director Dr Iftekharuzzaman said in the statement that the issue of meeting the commitments made by developed countries of releasing US$ 100 billion as 'new' and dditional' supports to address global warming was not discussed in COP25 which is making the long-term climate financing uncertain.Dr Iftekharuzzaman expressed his dissatisfaction over the move in the COP25. HYPERLINK mailto:nsrafsanju@gmail.comnsrafsanju@gmail.comPublished by HT Digital Content Services with permission from The Financial Express. For any query with respect to this article or any other content requirement, please contact Editor at HYPERLINK mailto:contentservices@htlive.comcontentservices@htlive.com\l"
"COP25","Bangladesh","COP25_Bangladesh29","PM flies to Madrid tomorrow","November 30, 2019 Saturday","The Financial Express (Bangladesh)","Bangladesh, Nov. 30 -- Prime Minister Sheikh Hasina leaves Dhaka for Madrid, Spain, tomorrow (Sunday) morning to attend the 25th session of the Conference of the Parties (COP25) to be held from December 2-13 under the UN framework convention on climate change.A special flight of Biman Bangladesh Airl"
