"COP","country","ID","title","date","source","text"
"COP25","Bangladesh","COP25_Bangladesh1","COP25: CSO expects effective govt role","November 26, 2019 Tuesday","United News of Bangladesh","Civil Society Organizations (CSOs) on climate advocacy networks on Tuesday sought an effective role of the government in the upcoming the United Nations (COP) scheduled to be held in Madrid of Spain in December.They made the remarks at a press conference at the Jatiya Press Club.The speakers suggested that the government lead a separate mechanism for Displacement and Migration at United Nation Framework Convention on Climate Change (UNFCCC).They also recommended raising voice to ensure easier financial access to Green Climate Fund (GCF) as the most vulnerable country (MVC).In the keynote presentation, Syed Aminul Hoque from EquityBD insisted that developed countries increase their mitigation action target based on latest Intergovernmental Panel on Climate Change (IPCC) report on reducing global warming.He also suggested developing the framework on implementing market based mechanism on 'Mitigation Outcome International Transfer' (Article 6 of PA) under UNFCCC process and followed by accountability, Transparency principle.Md Ziaul Hoque Mukta of Center for Sustainable Rural Livelihood (CSRL), Md Mostafa Kamal Akand of COAST Trust, Md Shamsuddoha from Center for Participatory Research and Development (CPRD), Kawser Rahman of Bangladesh Climate Journalist Forum (BCJF) and Md Badrul Alam of Krishak Federation and Atiqur Rahaman Tipu of Coastal Development Partnership also spoke at the briefing.\l"
"COP25","Bangladesh","COP25_Bangladesh2","PM flies for Spain today to join COP25","December 1, 2019 Sunday","The News Today (Bangladesh.)","Prime Minister Sheikh Hasina will leave Dhaka for Madrid today on a three-day official visit to Spain to join the ""Heads of State and Government Summit"" of the 25th Annual Conference of Parties (COP25).COP25 of the United Nations Framework Convention on Climate Change (UNFCCC) will be held on December 2-13 in Madrid under the Presidency of Chile and with logistical support from Spain. A Biman Bangladesh Airl"
"COP25","Bangladesh","COP25_Bangladesh3","Tepid COP25: Failure is not an option at COP26","December 22, 2019 Sunday","The Financial Express (Bangladesh)","Bangladesh, Dec. 22 -- After a disappointing 2019 United Nations , there is a need to restore confidence that the intergovernmental process can deliver on mitigation, adaptation, and finance.The 2019 United Nations Climate Change Conference, also known as COP25, that recently concluded in Madrid, was expected to put in place the final piece of the rulebook for the historic Paris Agreement, which was designed to address greenhouse-gas-emissions mitigation, adaptation, and finance.The meeting also was meant to set the stage for enhanced pledges by countries in 2020 to work toward keeping global temperature increase below 2.0 degrees centigrade, preferably 1.5 degrees.Instead, the world witnessed a prolonging of the negotiation process, and an unwillingness to compromise for the greater good. The current pledges by countries, as inscribed in their climate pledges, also called nationally determined contributions or NDCs, have set us on the path to a temperature increase of 3.2 degrees in this century.The world is already witnessing the impact of 1.1-degree centigrade temperature above pre-industrial levels. The recurring droughts and floods in some regions, as well as increased intensity and frequency of extreme events, foreshadows apocalyptic events that we may witness as a result of climate change. To meet the goal of no more than 1.5-degree centigrade temperature rise, current emissions have to be halved by 2030.The reluctance to commit to higher ambition and action is driven by economic and political considerations, as well as social upheavals. Perhaps the ambiguity in action stems from 1992, when the UN Climate Convention was labelled as a framework, a high-level umbrella document with principles and overarching objectives that signaled political will for action, with room for maneuvering at a later stage to reach a consensus on detailed actions.This gave countries the flexibility to develop national policies and action plans based on common but differentiated responsibilities. This arrangement has enabled learning and evaluations and subsequent ratchetting up of action. But it has also left space for uncertainty as circumstances change in countries amid shifting power and trade dynamics and relationships.At COP25Consequently, proposals relating to transitioning to new carbon markets floundered with one group of countries rightfully insistent on ensuring environmental integrity. Associated with this was the direction of shares of proceeds from the cooperative approaches under the new markets that would ensure automatic funding for the Adaptation Fund.On the other hand, the group of vulnerable countries that have borne the brunt of climate impacts were seeking a mechanism to compensate them for these losses and damages. The issue of compensation has been an impasse for many years now, and the compromise yet to be negotiated.The elephant in the room is the financing of action in developing countries and the target of $100 billion in financial flows from developed to developing countries by 2020 that was agreed at COP15. The OECD (Organisation for Economic Cooperation and Development) estimates that climate finance provided and mobilised by developed countries for developing countries in 2017 reached a little over $71 billion. But what developing countries want at this stage is an early assurance that, as agreed in Paris, a new financing commitment will be agreed to by 2025. So far, there have been no concrete signals that this will happen.The upcoming presidency of COP26 by the United Kingdom will have to untie the proverbial Gordian Knot of the negotiations. Future commitments to financing, as expected, would hold the key to encouraging deeper and wider action. Facilitating a dialogue within the Group of 77 and People's Republic of China grouping on how to narrow the divergent interests in this bloc is needed. On one side will be the big emitters, and on the other the small island developing states, least developed countries, and other vulnerable countries.The Article 6 conundrum will need to be resolved through a more nuanced and perhaps staged approach. A lot will ride on the United Kingdom's leadership in the coming year to coalesce and converge diverse interests on the intractable issues.The most important objective will be to restore confidence that the intergovernmental process can deliver. Failure is not an option at COP26.Preety Bhandari is responsible for providing policy and strategic direction to the Asian Development Bank'sclimate change programme. HYPERLINK mailto:adbbrm@adb.orgadbbrm@adb.orgPublished by HT Digital Content Services with permission from The Financial Express. For any query with respect to this article or any other content requirement, please contact Editor at HYPERLINK mailto:contentservices@htlive.comcontentservices@htlive.com\l"
"COP25","Bangladesh","COP25_Bangladesh4","COP25 outcome frustrates TIB","December 24, 2019 Tuesday","United News of Bangladesh","Transparency International Bangladesh (TIB) on Tuesday expressed deep concern as the United Nation climate conference (COP-25) failed to make any significant progress to resolve the global problem.The UN Conference of the Parties (COP25) took place under the presidency of Chilean government at Madrid in Spain from December 2 to December 13.The developed countries pledged to provide additional $ 100 billion on adaptation in 2020 which never came on the discussion table of COP25, creating uncertainty about its long term funding, said TIB Executive Director Dr Iftekharuzzaman.No decision was made over forming separate fund for facing the loss and damage, he said, adding that the Intended Nationally Determined Contributions (INDC) was also not updated to reduce the global temperature, said a press release.Overall, the draft of the Paris Agreement (Rule Book) which was approved in COP24 failed to get finalisation in this year's conference, the TIB chief added.Every stakeholder had hoped that a decision will come on separate compensation fund under Warsaw International Mechanism and its regulation, work plan, and challenges will be identified in the conference, he said. 'But that never happened.'\l"
"COP25","Bangladesh","COP25_Bangladesh5","COP 25 served interests of polluters: Civil Society","January 4, 2020 Saturday","United News of Bangladesh","Terming the outcomes of COP25 frustrating, civil society members at a press conference in the city on Saturday said it served the interests of the polluters.The civil society members came up with the observation at a press conference titled 'Madrid Climate Conference and Civil Society Observations' moderated by executive director of of COAST Trust M Rezaul Karim Chowdhury.COP25 lost the trust of MVCs (Most Vulnerable Country) and LDCs (Least Developed Countries).They opined that the government needs to set its climate change strategies (especially Adaptation Strategies) with own capacity and resources.Syed Aminul Hoque, deputy director of COAST Trust, in his key note presentation said the negotiation in COP25 in Madrid ended amid disappointment as most of the important issues remained unsettled.Major emitters failed to come up with any plan to reduce Green House gasses by 2020 and broke their pledges over financing in Loss and Damage management as expected by MVCs and LDCs, he added.Executive director of Bangladesh Centre for Advanced Studies (BCAS) Dr Atiq Rahaman said the politics and fossil-fuel interests are taking place above people and the planet.The United States, Japan, Australia and Brazil once again exposed their unwillingness to save the millions of vulnerable people, he added.Executive Director of Center for Participatory Research and Development (CPRD) Md Shamsuddoh urged the government, educationists, experts and civil society members to take effective preparations through discussion for COP26 to be held in December 2020.\l"
"COP25","Bangladesh","COP25_Bangladesh6","PM to attend COP25 in Spain","November 21, 2019 Thursday","The News Today (Bangladesh.)","Prime Minister Sheikh Hasina will attend the 25th UN Climate Change Conference to be held in Madrid, Spain next month.The 25th session of the Conference of the Parties (COP 25) will convene from December 2-13, officials said adding that the Prime Minister is likely to be there in Madrid on a six-day visit. Earlier, Chile, citing the impact of the ongoing anti-government protests, announced that it was withdrawing as host of the upcoming COP25 annual climate summit. On the eve of COP25, the German Embassy in Dhaka, in collaboration with the British High Commission, British Council and GIZ launched a photo exhibition under the theme 'Climate Change -Time for Action' on Wednesday.The exhibition will remain open until December 5.COP25 has been encouraged to stand out with ambitious demands and commitment at the conference, it said. Environment, Forest and Climate Change Minister Md Shahab Uddin inaugurated the exhibition and also handed over the first prize to the winner of the photo competition. German Ambassador to Bangladesh Peter Fahrenholtz and the Charg\'e9 d' Affaires at British High Commission in Dhaka Kanbar Hosein Bor attended the function as special guests and handed over the prizes among other winners. Representatives from the government of Bangladesh, different diplomatic missions, UN missions and bilateral agencies, civil society, academia, news media and interested individuals from diverse background attended the event. Responding to a social media call for submission of photographs on the effects of climate change in the lives of people and the environment of Bangladesh many participants submitted their photographs. From the submissions 50 photos were chosen for the exhibition of which three won the prizes. A movie capturing stories of people moved to Dhaka from rural areas due to adverse impacts of climatic change was also shown during the exhibition.\l"
"COP25","Bangladesh","COP25_Bangladesh7","COP 25: Facing existential crisis of climate change","November 28, 2019 Thursday","The Financial Express (Bangladesh)","Bangladesh, Nov. 28 -- The 2019 United Nations Climate Change Conference (COP 25) is scheduled be held in the Spanish capital Madrid on December 2-13, 2019. The Conference of the Parties (COP) within the framework of the United Nations Framework Convention (UNFCCC) is a collective response of the international community to climate change. It is an Agreement of 196 countries and the European Union (EU) that establishes the basic obligations to stabilise greenhouse gas (GHG) concentrations in the atmosphere at a level that will prevent climate change. COP is the important annual international forum for taking stock of where the world stands as regards climate change and to discuss issues related to global warming caused by human activities.The COP 25 is targeting to resolve some of the remaining issues on the rules that the participating countries (parties) are to follow in their efforts to reduce GHG emissions. The meeting may announce new initiatives to respond to global warming to try to advance a global strategy for tackling rising global atmospheric temperatures. Also, COP 25 is expected to reach a consensus on funding for repairing damage of the climate crisis. The funding issue is especially important for the climate vulnerable, least developed and the small island nations. The landmark Paris Climate Change Agreement (signed in 2015) is scheduled to enter into force in 2020. Therefore, COP 25 becomes the prelude to the major world event and a lot of expectations have been created.In the backdrop of the increasing natural disasters and dwindling bio-diversity, the mainstream political parties in most countries have been compelled to respond on 'unequivocal' public concerns over climate change and human sufferings from global warming. The latest example is the UK election manifesto of the major political parties participating in the election where they have supported a transition to net zero GHG emission within a few decades and are competing with each other on the policies to attain the target. Despite the 'Brexit' debates hanging over the country, UK members of parliament (House of Commons) have unanimously passed (on April 30, 2019) a motion to declare an 'environmental and climate emergency'. Labour Party leader Jeremy Corbin, then leader of the opposition in parliament, tabled the motion and the House of Commons passed the bill. Earlier, parliaments of Scotland and Wales declared climate emergencies. Analysts consider that the approved nonbinding climate emergency motion in UK parliament was reached unanimously because thousands of people took to the streets for a sustained period of protests by a number of environmental groups, UK Student Climate Network, Friends of Earth and others including the school strikers led by Greta Thunberg.Bangladesh Jatiya Sangsad (Parliament) adopted a motion on November 13, 2019 declaring climate change and its fallout as 'planetary emergency'. The planetary emergency motion ahead of the upcoming COP 25 calls for the global community to act urgently and decisively in achieving the net zero (carbon) emissions well before 2050.Prime Minister Sheikh Hasina is scheduled to attend COP 25 which would be a good forum to present the 'planetary emergency' resolution adopted in Bangladesh Jatiya Sangsad and share views with the world community on how best the emergency can be addressed. The COP 25 forum may serve as an opportunity to discuss the issues related to 'planetary emergency' and help formulate plans and get support from the global community on implementing such plans. As Bangladesh is one of the most vulnerable hotspots for global climate change, it expects the global community to act urgently, decisively and with considerably higher ambition in achieving net zero emission well before 2050, capping temperature rise to 1.5 degree Celsius. Despite being least responsible for these problems, Bangladesh and many other countries in the developing world became the worst victims of climate change.The planetary emergency connects with the existential crisis of climate change, devastating impact of disasters and increase in extreme weather events, irreparable loss of biodiversity, looming food insecurity, rising water level, unprecedented pressure on oceans and unsustainable use of resources. The resolution calls for planetary justice and climate equity so that the climate vulnerable countries are assisted with finance and technology to meet their development aspirations in the shortest possible time.Mushfiqur Rahman is a mining engineer and writes on energy and environment issues. HYPERLINK mailto:mushfiq41@yahoo.commushfiq41@yahoo.comPublished by HT Digital Content Services with permission from The Financial Express. For any query with respect to this article or any other content requirement, please contact Editor at HYPERLINK mailto:contentservices@htlive.comcontentservices@htlive.com\l"
"COP25","Bangladesh","COP25_Bangladesh8","BD needs to build self-capacity combating climate change","January 5, 2020 Sunday","The New Nation (Bangladesh)","Dhaka, Jan. 5 -- Bangladesh needs to build self-capacity for combating climate change. Our duty is to implement the Paris Agreement in the latest COP25 conference to reach any consensus on ways, civil society members said.The alternatives can be reached through future development strategies and gaining competency to combat climate change, they said at a press conference in the Dhaka Reporters Unity (DRU) of the capital on Saturday. Coast Trust, in association with several other organisations, organised the press meet titled 'COP25 Climate Conference and the Observation of Civil Society'.In the COP21 in Paris in 2015, nearly 200 nations signed the climate deal in which each country provides its own goals to curb emissions of heat-trapping gases that lead to climate change.On December 2-13 last year, the longest 25th United Nations , also known as COP25, was held aiming to finalise the ""rulebook"" of the Paris Agreement - the operating manual needed when it takes effect in 2020 - by settling on rules for carbon markets and other forms of international cooperation.Due to discontent between the developed economies and the least developed countries, however, the talks were unable to reach agreement in many areas, pushing decisions into COP26 scheduled to be held next year in Glasgow, UK.In this context, speakers at the conference stressed for planning alternative strategies to continue and strengthening ongoing climate action plan for Bangladesh, and placed some recommendations in this regard.Hence, Bangladesh has to choose alternative ways of its own to combat climate change, they added.Published by HT Digital Content Services with permission from The New Nation. For any query with respect to this article or any other content requirement, please contact Editor at HYPERLINK mailto:contentservices@htlive.comcontentservices@htlive.com\l"
"COP25","Bangladesh","COP25_Bangladesh9","Dhaka to highlight future strategies on climate front at COP25","November 27, 2019 Wednesday","United News of Bangladesh","At the forthcoming Madrid climate conference, Bangladesh will highlight its 'future strategies' to overcome challenges posed by climate change to carve out a place for itself as a resilient economy.Prime Minister Sheikh Hasina will leave Dhaka for Madrid on December 1 to attend the 25th session of the Conference of the Parties () to be held from December 2-13 under the UN framework convention on climate change. 'Through the Prime Minister's participation at the conference, it'll be possible to uphold Bangladesh's firm commitment in facing climate change at the world forum,' Foreign Minister Dr AK Abdul Momen told reporters at a press conference held at state guesthouse Padma on Wednesday.He said the Prime Minister will hold a bilateral meeting with Spanish President Pedro Sanchez on December 2 and discuss issues of mutual interest including development cooperation, trade and investment and mutual cooperation on various global issues.She will also hold meeting with Prime Minister of the Netherlands Mark Rutte on the same day and discuss the core bilateral issues including Delta Plan 2100.He said Bangladesh, under the leadership of Prime Minister Hasina, has been participating actively in global discussion and negotiation on climate change related issues.Dr Momen said the Prime Minister's ideas, role and contribution at national, regional and global levels towards sustainable development and facing climate change are well-established globally.On December 2, the Prime Minister will deliver her speech at Heads of State and Government Summit highlighting climate change and Bangladesh's position.She will call upon the global leaders to consider the financial compensation through further strengthening the Warsaw International Mechanism mandate.She will also emphasise 'loss and damage' apart from highlighting initiatives taken by the Bangladesh government.The Prime Minister will leave Madrid on December 3.COP25 annual climate summit.Senior officials at the Ministry of Foreign Affairs were present at the press conference.\l"
