"COP","country","ID","title","date","source","text"
"COP25","Bangladesh","COP25_Bangladesh45","Dhaka seeks simplified financing conditions","December 14, 2019 Saturday","The Financial Express (Bangladesh)","Bangladesh, Dec. 14 -- Bangladesh has demanded simplification of the climate financing conditions of the Green Climate Fund (GCF) for the affected countries.It placed the demand on the closing day of the Conference of the Parties or COP25 in the Spanish capital of Madrid on Thursday.The country also sought long-term financing by the emitting and developed countries and not from any market mechanism.""The developed countries are trying to shift the responsibility of financing from market mechanism which may involve profit-making,"" information minister Hasan Mahmud told the 'high-level segment' of the event.Mr Mahmud said Bangladesh could avail only $90 million from GCF, although there is a $9.50-billion fund.The minister, however, said Bangladesh is certainly advanced in its capacity than any other country in getting GCF funds.He said the developed countries have been spending billions of dollars in defence sector but they do not contribute to GCF.""The USA has contributed only $1.0 out of the total $3.0 billion it committed. But it backtracked from giving the rest $2.0 billion which is frustrating.""When asked, Transparency International Bangladesh executive director Dr Iftekharuzzaman said the minister has rightly demanded simplification of the harsh conditions of GCF funds.The affected countries do not get funds for the reason, he told the FE.Bangladesh has to continue climate diplomacy and place its demands for compensation for the loss and damage as new and additional funds and not as insurance.It also needs to enhance its capacity and skills to access GCF fund and upgrade its transparency and accountability mechanism, Mr Zaman concluded. HYPERLINK mailto:msshova@gmail.commsshova@gmail.comPublished by HT Digital Content Services with permission from The Financial Express. For any query with respect to this article or any other content requirement, please contact Editor at HYPERLINK mailto:contentservices@htlive.comcontentservices@htlive.com\l"
"COP25","Bangladesh","COP25_Bangladesh46","COP25 to be Held in Madrid on 2-13 Dec","November 30, 2019 Saturday","Energy & Power","The Bureau of the Conference of the Parties to the UN Framework Convention on Climate Change (UNFCCC) accepted the proposal from the government of Chile to hold the 2019 UN Climate Change Conference (COP25) in Madrid, which was made possible by the generous offer by the government of the Kingdom of Spain. COP25 will take place from 2 to 13 December 2019 at IFEMA - Feria de Madrid, Avda. Del Parten\'f3n, 5 28042 Madrid, Spain.The conference will take place under the Presidency of the government of Chile and will be held with logistical support from the government of Spain. The President-designate for the conference is Ms. Carolina Schmidt, Minister of Environment of Chile.The UN Climate Change secretariat is now working closely with the governments of Chile and Spain to organize the conference as efficiently and expeditiously as possible.\l"
"COP25","Bangladesh","COP25_Bangladesh47","UN chief lauds Hasina's leadership","December 7, 2019 Saturday","United News of Bangladesh","UN Secretary General Ant\'f3nio Guterres has praised Prime Minister Sheikh Hasina's leadership in addressing the issue of climate change in the international arena.He also mentioned Bangladesh's remarkable contribution to peace operations as well as the reputation and professionalism of Bangladeshi peacekeepers.The UN chief made the remarks when Ambassador and Permanent Representative of Bangladesh to the United Nations Rabab Fatima presented her credentials to the UN Secretary General (SG) at the UN Headquarters on Friday. Guterres recalled his meeting with Prime Minister Hasina during the 25th session of the Conference of the Parties () held in Madrid last week.Rabab Fatima becomes the 15th Permanent Representative (PR) of Bangladesh to the UN since 1974 when Bangladesh became the member of the apex body under the leadership of Father of the Nation Bangabandhu Sheikh Mujibur Rahman, said the Bangladesh Mission on Saturday. She was Bangladesh Ambassador to Japan prior to this appointment.After presenting her credentials, the PR conveyed greetings from the President and Prime Minister of Bangladesh to the Secretary General. Guterres termed Bangladesh as a friend of the UN, and lauded Bangladesh's socio-economic developments under the leadership of Prime Minister Sheikh Hasina. He said Bangladesh is a valued member of the UN and is making an important contribution to the work of the global body. The PR reiterated Bangladesh's continued commitment and support to the UN and to the Secretary General's initiatives and efforts.Fatima and Guterres also discussed the Rohingya crisis, and the SG reassured that he will continue his efforts towards finding an early and durable solution.The PR conveyed the invitation to the SG to attend the birth centenary of Father of the Nation Bangabandhu Sheikh Mujibur Rahman starting March 2020, and shared that the occasion will be celebrated globally in a befitting manner. Recalling the recent decision of UNESCO to celebrate the birth centenary, she said that Bangladesh plans to organise events and programmes with the United Nations in New York, and in this regard, she requested the SG's support.Ambassador Rabab Fatima, a career diplomat, joined the Bangladesh Foreign Service in 1989 and held important position in the Ministry of Foreign Affairs in Dhaka, and also served in Bangladesh Permanent Missions in New York and Geneva; and the Missions in Kolkata and Beijing in various capacities.Ambassador Fatima has extensive experience and specialisation in human rights and humanitarian issues. She has also worked with the Commonwealth Secretariat, London, as Head of Human Rights; and with the International Organization for Migration as Regional Representative for South and Southwest Asia.In the credential presentation ceremony, among others, Deputy PR Tareq Md Ariful Islam, Minister Monwar Hossain, UN Under-Secretary-General for Political and Peacebuilding Affairs Rosemary A DiCarlo and Chef de Cabinet of the UNSG Maria Luiza Ribeirio Viotti were present.\l"
"COP25","Bangladesh","COP25_Bangladesh48","Bangladesh not getting compensation for tackling climate change: TIB","November 28, 2019 Thursday","United News of Bangladesh","Mentioning that Bangladesh is not getting the compensation it needs to meet the climate risks under the Paris Agreement, Transparency International of Bangladesh (TIB) on Thursday demanded adequate and transparent financing by industrialised countries responsible for climate change.'As the Paris Agreement doesn't have a legal agreement on the issue, the international financial institutions (WB, ADB and IMF), along with the United States, are creating a vicious cycle and withholding the withdrawal of funds,' said TIB Executive Director Dr Iftekharuzzaman.He came up with the remarks at a press conference arranged by TIB at the city's Dhanmondi on the forthcoming 25th Conference of the Parties (COP25) to the United Nations Framework Convention on Climate Change (UNFCCC) slated to be held in Madrid, Spain from December 3 to December 12.According to TIB studies, Bangladesh has been financed with 85 million dollars so far over the last three years from the Green Climate Fund (GCF) although the country needs more than 2.5 billion dollars to tackle climate risks.'Considering the compensation policy of the polluting countries, donations should be guaranteed instead of loan. Underdeveloped countries will have to collectively raise the demand for the smoother supply of necessary funds from the GCF and other international funds Bangladesh will have to play a significant role [in this regard],' said Dr Iftekhar.TIB denounced the proposed bond and insurance-based funding scheme terming it 'inconsistent' with the fundamentals of grant-based adaptation funding for the affected countries.They warned that such plans will only help boost the profits of corporate houses.'Collecting insurance premiums from the affected people and families will put greater strain on them and increase the financial burden on those at risk,' said M Zakir Hossain Khan, Senior Programme Manager, Climate Finance and Governance, TIB.However, the TIB Executive Director called for approaching the proposed climate insurance scheme with caution. 'The government must accept the scheme only after assessing and determining the positive factors.'He further mentioned that the government must step up efforts to reduce the number of coal-based energy plants. 'But, Bangladesh plans to increase coal-based power plants to 30 that will emit about 11.5 croremetric tons of extra carbon dioxide in the atmosphere. As a result, carbon emission will endanger the population of the country.''More importantly,' Dr Iftekhar added, 'The country will lose 11 percent of its surface area due to sea level rise.'TIB also demanded a separate fund to tackle the losses and damages due to climate change which will have financed by the developed countries responsible most for the climate change.\l"
"COP25","Bangladesh","COP25_Bangladesh49","Climate at Mercy of Politics in 2020, Experts Warn","February 15, 2020 Saturday","Energy & Power","2020 is the most crucial year yet for humanity\' s plan to dodge the bullet of catastrophic global warming, experts said recently, warning that the narrow path to safety was riddled with pitfalls, from the US election to Brexit. When nations struck the 2015 Paris agreement, which aims to limit temperature rises under 2 degrees Celsius (3.6 Fahrenheit), they agreed on five-year periods in which climate action could be implemented, assessed and boosted. 2020 is the year the landmark deal goes into effect, yet almost three decades of diplomatic wrangling has fallen far short of what science says is needed to avert disastrous climate change.A crucial UN summit at which leaders will finalize their action plans to reduce greenhouse gas emissions is set to open in Glasgow on November 9 -- just six days after a US general election that could see President Donald Trump win a second term. Trump shocked the world in 2017 when he said the United States -- history\' s largest emitter -- was withdrawing from the Paris agreement. It is due to leave the deal on November 4. After a year of climate-related disasters, from cyclones and flooding in Africa and southeast Asia to devastating wildfires in Australia and California, nations in December failed to make progress during the annual UN Climate Change Conference COP 25.\l"
"COP25","Bangladesh","COP25_Bangladesh50","New Climate Investment Platform Targets Increase in Flow of Capital","October 15, 2019 Tuesday","Energy & Power","I n response to country needs to mobilize low-carbon, climate-resilient investments, a new global public good announced recently will aim to increase the flow of capital in developing countries to meet climate ambitions. The Climate Investment Platform (CIP) is an inclusive partnership welcoming all stakeholders from governments and international organizations to the private sector to scale-up climate action and translate ambitious national climate targets into concrete investments on the ground. With energy accounting for two thirds of total greenhouse gas emissions, the platform\' s first service l"
"COP25","Bangladesh","COP25_Bangladesh51","Hasina calls for swift climate action to create a world liveable for future generation","December 2, 2019 Monday","Energy Bangla","Dhaka, Dec. 2 -- Prime Minister Sheikh Hasina has called for action to stave off climate threats to create a world liveable for the future generation.Hasina spoke on ""action for survival"" as the leader of one of the most vulnerable nations at the 2019 UN Climate Change Conference, known as COP25, in Madrid on Monday.The Climate Vulnerable Forum, or CVF, and the Vulnerable 20 Group are great examples of South-South and Triangular cooperation and should build further on the current accomplishments, said Hasina.""Our children will not forgive us if we fail to ensure their future. Every moment, the cost of our inaction is devastating every living person on earth. The time to act is now,"" she said.Climate change is a stark reality for the world which has now caused irreversible damage to the human life and environment, ecology and natural resources, said Hasina.""Since the Earth Summit in 1992, we have not been able to secure much progress in the reduction of greenhouse gases, their emission is still on the rise. This trend is now unsustainable for the Earth,"" the prime minister said.The vulnerable countries suffer the most due to their limited capacities to cope with climate threats and specific geographical features, she said.""We are bearing the brunt of the damage though we made negligible or no contribution to the menace. This constitutes a serious injustice and must be acknowledged by the global community,"" said Hasina.The global climate landscape has changed considerably since the Forum first met in November 2009 in Male. Unfortunately, the progress under the UNFCCC process is ""very slow and largely inadequate"", said Hasina.Now there is a situation where the most vulnerable countries, which deserve the highest level of priority, are failing to access whatever support that is being realised, the prime minister said. ""The creation of a new CVF and V20 Trust Fund and possibility of having a new special rapporteur on climate change would be a great success.""More than 1.1 million Rohingyas from Myanmar have taken refuge in Bangladesh wreaking a havoc on the environment, said Hasina. ""We already have the firsthand experience of the worst kind of environmental calamity.""On mitigation, the world sees extreme reluctance on part of major emitters, said Hasina. ""This may wreck the international climate regime and put our countries at the risk of peril. Hence, we should not hesitate to demand accountability for inaction,"" she said.It is widely accepted that the gravest effect of climate change may be on human migration, according to Hasina.""Extreme weather events are already displacing many more people than violent conflicts. Slow-onset events like sea-level rise and desertification get even lower global focus. We must work towards correcting this imbalance,"" she said.""We must appreciate that migration could be an effective adaptation strategy, as we focus on enhancing adaptation capacities of affected communities. Hence, relocation and protection of displaced persons need due focus in global discourse to ensure their protection. We need to commence discussion on the creation of an appropriate framework to address the needs of people displaced due to climate change.""Published by HT Digital Content Services with permission from Energy Bangla. For any query with respect to this article or any other content requirement, please contact Editor at HYPERLINK mailto:contentservices@htlive.comcontentservices@htlive.com\l"
"COP25","Bangladesh","COP25_Bangladesh52","Hasan for simplifying climate financing process","December 14, 2019 Saturday","The News Today (Bangladesh.)","Demanding simplifying climate financing process, Information Minister Dr Hasan Mahmud has said the long-term funding should come from the states not from any market mechanism.'The developed nations are trying to impose the long-term financing on market mechanism and with this the matter of profit would come. Without profit, funding would not come from market mechanism,"" he said. Dr Mahmud came up with the observations while addressing ""High-Level Segment"" of the conference on behalf of Bangladesh at COP 25 in Madrid, Spain on Thursday, according to a press release received in Dhaka on Friday. Mentioning the fact that Bangladesh has only received USD nine crore from around USD 950 crore Green Climate Fund till now, the minister said the developed nations are spending billions in the military sector, but not giving money in the Green Climate Fund that they had pledged.'The US had pledged to provide USD 300 crore to the fund, but after giving USD 100 crore, they have withdrawn the rest of the money. It is very disappointing,"" Dr Hasan Mahmud said. Urging to make the funding process much easier, the information minister said as the process of providing fund is difficult the climate affected nations like Bangladesh are not getting money that they desired.'Bangladesh has so far received USD nine crore from Green Climate Fund due to its capability. Bangladesh is not only capable, but also is much ahead of many other countries in this regard. Bangladesh is the first country to formulate Climate Change Action Plan to tackle blow of climate change. We have formed the trust fund from our own resources and implemented 720 projects from this fund,"" he added.The minister is scheduled to return home on December 14.\l"
"COP25","Bangladesh","COP25_Bangladesh53","Hasan for integrated initiatives to cope with climate impact","December 13, 2019 Friday","The News Today (Bangladesh.)","Mentioning that Bangladesh is facing multi-dimensional threats due to the adverse impact of climate change as the country has become the innocent victim of global warming, Information Minister Dr Hasan Mahmud said the international community should initiate integrated approach to cope with the adverse impact of climate change.'Bangladesh is still one of the most vulnerable countries to climate change . . .The carbon emission rate of Bangladesh is only 0.5 tonnes per person,"" he said, addressing a sidel"
"COP25","Bangladesh","COP25_Bangladesh54","Rich nations must pay for climate damage: NGOs","November 30, 2019 Saturday","The News Today (Bangladesh.)","Climate negotiations opening next week in Madrid must prioritise funding for nations already dealing with the cost of drought, floods and superstorms made worse by rising temperatures, more than 150 environmental groups said Friday. In an open letter to the president of the COP 25 talks, Chile's environment minister Carolina Schmidt, the organisations urged agreement on ""the creation of a comprehensive financing facility, including debt relief, for developing countries experiencing such disasters."" They said money should come from wealthy nations - historically most responsible for planet-warming carbon emissions - in the form of tax on financial transactions, international air travel and fossil fuels.The Madrid conference is set to be dominated by discussions on so-called ""loss and damage"" funding, with a sharp divide between developing nations and richer polluters over how finance should be structured. Green groups this week said the increased pace and intensity of climate disasters, such as the twin cyclones that devastated parts of Mozambique this year, means that funding needs boosting to keep track. They said the amount needed for loss and damage would top $300 billion annually by 2030.'Without finance to help countries cope with climate-induced loss and damage, the most vulnerable parts of the world will sink deeper into debt and poverty every time they are hit by climate disasters they did not cause,"" the letter said. Storms in Mozambique this year displaced millions, destroyed homes and crops, inflicting an estimated $3 billion in damages - roughly 20 percent of the country's GDP. But without a global, unified process for climate damage funding, countries are not yet obliged to get their chequebooks out. After Cyclone Idai, the International Monetary Fund provided Mozambique with an emergency load of $118 million - woefully short of what was needed.'Wealthy countries have been ignoring developing nations' demands for financial support to repair the loss and damage caused by climate disasters,"" said Harjeet Singh, global climate change lead at ActionAid.\l"
"COP25","Bangladesh","COP25_Bangladesh55","PM returns home from Madrid","December 4, 2019 Wednesday","United News of Bangladesh","Prime Minister Sheikh Hasina returned home early Wednesday from Madrid, wrapping up her visit to Spain after attending the 25th session of the Conference of the Parties (COP25).Earlier, the flight took off from Madrid Torrejon Airport at 9:30am (local time) on Tuesday.Ambassador and Permanent Representative of Bangladesh to the World Tourism Organization Hassan Mahmood Khandker saw her off at the airport.On Sunday last, the Prime Minister went to Madrid, the Spain's central capital, and attended the inaugural and other events of COP25.COP25, kicked off in Madrid on Monday under the UN framework convention on climate change.On the sidel"
"COP25","Bangladesh","COP25_Bangladesh56","PM leaves Madrid for home","December 3, 2019 Tuesday","United News of Bangladesh","Prime Minister Sheikh Hasina on Tuesday left Madrid wrapping up her visit to Spain after attending the 25th session of the Conference of the Parties (COP25).COP25, kicked off in Madrid, the Spain's central capital, on Monday under the UN framework convention on climate change.A VVIP flight of Biman Bangladesh Airl"
"COP25","Bangladesh","COP25_Bangladesh57","Motion adopted in JS declaring 'planetary emergency'","November 13, 2019 Wednesday","United News of Bangladesh","The Jatiya Sangsad on Wednesday unanimously adopted a historic motion declaring a planetary emergency on account of the existential crisis of climate change and calling on the global community to act urgently and decisively in achieving the net zero (carbon) emissions well before 2050.The Bangladesh Parliament is the first legislature to adopt such a resolution, as revealed during the long discussion on the motion.The House passed the motion ahead of the upcoming COP 25 - the UN's annual climate conference scheduled to take place this year from December 2-13 in Madrid. The Conference of Parties (COP) is the supreme decision-making body of the Convention.Ruling Awami League lawmaker Saber Hossain Chowdhury piloted the motion in the House.The MPs across the benches passed the motion unanimously by voice vote when Speaker Dr Shirin Sharmin Chaudhury, who was in the chair, placed it for voting following the discussion.Taking the resolution, the House declared a planetary emergency on account of existential crisis of climate changes, devastating impact of disasters and increase in extreme weather events, irreparable loss of bio-diversity, looming food insecurity, rising water stress, unprecedented pressure on oceans and unsustainable use of resources.'The global community must act urgently, decisively and with considerably higher ambition in achieving net zero emissions well before 2050, capping temperature rise to 1.5 degree Celsius and transitioning swiftly to low carbon economies as overarching priorities,' said the Bangladesh Parliament.'Despite being least responsible to these problems, Bangladesh and many other countries in developing world, including Small Island Developing States (SIDS) are the most impacted and vulnerable,' said the Parliament adding that actions at global levels have not matched commitments and rhetoric.It said planetary justice and climate equity demands that these vulnerable countries are assisted with finance and technology to meet their development aspirations in the quickest and the shortest time.The House, therefore called on parliaments, governments, the United Nations and all stakeholders to work on a war footing, as custodians and as one team, to protect and fortify our planet- the only Home we have.Environment, Forest and Climate Change Minister Md Shahab Uddin, State Minister for Foreign Affairs Md Shahriar Alam, State Minister for Power, Energy and Mineral Resources Nasrul Hamid, Awami League MPs Tofail Ahmed, Begum Matia Chowdhury, Sheikh Fazlul Karim Selim, Rafiqul Islam (Bir Uttam), Kazi Nabil Ahmed, Nazrul Islam Babu and Waseqa Ayesha Khan, BNP MPs Harunur Rashid and Rumeen Farhana, Jatiya Party MPs Mujibul Haque (Chunnu) and Rustum Ali Faraji, and Jasod MP Shirin Akhter supported the motion joining the discussion.\l"
