"COP","country","ID","title","date","source","text"
"COP24","Ireland","COP24_Ireland15","Problem of making Paris accord stick dominates UN climate summit","December 12, 2018 Wednesday","The Irish Times","Negotiations at the UN summit in Poland, now entering their final political phase, continue to be dominated by issues around the strictness of a rulebook to bring the landmark Paris agreement on climate change to life. In addition, there are lingering issues about the standing of the UN Intergovernmental Panel on Climate Change (IPCC) report, published in October, which warned the world was off course in trying to keep global temperature rise within 1.5 degrees. The US and other big oil- and gas-producing countries refused to welcome its findings in a heated COP24 ""The fact that a group of four countries were trying to diminish the value and importance of a scientific report they themselves, with all other countries, requested three years ago in Paris is pretty remarkable,"" said Alden Meyer of the Union of Concerned Scientists. US State Department negotiators, however, remain deeply engaged in talks on the future of the Paris deal, a source directly involved in the negotiations told The Irish Times . ""I cannot say they are being obstructive,"" he added. Others indicated there is a US push for a deal on climate rules that president Donald Trump or his successor would be able to swallow. More tangible progress has been made under the ""Talanoa Dialogue""; a process designed to help countries implement and enhance their ""nationally determined contributions"" by 2020. It is expected to conclude and feature prominently in a final declaration at the weekend. Sharing stories The dialogue, initiated last year, seeks to break the climate deadlock by drawing participants closer together through sharing their stories of climate change. Governments, civil society, NGOs, businesses, cities and others were invited to respond to questions: ""Where are we now? How do we want to go? How do we get there?"" It is expected that it will be presented to the UN General Assembly, because of its significance in light of the UN sustainable development goals, according to a lead negotiator. ""Loss and damage"" arising from climate change was the outstanding issue highlighted by least developed states and small island countries - specifically how to provide financial support to countries whose economies are too vulnerable to cope with the impact of climate change. A particular difficulty is compensating for losses and damages that already occur and are irreversible. The task facing the COP24 was underlined by a report issued yesterday that showed average world temperatures are on course to far exceed the main goal set in the 2015 Paris Agreement on limiting global warming. The overshoot by the end of this century, however, could be less severe than expected thanks to significant efforts by some countries to combat climate change, according to Climate Action Tracker (CAT) - a consortium of three independent European research groups. Progress The CAT report highlighted progress since 2015, but current policies meant the world was heading for warming of 3.3 degrees, compared with 3.4 degrees it predicted a year ago. ""We have yet to see this translate into action in terms of what governments are prepared to put on the table,"" said Bill Hare, chief executive of Climate Analytics, one of the three CAT research groups. Since the Paris accord, countries including Argentina, Canada, Chile and India, plus the EU are moving in the right direction towards cutting emissions. \"
"COP24","Ireland","COP24_Ireland16","Climate summit lacked urgency and ambition","December 17, 2018 Monday","The Irish Times","The backdrop coming into the UN annual climate summit was dire; from where the world is at in responding to global warming to scientific indications of how climate breakdown looms on the horizon. Three years after the optimism of Paris, the world was in a darker place having reached a point where most of its 7.6 billion people are probably aware by now of the risks they face from climate change due to more severe and more frequent floods, droughts and wildfires. Global carbon emissions are on the rise, especially in the US and China, the world's largest economies - with evidence of other countries backsliding on their commitments under the historic 2015 Paris Agreement. All that did not help the mood. As politicians and diplomats met in Katowice, Poland, seeking to sign off on a guidebook to bring the deal into effect from 2020, the days of commitments under the agreement being only as good as the willingness of national leaders to keep their word were due to come to an end. If that is delivered on in the next two short years based on what was agreed, COP24 can then be considered a success. Low point The end of the first week was a low point marked by a political stalemate when big oil and gas producer countries led by the US and Saudi Arabia refused to ""welcome"" the latest findings of the UN's climate science body, the Intergovernmental Panel on Climate change. IPCC chairman Hoesung Lee was to later to underline its significance; that the temperature goal (containing global temperature rise to 1.5 degrees) is achievable ""but that this can only happen if governments take urgent and far-reaching action in all aspects of society, with many implications for policymaking"". UN general-secretary Ant\'f3nio Guterres attempted to reset the agenda going into the final days: ""To waste this opportunity in Katowice would compromise our last best chance to stop runaway climate change. It would not only be immoral, it would be suicidal."" Critical issues By the last official day of negotiations, there was still no resolution in sight for critical issues such as financing for developing countries' climate efforts - though some progress on this was achieved by close of business. But an obvious alliance between the EU and China (especially on having a common rulebook) was coming good in getting a deal of significance over the line. While an earlier side meeting with US officials delivering the usual pro-coal line from Trump-generated headlines, concerns that the US would be hostile in the negotiation rooms proved mostly unfounded - the state department was a constructive force. Beside China, the US oversaw the drafting of the rules governing transparency, a central aspect of the rulebook. Ireland consistently supported EU moves to ensure greater transparency and better reporting mechanisms for accounting of national greenhouse gas commitments.The Republic did not join the 27 countries who have formed the Coalition for Higher Ambition, who committed to scaling up commitments in line to Paris targets during the COP. Minister for Climate Action Richard Bruton flagged to NGOs in Katowice that Irish climate commitments would be made when he was sure they could be delivered on. There is clearly insufficient progress on persuading countries to make firm commitments to cut their emissions further . COP24 , none the less, has produced a common rulebook after achieving consensus among 195 states. The greater ambition and urgency desperately sought by so many outside the talks remains elusive. \"
"COP24","Ireland","COP24_Ireland17","Young voices to the fore at UN climate event; Robinson urges people to take steps in their lives to deal with global warming","December 5, 2018 Wednesday","The Irish Times","The world is moving to counter climate change in spite of global leaders behaving like irresponsible children, Swedish student Greta Thunberg (15) told the UN climate change summit. During the open day of negotiations at the COP24 gathering in Katowice, Poland, it was the voices of young people that stood out. Their importance in the global response to global warming was underlined by UN secretary general Ant\'f3nio Guterres: ""Our younger generations will have to help drive, and complete, the work we start today. We need to harness their energy, invention and political power to raise climate ambition."" Greta Thunberg began a solo climate protest by striking from school in August. More than 20,000 students around the world have joined her since. The school strikes have spread to at least 270 towns and cities in countries across the world, including Australia, the UK, Belgium, the US and Japan. ""For 25 years countless people have come to the UN climate conferences begging our world leaders to stop emissions and clearly that has not worked as emissions are continuing to rise. So I will not beg the world leaders to care for our future,"" she said. ""I will instead let them know change is coming whether they like it or not."" School strikes The teenager added: ""Since our leaders are behaving like children, we will have to take the responsibility they should have taken long ago,"" she said. ""We have to understand what the older generation has dealt to us, what mess they have created that we have to clean up and live with. We have to make our voices heard."" Also at the summit, Toby Thorpe, a student from Hobart, Tasmania, who took part in recent school strikes in Australia, said: ""We are in this together. Together we are strong and we will not give up."" Indication that major banks are becoming more conscious of their climate obligations were outlined at the talks. ING chief executive Ralph Hamers announced a landmark finance collaboration with BNP Paribas, Standard Chartered, BBVA and Soci\'e9t\'e9 G\'e9n\'e9rale ""to measure the climate alignment of their lending portfolios, with the aim of steering them in line with the Paris Agreement"". The banks have signed a commitment letter, pledging to finance change and put their balance sheets to work on climate projects. Mr Guterres said ""embracing inclusive multilateralism"" was an essential requirement, if the world was to succeed in responding to potential climate breakdown. ""Only global answers can solve global problems. Embracing inclusive multilateralism is the way to go, but it needs to adapt to meet the global challenges we currently face. We now need networked multilateralism,"" he added. Meanwhile, former president of Ireland Mary Robinson underlined the importance of COP24 . ""We're running out of time. It is important to take action now. We must be more ambitious,"" she said. In the Irish context, she acknowledged big changes were happening and there was ""more concern at political level. The Government and political parties are taking the issue more seriously."" There was a long way to catch up, she said, ""but we're on the right track"". Mrs Robinson said there were very tough emissions targets to be met. ""People need to take steps in their own lives. They need to get cross if governments are not doing enough,"" she told RT\'c9's Morning Ireland . - Additional reporting: Guardian \"
"COP24","Ireland","COP24_Ireland18","'There is no planet B': Swiss students stage strikes","January 18, 2019 Friday 5:19 PM GMT","RTE News","Thousands of school children and university students across Switzerland have skipped class to march in the streets and demand climate action, telling politicians ""there is no planet B"". Despite vows from a number of school districts to show zero tolerance for those who missed class, pupils as young as 12 turned out across at least 15 Swiss cities and towns for the ""climate strike"". The protest was inspired by Greta Thunberg, a 15-year-old Swedish girl who since last August has been missing school each Friday to protest in front of Sweden's parliament demanding concrete action from politicians to halt climate change. 'School strike for the climate': Greta Thunberg with a placard outside the Swedish parliament After she garnered international headlines with a fiery speech before world leaders at last month's COP24 climate talks in Poland, thousands of students have followed in her footsteps. ""Climate strikes"" have been staged in several countries, including Australia, Belgium, Britain, Canada, Japan and the US. The strike in Switzerland kicked off this morning in Lausanne, where thousands of young people marched through the streets, local police said. More marched across Geneva later on, ending up in front of the United Nations' European headquarters. \"
"COP24","Ireland","COP24_Ireland19","Outrage as oil and gas producers try to downplay climate change report","December 10, 2018 Monday","The Irish Times","Major oil and gas producer states have provoked outrage at UN climate talks in Poland as they sought to downplay a report warning of climate chaos facing the world sooner than expected. After a heated debate, the ploy by the US, Russia, Saudi Arabia and Kuwait to merely ""note"" the landmark UN report published in October shocked delegates at COP24 in Katowice. The four countries rejected a motion on Saturday to ""welcome"" the study, which would have made it much more difficult for governments to ignore. The motion has not yet been able to pass as a result. Denounced The EU, alongside a bloc of at 47 least developed countries, as well as a number of African, Latin and South American nations, all spoke in favour of the motion. Several denounced the countries trying to dilute its importance. An attempt to find a compromise during the plenary session failed; setting the scene for a larger political row when high-level negotiations begin today. ""It is troubling. Saudi Arabia has always had bad behaviour in climate talks, but it could be overruled when it was alone or just with Kuwait. That it has now been joined by the US and Russia is much more dangerous,"" said Alden Meyer, Union of Concerned Scientists director of strategy and policy. \"
"COP24","Ireland","COP24_Ireland20","Martina Devlin","December 22, 2018 Saturday","Irish Independent","ERE'S the problem. HAs individuals we can give up our aul' sins: instead, make greater efforts to recycle, insulate our houses, install solar panels, choose public transport and/or bicycles, stop buying single-use plastics and heavily packaged goods. You know the drill. But such changes in behaviour, necessary though they are, represent a drop in our plastics-infested oceans. Political action is what's needed. Political action is what's missing - interventions at national and international levels. Let's start with national. Unfortunately, the Irish Government is on Santa's naughty list because window-dressing alone is not enough. The Government pays lip service to climate justice but has failed to fulfil its own commitments on increasing carbon tax. If it makes just one resolution for 2019 it should be to prioritise decarbonisation policies. The global warming genie is out of its bottle and the window of opportunity for dealing with it is growing ever more narrow as countries prevaricate and hesitate. Nations are sitting on their hands - Ireland included. Apocalyptic warnings from scientists are met with shrugs. Ireland was among countries which signed up to steps curbing global warming as part of 2015's landmark 'Paris Rulebook' agreement. But the situation is escalating and those measures are insufficient to stop carbon pollution reaching critical levels. COP24 , the recent Poland summit notable for its friction, accepted another set of rules. Almost 200 nations participated, Ireland included once again. However, some states continue to dispute the latest climate science, primarily the Trump administration which denies that human activity is endangering the planet by contributing to rising seas, crop failures, extinction in the natural world and extreme weather conditions. Russia, Saudi Arabia and Kuwait are also resistant to pollution-cutting pledges, treating climate science like a political football. Boo to those badboys. Oh, wait - we're not too virtuous here in Ireland. Our October Budget failed to include a carbon tax rise, as recommended by the Citizens' Assembly, ESRI and Climate Change Advisory Council. Last year, the Government's own Committee in Budgetary Oversight emphasised use of the fiscal system to support climate change policies. But it's water off a duck's back to the present administration. You'd imagine Ireland wasn't among a host of developed countries burning ever larger quantities of fossil fuels for more than 200 years, thereby increasing the carbon in Earth's atmosphere. It's reached a point where some commentators are claiming the world has left it too late and the planet is already heading for climate catastrophe. On the other hand, there may still be a sliver of time to mitigate the effects of our formerly heedless and now just plain selfish behaviour. A report from the Intergovernmental Panel on Climate Change (IPCC) says the world has only about 12 years to avoid 1.5 degrees Celsius warming above pre-industrial levels - one of the goals of the Paris Agreement. UN Secretary-General Ant\'f3nio Guterres describes it as an ""ear-splitting wake-up call"". The IPCC says carbon pollution must be cut almost in half by 2030 and reach net zero by mid-century - which would require a fundamental reworking of global energy and transport systems. These summits aim to achieve results by consensus building: a peer-pressure approach encouraging countries to abandon dirty energy sources such as coal, oil and natural gas. Which brings me to Moneypoint, Ireland's largest power station: coal-fired and the State's biggest single emitter of greenhouse gases. How about if our political masters stop kicking the issue down the road and do something about that in 2019? In fact, the Government's best resolution for the coming year would be to set up a cross-party group along the same lines as the excellent Sl\'e1intecare. Call it Climatecare. Its remit should be speedy implementation of procedures that would have a dramatic effect on Ireland's emissions. These could include: closing down the two peat-burning It's reached a point where some commentators are claiming the world has left it too late and the planet is already heading for climate catastrophe stations; converting Moneypoint from coal-burning to natural gas; and ceasing any promotion of wood-burning stoves or boilers which are pollutants. Further, Climatecare should insist all new public transport vehicles are powered by electricity or based on hybrid technology; incentivise owners of trucks, taxis and coaches to do likewise; and hike investment on creating a safer environment for cyclists. Workers who become redundant as a result of any of the above measures must be compensated. The cost is minor when set against huge fines to be levied by the European Union if we fail to meet our commitments. But instead of heeding the unequivocal science, developed countries are wasting time trying to evade their responsibilities. They - we - have an obligation to secure a safe world for future generations. It's no coincidence COP24 was marked by protests from young people, who have most to lose by leaders' inaction. Inspired by a Swedish 15-year-old who called for a global school walkout, dozens of Polish students left the classroom and marched into the conference centre with a sign reading: ""12 years left."" This young generation will not look kindly on today's wishy-washy deal-makers. In Ireland, we can expect flooding to increase, along with coastal erosion, destroying land and buildings. Meanwhile, some in the Irish political system persists in denying human involvement in climate change, while other Flat Earthers around the world question whether it is happening at all. ""If we don't take climate action, the collapse of our civilisations and the extinction of much of the natural world is on the horizon,"" David Attenborough warned COP24 delegates. Compelling, you'd have thought. Yet political momentum for international co-operation is sagging. To be fair, the Government is engaged in a number of schemes to encourage energy saving: retro-fitting houses, subsidising electric cars, solar panels and so on. But it's hardly sufficient. Easy to say, of course, that Ireland is a small country and any action we take would have limited impact. However, if we give a lead perhaps others would follow, as with the smoking ban. Finally, humankind is a recent arrival on Earth in terms of its history. The world can manage perfectly well without us. But space exploration notwithstanding, we are incapable of managing without the world. Food for thought at the Christmas table this year, perhaps? We have Sl\'e1intecare, now we ; ; need Climatecare. Ireland is a ; ; small country but we can set an ; ; example and others may follow ; ; in efforts to end global warming ; ;   ; \"
"COP24","Ireland","COP24_Ireland21","Climate fears as 2018 is 'one of the hottest years ever'","November 30, 2018 Friday","Irish Daily Mail","THIS year is expected to be the fourth warmest year on record, say a global association of weather forecasters. The World Meteorological Organisation said 20 of the warmest years on record have taken place in the last 22 years. It also said the global average temperature for the first ten months of this year was nearly 1C above those between 1850 and 1900 - and could be 5C hotter by the end of this century. WMO secretary-general Petteri Taalas said: 'We are not on track to meet climate change targets and rein in temperature increases. 'Greenhouse gas concentrations are once again at record levels and if the current trend continues we may see temperature increases of 3C to 5C by the end of the century. If we exploit all known fossil fuel resources, the temperature rise will be considerably higher.' 'It is worth repeating once again that we are the first generation to fully understand climate change and the last generation to be able to do something about it.' Delegates from almost 200 countries will be attending a climate conference in Poland next week called the COP24 . Its aim is to continue the work started by the Paris climate deal. Recently, Richard Bruton, whose ministerial brief includes climate action, acknowledged the Government is currently 95% off its target to reduce carbon emissions. He said the country needed to 'step up dramatically' if it is serious about tackling emissions. \"
"COP24","Ireland","COP24_Ireland22","Nations reach deal to implement Paris Climate Accord","December 16, 2018 Sunday 4:39 PM GMT","RTE News","An agreement has been reached by representatives of nearly 200 countries on how to implement the Paris Climate Accord, after two weeks of negotiations at the UN Climate Change conference in Poland. The deal covers how countries report and measure their carbon dioxide emissions. Other issues where agreement could not be found will be revisited at a later date. Delegates from nearly 200 states finalised a common rule book designed to deliver the Paris goals of limiting global temperature rises to well below two degrees Celsius. ""Putting together the Paris agreement work programme is a big responsibility,"" said COP24 president Michal Kurtyka. ""It has been a long road. We did our best to leave no one behind."" But states already dealing with devastating floods, droughts and extreme weather made worse by climate change said the package agreed in Katowice lacked the bold ambition to cut emissions the world needed. Egyptian ambassador Wael Aboulmagd, chair of the developing nations G77 plus China negotiating bloc, said the rule book saw the ""urgent adaptation needs of developing countries relegated to a second-class status."" ""Without a clear rulebook, we won't see how countries are tracking, whether they are actually doing what they say they are doing,"" Canada's Environment Minister Catherine McKenna said. At their heart, negotiations were about how each nation funds action to mitigate and adapt to climate change, as well as how those actions are reported. \"
"COP24","Ireland","COP24_Ireland23","Climate change 'our greatest threat' - Attenborough","December 3, 2018 Monday 7:25 AM GMT","RTE News","British broadcaster and environmentalist David Attenborough urged world leaders at the COP24 summit in Poland to get on and tackle ""our greatest threat in thousands of years"". Known for countless nature films, Mr Attenborough has gained prominence recently with his 'Blue Planet II' series, which highlighted the devastating effect of pollution on the oceans. ""Leaders of the world, you must lead,"" said the naturalist, given a 'People's seat' at the two-week UN climate conference in the Polish coal city of Katowice alongside two dozen heads of state and government. ""The continuation of our civilisations and the natural world upon which we depend, is in your hands,"" he said. Political leaders are in the Polish coal city of Katowice for the two weeks of talks to revive the landmark Paris 2015 deal on climate change - amid dire warnings about a lack of action. The world is currently on course to overshoot by far the limits for global warming agreed in the Paris accord, which were intended to prevent more extreme weather, rising sea levels and the loss of plant and animal species. UN Secretary General Antonio Guterres said at the summit that the world is ""way off course"" in its plan to prevent catastrophic climate change. After a string of damning environmental reports showing mankind must drastically slash its greenhouse gas emissions to avert runaway global warming, Mr Guterres told delegates: ""We are still not doing enough, nor moving fast enough"". Minister for the Environment Richard Bruton represented Ireland at the opening ceremony. Speaking from the conference, Mr Bruton said he ""completely"" agrees with the UN Secretary General's comments. \"
