"COP","country","ID","title","date","source","text"
"COP25","Bangladesh","COP25_Bangladesh34","Danger of denying climate call","December 15, 2019 Sunday","Energy & Power","Madrid is all set to host the COP25 (the 25th session of the conference of parties) as the governments, members of civil society and NGOs, and environment activists have already started gathering. The main negotiation on implementation of Paris Agreement to protect the world from climate change impact starts on December 2 and is scheduled to continue until December 13.The organizer, Chile, regretted holding the global event only one month before amid citizen\' s protest. Then Spain showed interest in hosting it and it was accepted by the board of the United Nations Framework Convention on Climate Change (UNFCCC). However, people concerned with the issue are optimistic about the availability of fund, required for implementation of the Paris Agreement, would agree upon at the COP25. Rules and procedures, action plan and implementation strategy would also be decided. It is being thought that if these are not agreed upon at the COP25, the commencement of implementation of Paris Agreement from 2020 will be delayed.The conference is being held at a time when different countries of the world are encountering different types of climate disasters. Bangladesh capital Dhaka has become one of the most polluted cities of the world. Air pollution of different cities and towns including the port city has become unbearable. Threats of frequent cyclones and other natural calamities are growing. Countries including America, Brazil and Australia are huffing and puffing in managing bush fire menace. Some European countries are struck by flash flooding. Another important matter worth mentioning here that one of the major polluting countries, United States of America, has walked out of the Paris Agreement.A report of the World Resources Institute evidences that though USA as a state has walked out, yet different states, cities and businesses in USA still remain committed to the Paris Agreement. They represent two-thirds of the US population and business control 70% of the GDP. It will be great news for protecting the mother earth if this continues. Three recent reports published by the International Panel on Climate Change (IPCC) have sounded wake up alarm for the world leaders.The entire civilization, our land and our sea are in great danger from the adverse impacts of Green House Gas (GHG) emissions if we fail to act quickly now.The IPCC reports also stated that melting of polar glacier would not stop unless we can limit global warming below 1.5 degree Celsius by 2100.The sea level would continue rising and the danger of natural calamities would become more menacing than the previous decades.The Emission Gap Report by the United Nations Environment Program (UNEP) stated that even if the NDCs declared by different nations are fully implemented, the global warming would rise 3.2 degree Celsius. That will make mother earth exposed to different disasters.The report also states that for restricting the global warming within 1.5-2.0 degree Celsius, the annual GHG emissions reduction rate between 2020 and 2030 must be 7.6%. An initiative was launched at the climate negotiation in Katowice, Poland in 2018 for framing the Rules Book for implementation of the Paris Agreement. But it could not be finalized. In Madrid COP25, the participating countries must work to finalize the Rules Book. The world leaders expressed optimism that the COP25 would achieve the objectives. Dr Manjurul Hannan Khan, Additional Secretary of the Ministry of Environment, Forest and Climate Change and a member of Bangladesh delegation to the COP25, said that the crunch time for reaching final agreements in climate conference has arrived. He sounded optimistic that the meeting of minds of all parties would be there in Madrid. Different analyses and observations indicate that the COP25 would create the necessary momentum for commencing implementation of the Paris Agreement from 2020. During the COP21 in Paris in 2015 all the countries have been requested for submitting the updated NDCs. Most of the countries have already submitted the updated NDCs to the UNFCCC. Many countries including Bangladesh have started finalizing Climate Strategy and Action Plan. Bangladesh would complete it within three months. In September 2019 at the Climate Action Summit in New York, many small and medium countries committed to intensify actions for reducing the GHG emissions for achieving greater NDC targets. Some 68 countries have pledged for this. But it needs to observe what major polluting countries are doing.The COP25COP25, some head of the states or governments would attend the COP25. Among them, Bangladesh Prime Minister Sheikh Hasina would lead the country delegation. Apart from participating in the inaugural program, she will address in a special session on adaptation. In addition to highlighting the Bangladesh experience of adaptation, she will press for global funding on behalf of the climate vulnerable countries for confronting adverse climatic changes.The COP25The UNFCCC would prepare a synthesis on the basis of NDCs of countries. It will act as a policy paper for reducing GHG emissions. Governments, civil society, business and NGOs are expecting that the outstanding elements of the Rules Book would be finalized and agreed through negotiation in Madrid. These are carbon market post-Kyoto Protocol, common timeframe for implementation of NDCs, review of loss and damage and determination of action plan, advance financing and capacity building. A 300-page Rules Book was formulated at the COP24 for implementation of the Paris Agreement. But the issues could not be finalized.The main priority of COP25 is finalization of the rules for carbon market. More or less 51% of the NDCs state about attaching NDCs with the emission control is a major objective. The money received from carbon market will drive the world towards renewable energy and will play a major role in climate resilience financing. Experts observed that all must remain concerned about these during the finalization of the rules and regulations.The correct accounting of GHG emission would not be possible if the scope of carbon credit accounting is there for both buyers and sellers. Prior to 2020, the carbon market would follow Kyoto Protocol. But the modality of the carbon market operation from 2020 needs to be determined following the article 6 meticulously. We must bear in mind that the emission control mechanism is not affected through tangles of accounting. It needs ensuring that the money received from carbon market directs to adaptation fund and climate vulnerable countries gets higher benefits. Climate activists and civil society have advised remaining vigilant so that the rules are not finalized carelessly. These must be done in environment-friendly manner. Otherwise the carbon market rules would rather have negative impacts than positive one.The second priority is agreeing on a common timeframe for implementation of the NDCs of the countries. The COP24 reached initial agreements but could be ultimately finalized.The NDCs submitted in 2015 had set implementation timeframe by 2020 and 2025. But the implementation time of NDCs submitted last year set the starting time of implementation as 2031. Analysts suggested that in Madrid negotiation agreement should be reached for implementing the NDCs within the 2031-2035 timeframe. The third priority is assessment of loss and damage. It is a very sensitive matter.The Madrid negotiation must review and finalize the Warsaw International Mechanism on Loss and Damage 2015 (WIM). WIM was created for ensuring financial assistance of the developing and climate vulnerable through accurately accounting their damage and losses. WIM reviewed and assessed the damage and losses over the past 6 years. It is expected that the Madrid negotiation would ensure the rules and modalities are finalized for financing for the affected countries through final review of the assessment done. The fourth and final priority is advance financing and capacity development. It is clear that advance financing is a must to enable the climate vulnerable countries achieving double reduction of GHG emission. This financing has to come from Green Climate Fund (GCF). But till now, contribution to the GCF is not encouraging at all. Till now, 28 countries together have pledged for US$ 28 billion to the GCF. But the actual receipt is only $ 5.6 billion. In subsequent 2020, $ 100 billion would be required and every year more $100 billion. Analysts believe that Madrid conference must ensure the above contribution by rich major polluting countries if Paris Agreement implementation is to start from 2020. Otherwise countries relying on contribution from GCF for achieving NDCs cannot achieve the targets.The main focus of Madrid conference must be confirming the contribution to the GCF. Inger Andersen of UNEP has told media that the climate investment cost in 2050 would grow US$ 7.9 trillion. The world\' s major fossil fuel producers are set to bust global environmental goals with excessive coal, oil and gas extraction in the next decade, the United Nations and research groups said.The 10 nations in focus, including China and the United States, plan to produce fuels by 2030 at levels between 50-120% over Paris Agreement targets, the study showed. Under that 2015 global pact, nations committed to a long-term goal of limiting the average temperature increase to within 1.5-2.0 degrees Celsius above preindustrial levels. But by 2030, the 10 countries\' planned production would lead to 39 gigatonnes (Gt) of carbon dioxide emissions, 53% higher than what is needed to reduce temperature rises to 2C and 21 Gt, or 120%, more than is needed for 1.5C, the report said. Other countries analysed included Russia, India, Australia, Indonesia, Canada, Germany, Norway and Britain.  The world\' s energy supply remains dominated by coal, oil and gas, driving emission levels that are inconsistent with climate goals,  said United Nations Environment Program (UNEP) executive director Inger Andersen. According to an AFP report, large investment funds are not directed towards achieving climate change mitigation targets. British Organization Influence Map analysing 50, 000 investment accounts of 150 financial giants has mentioned that the investment in Oil and Gas Exploration, Coal Mining and Automobile Industry is US$ 8.2 trillion. They are interested for investment in brown technology although the Paris Agreement stressed upon giving priority to green projects by private sector investors. For this, the Paris Agreement perceived target of limiting the fossil fuel use especially of coal by 2030 would not be achieved.The use of coal would still remain above 30%. On the other hand, World Energy Outlook 2019 published recently by the International Energy Agency (IEA) stated that stable policy is absent for restricting increased global carbon emission. It stated that people of many countries of the world are still deprived of quality energy supply. Around 850 million population of the world do not have access to electricity.The rate of growth of energy sector would be 1.4% till 2040. Emissions growth would also match this rate. New policy scenario of expanding use of renewable energy and achieving energy efficiency can limit this growth to 1%. It is being told that Oil use would remain stable till 2030 and gas would remain third in preference. Use of coal would be reduced but can not be eliminated all together. During this period, renewable energy contributing about 50% would take the lead and solar would be the leader. IEA observed that emission would be reduced but mentionable success may not be visible by 2040.The growth of energy efficiency now is 1.4%. For achieving the target set in Paris Agreement, it has to reach 3% by 2040. Energy efficiency has huge potential to help reduce carbon emissions, the IEA said. But governments need to take stronger policy action to reverse the worrying slowdown in global energy efficiency improvements, according to a public survey conducted by the International Energy Agency.The survey was carried out to inform the first meeting of the Global Commission for Urgent Action on Energy Efficiency.A catastrophic scenario has appeared about global warming and NDCs in a UNEP Emission Gap Report. On the eve of a year in which nations are due to strengthen their Paris climate pledges, a new UNEP report warns that unless global greenhouse gas emissions fall by 7.6 per cent each year between 2020 and 2030, the world will miss the opportunity to get on track towards the 1.5\'b0C temperature goal of the Paris Agreement. It says that even if all current unconditional commitments under the Paris Agreement are implemented, temperatures are expected to rise by 3.2\'b0C, bringing even wider-ranging and more destructive climate impacts. Collective ambition must increase more than fivefold over current levels to deliver the cuts needed over the next decade for the 1.5\'b0C goal. 2020 is a critical year for climate action, with the UN climate change conference in Glasgow aiming to determine the future course of efforts to avert crisis, and countries expected to significantly step up their climate commitments.  Our collective failure to act early and hard on climate change means we now must deliver deep cuts to emissions - over 7 per cent each year, if we break it down evenly over the next decade,  said Inger Andersen, UNEP\' s Executive Director. This shows that countries simply cannot wait until the end of 2020, when new climate commitments are due, to step up action. They - and every city, region, business and individual - need to act now.  We need quick wins to reduce emissions as much as possible in 2020, then stronger Nationally Determined Contributions to kick-start the major transformations of economies and societies. We need to catch up on the years in which we procrastinated,  she added. If we don\' t do this, the 1.5\'b0C goal will be out of reach before 2030. The Intergovernmental Panel on Climate Change (IPCC) has warned that going beyond 1.5\'b0C will increase the frequency and intensity of climate impacts, such as the heatwaves and storms witnessed across the globe in the last few years. G20 nations collectively account for 78 per cent of all emissions, but only five G20 members have committed to a long-term zero emissions target. In the short-term, developed countries will have to reduce their emissions quicker than developing countries, for reasons of fairness and equity. However, all countries will need to contribute more to collective effects. Developing countries can learn from successful efforts in developed countries; they can even leapfrog them and adopt cleaner technologies at a faster rate. Crucially, the report says all nations must substantially increase ambition in their Nationally Determined Contributions (NDCs), as the Paris commitments are known, in 2020 and follow up with policies and strategies to implement them. Solutions are available to make meeting the Paris goals possible, but they are not being deployed fast enough or at a sufficiently large scale. Each year, the Emissions Gap Report assesses the gap between anticipated emissions in 2030 and levels consistent with the 1.5\'b0C and 2\'b0C targets of the Paris Agreement.The report finds that GHG emissions have risen 1.5 per cent per year over the last decade. Emissions in 2018, including from land-use changes such as deforestation, hit a new high of 55.3 gigatonnes of CO2 equivalent. To limit temperatures, annual emissions in 2030 need to be 15 gigatonnes of CO2 equivalent lower than current unconditional NDCs imply for the 2\'b0C goal; they need to be 32 gigatonnes lower for the 1.5\'b0C goal. On an annual basis, this means cuts in emissions of 7.6 per cent per year from 2020 to 2030 to meet the 1.5\'b0C goal and 2.7 per cent per year for the 2\'b0C goal. To deliver on these cuts, the levels of ambition in the NDCs must increase at least fivefold for the 1.5\'b0C goal and threefold for the 2\'b0C. Climate change can still be limited to 1.5\'b0C, the report says. There is increased understanding of the additional benefits of climate action - such as clean air and a boost to the Sustainable Development Goals. There are many ambitious efforts from governments, cities, businesses and investors. Solutions, and the pressure and will to implement them, are abundant. As it does each year, the report focuses on the potential of selected sectors to deliver emissions cuts. This year it looks at the energy transition and the potential of efficiency in the use of materials, which can go a long way to closing the emissions gap. There has not been even marginal achievement in challenges for limiting the global warming to 1.5-2.0 degrees Celsius compared to preindustrial revolution as perceived in Paris Agreement.The developed world is not even prepared for providing the required fund for advancing towards the target. Major polluter USA has already moved out of the Paris Agreement. According to the Emissions Gap Report, the global warming can be limited to 3.2 degree Celsius even if all countries achieve the present targets of NDCs. For achieving global warming limitation target of 1.5-2 degrees Celsius, the GHG emissions must be reduced to an annual rate of 7.6% between 2020 and 2030. Climate activists and civil society all over the world in united voice are urging repeatedly that major polluting countries must contribute massively for saving the climate vulnerable countries and saving the mother earth.The climate vulnerable countries using their own resources are endeavoring for reducing GHG emissions for achieving NDC set targets although they have no obligations for this. They desperately need additional fund for reducing more GHG emission. This financing must come as grant and not as loan or insurance.The developed world is not agreeing to this argument. Required investment is the demand of time and nature. If we fail to respond positively to the call of the nature, world civilization, our earth and our light would move towards destruction. Natural calamities have become a frequent phenomenon worldwide. This frequency would assume catastrophic level if we continue to fail in our obligations. Nature would take revenge and its intensity would take the world civilization and mother earth to the brink of destruction. Hence, good senses must dawn on all now for taking consensus decisions. The COP25 is expected to walk along this way.\l"
"COP25","Bangladesh","COP25_Bangladesh35","Army chief's Myanmar visit to be good for Bangladesh: FM","November 27, 2019 Wednesday","United News of Bangladesh","Foreign Minister Dr AK Abdul Momen on Wednesday said the scheduled visit of the Army Chief to Myanmar will be good for Bangladesh and 'open another l"
"COP25","Bangladesh","COP25_Bangladesh36","Realise climate compensation as grant not as credit","November 29, 2019 Friday","The Financial Express (Bangladesh)","Bangladesh, Nov. 29 -- Transparency International, Bangladesh (TIB) has renewed its call to the government to realise compensation from the international agencies as grant not as credit to address climate change effects.TIB made the call at a press conference in the city on Thursday ahead of COP25, the UN Climate Change Conference, to be held on December 2 to 13 in Madrid of Paris.If the countries vulnerable to climate change effects, like Bangladesh, fail to realise grant from the international agencies and developed countries instead of credit, then the local climate victims will have to bear additional burden of it.TIB senior programme manager (climate finance governance) M Zakir Hossain Khan and programme manager (Climate finance policy integrity) Md. Mahfuzul Haque jointly presented a keynote paper.Grant continues to decl"
