"COP","country","ID","title","date","source","text"
"COP24","Canada","COP24_Canada92","World faces 'impossible' task at post-Paris climate talks","November 28, 2018 Wednesday","Postmedia Breaking News","KATOWICE, Poland - Three years after sealing a landmark global climate deal in Paris, world leaders are gathering again to agree on the fine print. The euphoria of 2015 has given way to sober realization that getting an agreement among almost 200 countries, each with their own political and economic demands, will be challenging - as evidenced by President Donald Trump's decision to pull the United States out of the Paris accord, citing his ""America First"" mantra. ""Looking from the outside perspective, it's an impossible task,"" Poland's deputy environment minister, Michal Kurtyka, said of the talks he will preside over in Katowice from Dec. 2-14. Top of the agenda will be finalizing the so-called Paris rulebook, which determines how countries have to count their greenhouse gas emissions, transparently report them to the rest of the world and reveal what they are doing to reduce them. Seasoned negotiators are calling the meeting, which is expected to draw 25,000 participants, ""Paris 2.0"" because of the high stakes at play in Katowice. Forest fires from California to Greece, droughts in Germany and Australia, tropical cyclones Mangkhut in the Pacific and Michael in the Atlantic - scientists say this year's extreme weather offers a glimpse of disasters to come if global warming continues unabated. A recent report by the Intergovernmental Panel on Climate Change warned that time is running out if the world wants to achieve the most ambitious target in the Paris agreement - keeping global warming at 1.5 degrees Celsius (2.7 degrees Fahrenheit). The planet has already warmed by about 1 degree C since pre-industrial times and it's on course for another 2-3 degrees of warming by the end of the century unless drastic action is taken. The conference will have ""quite significant consequences for humanity and for the way in which we take care of our planet,"" Kurtyka told the Associated Press ahead of the talks. Experts agree that the Paris goals can only be met by cutting emissions of carbon dioxide and other greenhouse gases to net zero by 2050. But the Paris agreement let countries set their own emissions targets. Some are on track, others aren't. Overall, the world is heading the wrong way. Last week, the World Meteorological Organization said globally averaged concentrations of carbon dioxide reached a new record in 2017, while the level of other heat-trapping gases such methane and nitrous oxide also rose. This year is expected to see another 2 per cent increase in human-made emissions, as construction of coal-fired power plants in Asia and Africa continue while carbon-absorbing forests are felled faster than they can regrow. ""Everyone recognized that the national plans, when you add everything up, will take us way beyond 3, potentially 4 degrees Celsius warming,"" said Johan Rockstrom, the incoming director of the Potsdam Institute for Climate Impact Research. ""We know that we're moving in the wrong direction,"" Rockstrom told the AP. ""We need to bend the global carbon emissions no later than 2020 - in two years' time - to stand a chance to stay under 2 degrees Celsius."" Doing so will entail a transformation of all sectors of their economies, including a complete end to burning fossil fuel. Poor nations want rich countries to pledge the biggest cuts, on the grounds that they're responsible for most of the carbon emissions in the atmosphere. Rich countries say they're willing to lead the way, but only if poor nations play their part as well. ""Obviously not all countries are at the same stage of development,"" said Lidia Wojtal, an associate with Berlin-based consultancy Climatekos and a former Polish climate negotiator. ""So we need to also take that into account and differentiate between the responsibilities. And that's a huge task."" Among those likely to be pressing hardest for ambitious measures will be small island nations , which are already facing serious challenges from climate change. The U.S., meanwhile, is far from being the driving force it was during the Paris talks under President Barack Obama. Brazil and Australia, previously staunch backers of the accord, appear to be following in Trump's footsteps . Some observers fear nationalist thinking on climate could scupper all hope of meaningful progress in Katowice. Others are more optimistic. ""We will soon see a large enough minority of significant economies moving decisively in the right direction,"" said Rockstrom. ""That can have spillover effects which can be positive."" Poland could end up playing a crucial role in bringing opposing sides together. The country has already presided over three previous rounds of climate talks, and its heavy reliance on carbon-intensive coal for energy is forcing Warsaw to mull some tough measures in the years ahead. The 24th Conference of the Parties, or COP24 as it's known, is being held on the site of a Katowice mine that was closed in 1999 after 176 years of coal production. Five out of the city's seven collieries have been closed since the 1990s, as Poland phased out communist-era subsidies and moved to a market economy. Yet elsewhere in the city, 1,500 miners still extract thousands of tons of coal daily. Poland also still depends on coal for some 80 per cent of its energy needs. Poland intends to send a signal that the miners' futures, and those of millions of others whose jobs are at risk from decarbonization, are not being forgotten. During the first week of talks, leaders are expected to sign a Polish-backed declaration calling for a 'just transition' that will ""create quality jobs in regions affected by transition to a low-carbon economy."" Then negotiators will get down to the gritty task of trimming a 300-page draft into a workable and meaningful agreement that governments can sign off on at the end of the second week. ""(I) hope that parties will be able to reach a compromise and that we will be able to say that Katowice contributed positively to this global effort,"" Kurtyka said. -- Jordans reported from Berlin. -- Follow Frank Jordans on Twitter at HYPERLINK http://www.twitter.com/wirereporter HYPERLINK http://www.twitter.com/wirereporter http://www.twitter.com/wirereporter -- Read more stories on climate issues by The Associated Press at HYPERLINK https://www.apnews.com/Climate https://www.apnews.com/Climate HYPERLINK https://www.apnews.com/Climate https://www.apnews.com/Climate \"
"COP24","Canada","COP24_Canada93","Poles want coal jobs protected amid green energy shift; Poles want coal jobs protected amid green energy shift","August 9, 2018 Thursday 02:28 PM EST","Canadian Press","WARSAW, Poland - Polish trade union leaders and government officials at a climate conference called Thursday for nations to protect industrial jobs and be given the freedom to choose their own approaches to reduce greenhouse gas emissions. The two-day meeting that opened in Katowice aimed to work out the positions of Poland's trade unions and industry before an international climate summit in December taking place in the industrial city. Poland chose to host the COP-24 summit in Katowice to show how this former coal-mining city has been turned into an environment-friendly one in the almost-three decades after the collapse of communism and after Poland joined the European Union in 2004. At the Dec. 3-14 summit, more than 190 countries taking part in the 2015 Paris Agreement are to work out a rulebook for implementing the landmark climate accord. Participants at the Poland conference said nations should be allowed to choose their own ways of cutting carbon emissions in accordance with their industrialization and reliance on fossil fuels. They said developing economies should not be forced to cut jobs. ""Those member countries in Europe that have a chance for a modern development and for modern industry, they should get support, on the condition it really is modern industry that will preserve the region's jobs,"" Deputy Energy Minister Grzegorz Tobiszowski said. Since 1990, Poland has cut over 300,000 coal mining jobs, to some 83,000 currently, and has also scaled down coal extraction to some 65 million tons from 147 million tons. However, the industry remains one of the major employers in Poland and consecutive governments have vowed to protect it, while still modernizing it and making it more environment-friendly. Some 80 per cent of Poland's energy comes from coal, some 15 per cent comes from renewable sources and 5 per cent is from gas. By 2030, the government has pledged to cut coal to some 49 per cent of the country's energy mix. Tomasz Rogala, the head of the European Association for Coal and Lignite, said that last year the EU imported 173 million tons of coal, an amount that could have provided some 175,000 jobs in Europe. Among the issues for the two-week summit in December are how to ensure transparent monitoring of what countries do to cut their global emissions and the methods used to take stock of what countries have achieved. It is also expected that the governments will hear that their current national pledges won't be enough to keep global warming below 2 degrees Celsius by 2100, and should therefore raise their ambitions. While U.S. President Donald Trump has threatened to pull out of the 2015 Paris accord, the rest of the world remains committed to the deal. \"
"COP24","Canada","COP24_Canada94","Protesters block Johnson Street Bridge to highlight need for action on climate change","December 3, 2018 Monday","Postmedia Breaking News","With the aim of pressuring governments to take action on climate change, about 200 people staged a sit-in on the Johnson Street Bridge Monday evening, shutting it down to traffic during the evening commute. Victoria police diverted traffic away from Pandora Avenue, allowing the group to walk from Centennial Square to the bridge. Cars were held at Wharf Street as the group approached the bridge at 6:07 p.m. Protesters carried banners that said ""we will defend our coastline"" and chanted ""this land is truly sacred."" First Nations elder Rose Henry lightly tapped a drum as protesters sat on the pavement in a circle holding candles. The march was timed to coincide with COP 24 , the annual UN climate change conference which started Monday in Poland. The bridge blockade was meant to last 12 minutes, representing the 12 years organizers say is left to address the climate crisis. However, by 6:40 p.m. the group remained on the bridge, singing songs and listening to speakers. In October, the United Nations Intergovernmental Panel on Climate Change released a sobering report, which shows the world is on track to warm up by 1.5 degrees Celsius above pre-industrial levels by 2040. That could cause polar ice caps to melt faster, leading to rising seas which could displace people around the globe. There's also a prediction for more extreme weather, playing a role in wildfires that have ravaged communities across British Columbia and California. Marchers carried candles which shone against the blue lights of the bridge. The crowd was hushed for two minutes to reflect on the depth of the climate emergency. Similar rallies were held across the United Kingdom and Australia last month to highlight government inaction on global climate change. In London, more than 6,000 people blocked five key bridges on Nov. 17, resulting in the arrest of 85 people. Victoria police said earlier they would not close the bridge to facilitate the protesters' actions. Keith Cherry, organizer for Rise and Resist!, said the idea of disrupting the daily commute will send a message to the federal and provincial governments that ""business as usual is not good enough."" Cherry criticized the decision by Prime Minister Justin Trudeau to spend $4.5 billion to buy the Trans Mountain pipeline from Kinder Morgan and the fact that British Columbia continues to push liquified natural gas instead of renewable energy sources. ""Both governments are implicated in pushing fossil fuel expansion at a time we can't afford."" Protesters handed out flyers and thanked waiting drivers for their patience. ""When people are asking to weigh the climate change catastrophe that will be facing our children and grandchildren with the fact that drivers might be asked to wait a few minutes on their evening commute, we think it's a small price to pay,"" Cherry said before the march. A poll released Monday suggests a majority of Canadians are complacent about changing their behaviour to fight climate change. In the Forum Research survey, 62 per cent said they were aware or very aware of the federal government's carbon pricing plan, but 53 per cent said it wouldn't change their behaviour. However, almost half of the respondents - 49 per cent - said they would accept a two to five per cent hike in their costs to help mitigate the effects of climate change. - With files from The Canadian Press \"
"COP24","Canada","COP24_Canada95","QS veut talonner la CAQ sur les changements climatiques jusqu'en Pologne; QS veut talonner la CAQ jusqu'\'e0 la COP24 en Pologne","dimanche 9 d\'e9cembre 2018 04:10 PM EST","La Presse Canadienne","MONTR\'c9AL - Qu\'e9bec solidaire \£bne l\'e2che pas le morceau\'bb dans la lutte aux changements climatiques, comme l£ rappel\'e9 sa chef parlementaire Manon Mass\'e9. La troisi\'e8me opposition \'e0 l'Assembl\'e9e nationale a m\'eame pr\'e9vu envoyer sa porte-parole en mati\'e8re d'environnement, Ruba Ghazal, talonner le gouvernement jusqu'\'e0 la COP24 \'e0 Katowice en Pologne. La d\'e9put\'e9e de Mercier dit se rendre \'e0 la 24e Conf\'e9rence des Parties \'e0 la Convention-cadre des Nations Unies sur les changements climatiques ( COP24 ) dans le but de s'inspirer des meilleures initiatives de partout sur la plan\'e8te. Elle d\'e9plore l£bsence du premier ministre du Qu\'e9bec Fran\'e7ois Legault qu'elle compare \'e0 une politique de la chaise vide. Mme Ghazal affirme tout de m\'eame avoir pr\'e9vu une rencontre, jeudi, avec la ministre de l'Environnement MarieChantal Chass\'e9 \'e0 qui elle pr\'e9voit remettre une copie du plan de lutte aux changements climatiques de QS. Dimanche, dans le cadre de leur conseil national \'e0 Montr\'e9al, les militants ont adopt\'e9 une \£bcampagne sur les changements climatiques\'bb. Il s£git principalement d'un plan de transition \'e9nerg\'e9tique et \'e9conomique jumel\'e9 \'e0 une strat\'e9gie de mobilisation et d'\'e9ducation populaire. Manon Mass\'e9 a parl\'e9 d'un plan \£bambitieux et plus que n\'e9cessaire\'bb. \£bQu\'e9bec solidaire ne va pas parler de changements climatiques comme les autres partis. Pour nous, ce n'est pas juste une question de sacrifices, c'est aussi une fa\'e7on de d\'e9velopper l'\'e9conomie\'bb, a-t-elle d\'e9crit. Le parti entend mettre \'e0 profit sa \£bmachine de mobilisation au service de la n\'e9cessaire transition\'bb, dit Mme Mass\'e9. Des manifestations, des rencontres publiques, la publication de documents de sensibilisation, toutes sortes d£ctions sont \'e0 pr\'e9voir. \£bOn va faire tout ce qu'il faut pour \'eatre audible, mais aussi pour permettre \'e0 la population de s'exprimer\'bb, poursuit la chef parlementaire qui souhaite notamment s£llier \'e0 d£utres partis de gauche \'e9cologistes \'e0 travers le monde. Ruba Ghazal appelle le gouvernement \'e0 passer \'e0 l£ction et \'e0 ne plus se contenter de belles paroles et de gestes symboliques. \£bC'est bien beau, mais le temps des gestes symboliques est termin\'e9. Ce \'e0 quoi les gens s£ttendent, c'est un plan d£ction s\'e9rieux\'bb, a-t-elle d\'e9clar\'e9 en conf\'e9rence de presse quelques heures avant son d\'e9part pour la Pologne. Le \£btroisi\'e8me lien\'bb, un enjeu national Une attaque directe au projet de troisi\'e8me lien dans la Capitale-Nationale. \£bEn ce moment, ce n'est vraiment pas populaire \'e0 Qu\'e9bec. C'est nous, qui vivons au centre-ville, qui voyons d\'e9barquer des milliers d£utomobiles jour apr\'e8s jour. C'est nos lieux de vie! Nos enfants se prom\'e8nent dans les ruelles, dans les rues et elles sont remplies d£utos. On n'en veut juste pas plus\'bb, a comment\'e9 Mme Dorion. Ruba Ghazal souhaite que le dossier devienne un enjeu national et pas seulement r\'e9gional. \£bC'est un type de d\'e9veloppement dont on n£ pas besoin aujourd'hui, d\'e9nonce celle qui est porte-parole en mati\'e8re de Transport. Ce que les gens veulent, ce n'est pas n\'e9cessairement de se d\'e9placer dans leur auto. C'est de pouvoir se d\'e9placer d'un point A \'e0 un point B.\'bb Selon elle, on ne peut pas construire des routes et ensuite bl\'e2mer les gens de les utiliser. Il faut plut\'f4t \'e9viter de les construire et offrir d£utres moyens de transport collectif. \"
"COP24","Canada","COP24_Canada96","Key terms and issue at this year's global climate summit; Key terms and issue at this year's global climate summit","December 1, 2018 Saturday 03:24 AM EST","Canadian Press","KATOWICE, Poland - Negotiators are gathering in Katowice, Poland, for the annual U.N. climate summit, known informally as COP 24 . It is the most important international meeting for countries to discuss and co-ordinate the fight against global warming. Here is a look at some of the key issues and terms that will come up at the event, which starts Sunday and ends on Dec. 14: COP The acronym stands for Conference of the Parties to the U.N. Framework Convention on Climate Change. Held for the first time in 1995, the COP also acts at the meeting of parties to the 1992 Kyoto Protocol that first committed countries to reducing greenhouse gas emissions and the 2015 Paris Agreement. The term ""Paris"" is often used to refer to the accord's headline goal of keeping global warming below 2 degrees Celsius (3.6 degrees Fahrenheit) compared with pre-industrial times, and if possible to limit the increase to 1.5 C (2.7 F). PARIS RULEBOOK When leaders approved the 2015 accord, they put aside a lot of questions about the finer details of how the agreement would work. The meeting in Katowice is meant to finalize those details, including how countries will collect and transparently report their greenhouse gas emissions, and keep track of efforts to reduce them. NDCs Rather than set a global target for emissions cuts, the Paris Agreement allowed countries to submit their own goals, known as Nationally Determined Contributions. It was recognized that all the initial national targets together wouldn't be enough to keep global warming below 2 degrees C, so the Paris accord requires countries to keep raising their goals over time. The next set of NDCs for the period after 2020 needs to be submitted within the next two years. An overview of submissions so far can be found here . TALANOA DIALOGUE To encourage countries to keep raising their NDCs, regular discussions are held among all parties to the Paris Agreement. These review what's been achieved so far and what needs to be done next. As part of its presidency of last year's climate meeting, Fiji introduced the notion of ""talanoa,"" a form of open conversation rooted in the Pacific island's culture that's intended to allow participants to share their stories and learn from each other. It's hoped that the so-called Talanoa Dialogue will allow countries to discuss sensitive issues without resorting to blaming others. GLOBAL STOCK-TAKE Once every five years, countries are meant to summarize the world's overall progress toward achieving the Paris goal of keeping global warming below 2 degrees C - if not 1.5 C. The first such global stock-take was meant to happen in 2023. But because the Paris accord was ratified so quickly, this year's meeting is regarded as the first, albeit unofficial global stock-take. CLIMATE FINANCE Curbing global warming is expected to require a vast overhaul of the world's economy, as countries shift from using fossil fuels to using clean sources of energy to heat homes, manufacture goods and power all manner of devices from cars to computers. Rich countries have the resources to pay for this transition but many poor countries don't. To ensure that they, too, reduce their greenhouse gas emissions large sums of money will need to flow from rich to poor countries. Aside from using the money to ""green"" their economies, developing nations will also need funds to adapt to the inevitable consequences of climate change, such as sea level rise, which are predicted to hit poor countries hardest. \"
"COP24","Canada","COP24_Canada97","Canadian youth @ global climate conference","December 4, 2018 Tuesday","Canadian Government News","Vancouver, Canada: The University of British Columbia (UBC), Canada has issued the following news release: CBC reported on COP24 , the climate conference that started this week in Katowice, Poland, and mentioned Marina Melanidis, one of the members of the B.C. youth delegation. Melanidis is studying natural resources conservation at UBC. In case of any query regarding this article or other content needs please contact: HYPERLINK mailto:editorial@plusmediasolutions.com editorial@plusmediasolutions.com \"
