"COP","country","ID","title","date","source","text"
"COP24","Ireland","COP24_Ireland31","Macron says Europe must sharply adjust greenhouse gas emission targets","October 19, 2018 Friday","The Irish Times","Europe must respond to the latest shocking international climate change report by sharply adjusting its greenhouse gas emissions targets, France's President Emmanuel Macron told journalists in Brussels . Leaders at the EU summit had welcomed the recent publication of the latest Intergovernmental Panel on Climate Change (IPCC) special report. They insisted that the union must step up its preparations for the forthcoming COP24 climate conference in Poland in December. In a strongly worded rebuff to US climate scepticism, they applauded the report for ""unequivocally confirming the negative impacts of climate change, including its conclusions indicating that global emission reductions in all sectors are crucial, and that further action is needed in mitigation and adaptation, notably to reach the temperature goal as set out in the Paris Agreement"". The leaders gave strong backing to proposals from the commission to create a new partnership with Africa, pledging that the new, enhanced relationship would be supported by the ""necessary resources"" through the European External Investment Plan and the EU Trust Fund for Africa . Relationship with Africa The commission president Jean-Claude Juncker insisted their new engagement with Africa ""was not about migration"" but a far wider and more profound new relationship. Leaders recalled their previous condemnation of the Salisbury attack, and deplored the cyber-attack on the Organisation for the Prohibition of Chemical Weapons (Powder). EU security ""Such threats and attacks strengthen our common resolve to further enhance the EU's internal security and our ability and capabilities to detect, prevent, disrupt and respond to hostile activities of foreign intelligence networks and other malicious actors on our territories as well as online ,"" the summit conclusions said. Proposals to require internet platforms to take down terrorist material online within an hour of notification were endorsed. Although the leaders were expected to take Italy to task over its plans to raise its deficit in breach of EU rules, the Italian prime minister Giusesppe Conte got a polite hearing when he reported. Mr Juncker said the leaders felt it was more appropriate for them to await the commission study of all the member state budgets. \"
"COP24","Ireland","COP24_Ireland32","A road map that must be acted on; Climate change deal","December 17, 2018 Monday","The Irish Times","The outcome of the UN climate change talks in Katowice, Poland, deserves a guarded welcome, although it is short of what is required to address a global crisis threatening civilisation in less than two decades. It brings a rules-based global order to the 2015 Paris Agreement. From 2020, it will be driven by actions rather than promises on reducing greenhouse gas emissions. It defines 195 signatory states' responsibilities for tackling climate change, reporting progress and intensifying their efforts for decades to come. At a moment of deep global divisions and instability, governments have reached a deal on climate rules and secured a victory for multilateralism. There is much unfinished business and lack of collective acceptance of what is urgently required. If the key aspiration of the Paris pact - to contain the global temperature rise to within 1.5 degrees - is to have any chance of happening, the verdict of leading climate scientists in the latest Intergovernmental Panel on Climate Change report must be the platform to build future actions. The blunt message at COP24 to governments was that limiting warming to 1.5 degrees is possible but the window for action is narrowing. Scientists delivered; it's up to governments to take unprecedented action. And yet a small band of countries, emboldened by Donald Trump's impending withdrawal from the agreement, while defending their huge fossil fuel interests, found it impossible to ""welcome"" its findings. Significantly, the deal introduces transparency around action and, if outstanding issues are resolved next year, will end rogue accounting practices - such as double counting of reductions. Separately, the talks struck a delicate balance between concerns of the smallest, poorest and most vulnerable countries, developed nations most responsible for global warming, and emerging economies wary of being saddled with a bigger burden to act. At last, there is a clearer path to tangible, ongoing financial supports for adaptation. Negotiators believe the rulebook is a strong enough tool that, if coupled with political leadership, can prevent the worst impacts. But reality reveals gaps; national climate pledges to date put the world on track for up to 4 degrees of warming, double the target agreed in Paris. Many will be bitterly disappointed a political statement urging governments to commit to increased ambition before 2020 did not materialise, though the EU, including Ireland and many other countries, consistently pushed for stronger ambition. Katowice was never going to be the big climate action breakthrough many demanded but it has shown once more the resilience of the Paris pact. It now has a solid road map for climate actions. The missing elements are leadership, necessary urgency and scaled-up national ambitions. \"
"COP24","Ireland","COP24_Ireland33","Climate summit told people in rich countries must eat less meat; Some 50% more food needed by 2050 but greehouse gases must fall in same time","December 7, 2018 Friday","The Irish Times","People living in wealthy countries, including Ireland, will have to make big reductions in the amount of beef and lamb they consume if the world is to be able to feed 10 billion people, according to a World Resources Institute (WRI) report issued at the UN climate summit. These cuts, combined with a series of other measures, are also needed to prevent catastrophic climate change in coming decades, it concludes. More than 50 per cent more food will be needed by 2050, the WRI notes, ""but greenhouse gas emissions from agriculture will have to fall by two-thirds at the same time"". The extra food will have to be produced without creating new farmland, it says, otherwise the world's remaining forests face destruction. Meat and dairy production use 83 per cent of farmland, and produce 60 per cent of agriculture's emissions. Increasing the amount of food produced per hectare was the most critical step, followed by cutting meat-eating and putting a stop to the wasting of one-third of food produced, it suggests. Speaking in Katowice, Poland, which is hosting the summit, Dr Tim Searchinger of the WRI and Princeton University said: ""If we tried to produce all the food needed in 2050 using today's production systems the world would have to convert most of its remaining forest, and agriculture alone would produce almost twice the emissions allowable from all human activities."" Science fiction With a recent UN report setting out the need for the global economy to go ""net-zero"" on carbon emissions by 2050 to limit warming to 1.5 degrees, ""the potential for natural solutions are much better than the science fiction of geoengineering"", a separate report by Christian Aid concludes. Report author Dr Kat Kramer, Christian Aid's global climate lead, said: ""The move to a net zero world by 2050 is gaining momentum as we realise how vital it is to limit global warming to 1.5 degrees."" The search for ways to create ""carbon sinks"" that generate negative emissions was growing, he said at briefing at COP24 , the informal name of the climate conference. ""The idea of putting mirrors in space or spraying the atmosphere with reflective aerosols gets attention but these are largely expensive science fiction fantasies. ""What we need is a renewed relationship with nature. Restoring ecosystems, especially peatlands and native forests, has the potential to create significant benefits for the climate without using our atmosphere as a school laboratory."" - Additional reporting: Guardian \"
"COP24","Ireland","COP24_Ireland34","Nothing says an Irish Christmas quite like the phrase: 'welcome home'","December 8, 2018 Saturday","Irish Independent","must admit, I love Christmas. IBut the stress, the aggro, the needless pressure we put on ourselves? speech: Attenborough called at the COP24 change summit Poland on Photo: Lukasz east/rex That's not for me. Once I realised that Christmas is what you make of it, rather than trying to conform to the ad industry's perception of what a good Yuletide should be, things became a lot easier. But even for someone who enjoys the festive period, it's virtually impossible to maintain my decades' long dedication to laziness. I take my commitment to indolence seriously, and I must say that I've become rather good at it. But for those of us who can't see the point of doing a chore today when you can put if off until tomorrow, this time of the year can be rather, as they say, problematic. Last year was the worst and still gives me The Fear. A combination of typically bad planning and time management meant that I didn't start buying presents until Christmas Eve. falling, That, I thought, was the sensible option - get the work done, then do a surgical strike to the shops and get home, laden with presents, by about lunchtime. do as have the Well, that turned out to be a catastrophically stupid decision and rather than being the smartest cookie in the room, I spent the day jostling with other men as we desperately spent money we didn't have on things people didn't want. Christmas seemed to creep up on us idiots who were desperately trying to buy anything that wasn't nailed down and, later, when I pointed out the huge number of men and very few women to the wife, she had a simple response - men are idiots. Frankly, after the hellish experience of the previous few hours, I couldn't argue with her. But it won't sneak up on me this year because I am now fully into the festive mood. levy now The reason? Well, in my local the other night, a group gathered behind were waiting for a special guest. When they turned up, the air was filled with cries of 'welcome home!' And it struck me - there isn't a phrase that better suits the best elements of an Irish Christmas than 'welcome home.' about plastic ' It also inspired me to never make the same mistake that I made last year. Nope, in 2018, the newer, smarter me will avoid all the Christmas Eve hassle. I'll definitely do my shopping on the 23rd instead... \"
"COP24","Ireland","COP24_Ireland35","Climate change talks move closer to deal on curbing emissions","December 15, 2018 Saturday","The Irish Times","The United Nations talks on securing a robust rule book for the Paris agreement on climate change were edging closure to agreement last night after 24 hours of notable progress. An outline decision circulated yesterday, the last day of official talks, contained plans for a common rule book for all countries, with flexibility for poorer countries - and provision for all countries to increase their carbon-cutting commitments by 2020. Most delegations believed, however, the final outcome was still in the balance; especially on the issue of whether it will be ambitious enough in agreeing measures to contain global temperatures to a 1.5 degree rise as required under the 2015 agreement. Of critical importance to a majority of states was to ensure the rule book was compatible with the recent Intergovernmental Panel on Climate Change report, which concluded it was only a matter of years before the effects of catastrophic climate change would begin to hit many parts of the world. But the option of a two-tier rule book was still in the draft, which developing countries contended would let richer countries off the hook in addressing their responsibilities. Among key issues not yet decided was the question of ""loss and damage"", which is of most concern to least developed countries and small island states; how vulnerable communities and states in the front line of climate change impacts will be adequately supported. Whether the damage caused by climate change would be accounted for when countries submit their climate reports to the UN was unresolved. This is being sought by vulnerable countries as it would increase pressure on the developed world to assist. The United States has traditionally resisted all mentions of loss and damage. There was minimal progress in getting countries to make firm commitments to cut their emissions further than already committed to. A revised text issued early yesterday called for developed countries to meet long-standing promises to boost climate-related aid to $100 billion a year by 2020, ""noting with concern the urgent and emerging needs"" arising from more extreme weather events in recent years. Lockdown A further updated text was due last night, while negotiating teams were in ""lock down"" for most of the day as a series of bilateral meetings was taking place under the direction of COP24 president Michal Kurtyka. The Irish delegation under the umbrella of the European Union has supported efforts to ensure the rule book is underpinned by clarity and transparency, with tighter deadlines and ending practices such as double counting of emission reductions. A system for measuring, reporting and verifying greenhouse gas emissions in all states will be part of the rule book, including a ""global stocktake"" of overall progress on meeting the Paris goals. But the structures underpinning this had yet to be signed off, according to sources. \"
"COP24","Ireland","COP24_Ireland36","2018 to be among hottest years on record - UN","November 29, 2018 Thursday 4:23 PM GMT","RTE News","Global temperatures in 2018 are set to be the fourth highest on record, the UN has said, stressing the urgent need for action to rein in runaway warming of the planet. In a report released ahead of a major climate summit in Poland, the World Meteorological Organisation pointed out that the 20 warmest years on record have been in the past 22 years, and that ""2018 is on course to be the 4th warmest year on record"". ""This would mean that the past four years \- 2015, 2016, 2017 and 2018 \- are also the four warmest years in the series,"" the UN agency said in its provisional report on the state of the climate this year. The report shows that the global average temperature for the first ten months of the year was nearly 1.0-degree Celsius above the pre-industrial era (1850-1900). ""It is worth repeating once again that we are the first generation to fully understand climate change and the last generation to be able to do something about it,"" Mr Taalas warned. With levels of greenhouse gases in the atmosphere, the main driver of climate change, at a record high, ""we may see temperature increase of 3-5C by the end of the century,"" he said. ""If we exploit all known fossil fuel resources, the temperature rise will be considerably higher."" Delegations from nearly 200 countries are due in Poland next week for what is known as the COP24 climate summit, aimed at renewing and building on the Paris deal and limiting global warming. The Conference of the Parties (COP) is the supreme body of the United Nations Framework Convention on Climate Change (UNFCCC). World leaders have been trying to breathe new life into the 195-nation agreement amid backsliding from several nations, most notably the US, over commitments made when it was signed in December 2015. It is to take effect in 2020 and calls for limiting global warming to less than 1.5C above pre-industrial levels. But experts have warned that global warming is on track to surpass three degrees by 2100 and urge governments to do more than first planned to rein it in. ""Every fraction of a degree of warming makes a difference to human health and access to food and fresh water, to the extinction of animals and plants, to the survival of coral reefs and marine life,"" WMO deputy chief Elena Manaenkova stressed in a statement. ""It makes a difference to economic productivity, food security, and to the resilience of our infrastructure and cities,"" she said. ""It makes a difference to the speed of glacier melt and water supplies, and the future of low-lying islands and coastal communities."" \"
"COP24","Ireland","COP24_Ireland37","New push to finalise rulebook on implementing Paris agreement; Stand-off between US and China threatens to slow global action on climate change","December 8, 2018 Saturday","The Irish Times","The pace of negotiations at the UN climate talks has quickened in advance of politicians returning to Katowice in Poland this weekend. An attempt to finalise a deal on a rulebook for full implementation of the Paris agreement from 2020 will be made in the coming days. As new draft negotiating texts were circulated this week, finance elements were the most difficult to get across the line. ""We are not there yet,"" said Jo Tyndall, one of the co-chairs, at a plenary session late on Thursday. A final push was in progress overnight into yesterday, in advance of ministers and lead negotiators arriving today. Minister for Climate Action Richard Bruton is due to return to the summit on Tuesday. With developed countries having so far failed to deliver on their promise of $100 billion per year by 2020, trust has evaporated from the perspective of developing countries. Meanwhile, a stand-off between the US and China threatens to slow global action on climate change when the risks of catastrophe are accelerating. Biggest threats ""The biggest threats to the planet are the lack of US climate leadership at home and the unwillingness of the US to engage with China,"" said Joanna Lewis, a China specialist at Georgetown University. ""The rest of the world looks to the US and China for leadership, and it has become clear that, as the alliance has waned, global momentum to address climate change has slowed."" Taken together, the emissions produced by the US and China account for more than 40 per cent of the global total. In both countries emissions went up this year, according to analysis issued this week by the Global Carbon Project. While China's emissions have grown in the past two years, mainly because of continued use of coal, it is on track to meet its modest, self-imposed Paris target to reach peak emissions by 2030. Rulebook COP24 opened amid concerns that a rulebook might prove impossible to negotiate, according to Jennifer Higgins, policy and advocacy adviser at Christian Aid Ireland. Other fears, she said, ""included a roll back on ambition, a lack of strong leadership, and an inadequate response to the finding of the IPCC [Intergovernmental Panel on Climate Change] special report which clearly demonstrated that if we continue on our current path we'll breach the goal of limiting global warming of 1.5 degrees in just 12 years"". There was, however, optimism in the air, ""and instead we are looking to some better-case scenarios, a pulling together, with a proactive effort to ensure a complete rulebook by the end of the COP"". Whether this was well founded would emerge only when finalised documents emerge next week. The message from civil society organisations attending the summit was the need for urgency. This was echoed, she believed, by the renowned naturalist Sir David Attenborough who, in occupying the ""people's seat"" at the beginning of the COP, said people wanted decision-makers to act now. An Taisce advocacy officer Ian Lumley highlighted a disconnect between reality and genuine climate action. ""The display at the entry to the national exhibition pavilions featured the wonders of coal as a base ingredient in soap and cosmetic beauty treatments, and managed to ignore climate and air pollution impact,"" Mr Lumley said. Additional reporting: New York Times \"
"COP24","Ireland","COP24_Ireland38","Negotiators face uphill task to forge global deal; China accuses some rich nations of breaking pollution clean-up promises","December 14, 2018 Friday","The Irish Times","Tension, tiredness and reports of lack of progress on the issues that have repeatedly surfaced at the UN climate talks were all too evident yesterday as negotiators attempted to forge a global deal on the Paris Agreement rulebook. China accused some of the richest nations in the world of ""backsliding"" on promises to clean up pollution, reduce greenhouse gas emissions, and provide $100 billion a year in climate-related aid by 2020. Poland spearheaded a push by a group of the 79 least developed countries for clarity on when those promises would be fulfilled. It indicated deepening rifts, with the talks, that were due to conclude in Katowice today, likely to run into the weekend. ""Some delegations are backsliding,"" Xie Zhenhua, China's lead envoy to the talks in Katowice, said at a briefing. ""There are still quite a number of developed countries who did not start providing financial and technological support that they had pledged in the Paris Agreement three years ago. We cannot accept any backsliding."" The remarks illustrated the divide on environmental issues between China and the US, which had worked together to seal the Paris pact in 2015. The NGO, ActionAid, warned that ambition on averting catastrophic climate change ""is at risk of fizzling out"". ""Ministers are here to agree the rulebook needed to implement the 2015 Paris Agreement to limit global warming to 1.5 degrees and protect the planet now and for future generations,"" said Harjeet Singh, its lead on climate change. ""The alternative is unconscionable: up to 150 million more premature deaths and millions more people forced to migrate because of climate change."" Deniers A coalition of African environmental and climate justice groups said the report was ""under contemptuous attack by a coalition of climate deniers revolving around the US"". What's worrying many delegates and observers is the complexity of the task of delivering a strong rulebook. That concern was echoed by Prof John Sweeney who is representing An Taisce at COP24 . ""I think it's pretty normal for the Thursday [before the final day] but suspect there is more resistance to compromise this year,"" Prof Sweeney said. There was a notable lack of clarity on emissions targets and how they were accounted for, he added. Without a level playing field, there was a risk some countries would exploit ambiguities. Developing nations were resisting measures that would ensure transparency in the way emission cuts are measured, reported and verified. There has also been an attempt by a small number of countries to remove human rights references from the preamble of the Paris Agreement. Former president and climate justice campaigner Mary Robinson fought hard to get it more centrally featured. What might not be the final day will coincide with more school strikes across the world, notably in the US and Germany, as young people demonstrate concern about a lack on progress in addressing climate change. British energy and clean growth minister Claire Perry confirmed the UK had written to the UN offering to host the 2020 climate summit, which would coincide with the Paris pact coming into full effect. It would also come just weeks after the next US election, which is likely to see any Democrat candidate run on a ticket of returning the US to the accord, while President Trump will seek to rubber-stamp his decision to quit the treaty. The day after the election, the US must affirm its withdrawal or not. \"
