"COP","country","ID","title","date","source","text"
"COP22","UAE","COP22_UAE18","UAE Water Aid Foundation highlights key achievements at 9th meeting held by board of trustees","January 11, 2017 Wednesday","Emirates News Agency (WAM)","UAE Water Aid FoundationDUBAI, 11th January, 2017 (WAM) -- Suqia, the UAE Water Aid Foundation, has held its ninth board of trustees meeting at the headquarters of Dubai Electricity and Water Authority, DEWA, chaired by Saeed Mohammed Al Tayer, Chairman of the board of trustees of Suqia, and attended by Dr. Mohammed Abdullah Al Baili, Deputy Vice Chairman for Academic Affairs and Provost of United Arab Emirates University.Also attending were Waleed Salman, Executive Vice President of Strategy and Business Development at DEWA, Nasser Lootah, Executive Vice President of Generation at DEWA, Abdulkareem Al Shamsi, Acting Executive Director of Suqia, and Abdullah bin Afira Al Falasi, Acting Secretary of the board of trustees of Suqia.Mr. Al Tayer welcomed the board members and lauded their efforts and achievements during 2016. He also praised the efforts made by Suqia to promote the Mohammed bin Rashid Al Maktoum Global Water Award in international events such as the 22nd session of the Conference of the Parties, COP22, in Marrakesh, Morocco, and the 2016 Conference on Research and Technology Development for Sustainable Water Resources Management in Cairo.Al Tayer said that Suqia would double its efforts in the field of humanitarian aid, in tune with the declaration of 2017 as the ""Year of Giving"", announced by President His Highness Sheikh Khalifa bin Zayed Al Nahyan. It is also in sync with the directives of Vice President, Prime Minister and Ruler of Dubai, His Highness Sheikh Mohammed bin Rashid Al Maktoum, to create a knowledge-based economy with focus on technology, research and development and innovation to find solutions to the global issue of water scarcity.""The Mohammed bin Rashid Al Maktoum Global Water Award contributes to achieving the National Innovation Strategy, launched by His Highness Sheikh Mohammed bin Rashid Al Maktoum, to transform the UAE into one of the most innovative countries in the world by 2021. Suqia encourages leading corporations, research centres, institutions and innovators from across the world to compete and find sustainable and innovative renewable energy solutions for water scarcity while focussing on young innovators as they account for the largest percentage of participants. This reflects our efforts to enhance the participation of the youth in protecting the environment and sustainable development, in adherence with the national initiative, ""Green Economy for Sustainable Development"", to build a green economy in the UAE,"" Al Tayer said.He noted that Suqia had received 138 applications to contend for the award, 26 of which came from UAE-based applicants. This reflects the commitment of all government and private organisations to achieve the vision of the wise leadership. It also received 14 applications from Egypt, 10 from India, five each from Saudi Arabia, The Netherlands and South Korea, four each from the UK, Kuwait, and Italy, three applications each from Bahrain, South Africa, France, Brazil, Qatar, Japan, Greece and the US, and 36 applications from other multinational organisations.""The Mohammed bin Rashid Al Maktoum Global Water Award has generated huge interest from leading research companies, institutions and innovators from all over the world competing to find sustainable solutions for water scarcity. The achievements made by Suqia during 2016 reflect its commitment towards achieving the directives of the wise leadership to strengthen the UAE's participation in the field of humanitarian aid,"" said Al Shamsi, Acting Executive Director of Suqia.The meeting discussed Suqia's latest projects in co-operation with the Mohammed bin Rashid Al Maktoum Humanitarian and Charity Establishment, including the completion of two boreholes in Ghana during the last quarter of 2016, bringing the total number of beneficiaries to 40,000. Boreholes are currently being drilled in Afghanistan, Mauritania, Somalia, Tajikistan, Ghana, Benin, Uganda, Bangladesh, Mali and Senegal to benefit an estimated 53,900 people. The meeting also highlighted Suqia winning the top slot in the Carbon Ambassadors Programme.Suqia's team designed a water purification unit that operates using reverse osmosis and retrofitted a 20ft recycled shipping container. The system produces 7.6 cu.m. of potable water per day, helping more than 1,500 people on a daily basis. Suqia also contributed to the State of Green Economy Report 2017, which was launched during the Climate Action 2016 Summit. The event was held on the sidel"
"COP22","UAE","COP22_UAE19","ADSW will help facilitate the implementation of national clean energy targets: Kazakhstan President","January 16, 2017 Monday","Emirates News Agency (WAM)","ADSW/President of Kazakhstan""We have an acute need to secure safe energy and ecological conditions for the planet. The 21st century should be the epoch for breakthrough decisions and solutions in energy, and an epoch that will define not only the future direction of the energy industry, but the fate of the planet for 1,000 years to come,"" he said at the opening ceremony.""The majority of the global community understand the seriousness of the issue,"" President Nazarbayev added. ""The proof is the obligations undertaken by countries within the sustainable development goals of the United Nations by 2030. However, the energy policy of the world is still not fully aligned. I believe that ADSW will help facilitate the implementation of national clean energy targets. Renewable energy sources are today more affordable than they were before. We must take advantage."" Taking place on the theme, ""Practical steps towards a sustainable future"", this year's Abu Dhabi Sustainability Week is one of the first global platforms to debate the outcomes of the international climate conference, COP22, in Marrakech, and to take further action to accelerate the adoption of renewable energy following the ratification of the Paris Agreement.The ADSW opening ceremony was followed by Abu Dhabi Global Action Day, a high-level conference aimed at turning the goals of the Paris Climate Agreement and the 2030 Agenda for Sustainable Development into practical and innovative solutions in policy, investment, technology and partnerships, with a focus on the steps to be taken by both government and business.Dr. Thani Al Zeyoudi, UAE Minister of Climate Change and Environment, MoCCE, opened the Global Action Day programme.\l"
"COP22","UAE","COP22_UAE20","Masdar announces winner of fifth Engage Social Media Contest","January 14, 2017 Saturday","Emirates News Agency (WAM)","Masdar / 'Engage' Social Media Contest WinnerABU DHABI, 14th January, 2017 (WAM) -- Abu Dhabi's renewable energy company Masdar announced the winner of its fifth Engage Social Media Contest.This year's winning post was submitted by Seva Karpauskaite from Kaunus, Lithuania. Her video, featuring the iconic Washington, D.C., monuments as a backdrop, explored the need to develop green structures that would allow clean technologies to expand and scale in order to reduce climate change risks over the next decade.The annual contest received 130 entries, a record participation since it started, with submissions coming from 45 countries across six continents. For the first time, the contest welcomed submissions in formats other than blog posts, which led to entries that included videos, slideshows and Tumblr updates.The contest asked participants to make a case for the solutions which, in their view, could be most effective in mitigating climate change risks over the next decade.The goal of the contest was to connect the momentum gained from the November COP22 climate talks in Marrakech, Morocco, with the enthusiasm building for the annual Abu Dhabi Sustainability Week, ADSW, which runs from 12th to 21st January.Outcome from Masdar's recent GenZ Global Sustainability Survey also shaped this year's theme as the survey found that global citizens aged 18-25 believed that climate change posed the greatest challenge to their future security and prosperity. Contestants were encouraged to debate their opinions within the Engage site as well on social media platforms, using the hashtag #WorldIn2026.Karpauskaite is the first European and second woman to win the contest. A graduate of King's College at Cambridge University, she had done her bachelor's degree in Politics, Psychology and Sociology. She is now studying at the School of International Studies at Johns Hopkins University in Washington, D.C., where she is pursuing a master's degree in International Economics and International Politics with a focus on Energy, Resources and Environment. One of her long-term goals is to combine theoretical insights with practical experience into a future career in sustainability advocacy and consulting.As the winner of this year's Engage, Karpauskaite will be Masdar's VIP social media influencer at the 2017 Abu Dhabi Sustainability Week, ADSW.""We are very pleased to see the record level of participation this year's Engage contest generated,"" said Masdar's Anca Westley, Director of ADSW. ""At a time when Masdar's recent GenZ survey showed just how passionate young citizens worldwide are about addressing climate change, the contest raised many ideas regarding how the society can ensure sustainable development over the next 10 years,"" she said.\l"
"COP22","UAE","COP22_UAE21","Moroccan Minister visits UAE pavilion at Marrakech Climate Conference","November 18, 2016 Friday","Emirates News Agency (WAM)","Moroccan Minister visits UAE pavilion at Marrakech Climate ConferenceMARRAKECH, 18th November, 2016 (WAM)--Salaheddine Mezouar, Minister for Foreign Affairs and Cooperation of Morocco and Chairman of Supervisory Committee of 22nd session of the Conference of Parties (COP22) of the United Nations Framework Convention on Climate Change (UNFCCC), has visited the UAE pavilion on the sidel"
"COP22","UAE","COP22_UAE22","Renewable energy charging forward","December 1, 2016","Gulf Industry Worldwide","Low natural gas and electricity prices have created a tough competitive environment for renewable energy, but this has remarkably had little impact on the momentum of alternative energy growth, finds a new Deloitte report entitled,  Alternative Thinking 2016: Five game-changers that are powering the future of renewable energy. The report identifies the important trends and opportunities in the renewable energy industry. It also presents  what if scenarios that may propel the renewable power sector forward, outpacing current projections. Alternative energy is at a tipping point, said Salam Awawdeh, Partner and Middle East Energy & Resources Leader at Deloitte in the Middle East.  The growth we have seen over the past few years since we last published the report is now ready to be propelled forward as a result of these game-changers. Especially in the Middle East, Solar friendly policies across all parts of the solar value chain (investors, solar developers, construction contractors and technology manufacturers) have contributed enormously to solar industry growth in many jurisdictions; Jordan, UAE and Egypt amongst others.Enthusiastic effort is invested in realignment of relevant energy strategies as many were considered when Brent crude exceeded $105 per barrel, and emphasis was put on the lower cost-recovery tariffs guaranteed by technologies such as renewables, oil shale or nuclear. The large drop in oil prices, if sustained, would considerably reduce generation investment cost recovery. And a spell over effect, it may reduce the opportunity cost of switching away from traditional fossil fuels, and make some technologies almost cost-comparable to traditional ones \- at least in the short term. According to the report, the convergence of forces driving renewable energy forward has created a momentum that is likely irreversible for the industry. These five game-changers include:Regulatory reform and public policy support: Far-reaching regulations at global, national and local levels are driving increased adoption of renewable energy. This includes the 2015 United Nations as well as adoption of state and provincial regulations to protect the environment.Corporate commitment: A significant number of large global companies have launched a movement to generate all of their energy from renewables in the next two decades. In the US alone, 58 leading multinational corporations have signed on to the Renewable Energy Buyers\' Principles1, an initiative that aims to make renewable energy easier for companies to procure at a large scale.Financing innovation: Investors now understand renewables as an asset class and are more confident in investing in them, while new financing vehicles have lowered the cost of capital and improved access to it. Giving companies the opportunity to reduce their tax burdens bolsters the trend of corporations investing in renewables by making the overall financial proposition even more attractive.Energy storage: Energy storage technology is advancing and making renewable energy more viable by eliminating the issue of intermittency.Grid integration: Once the nemesis of utilities, a host of new technologies are quickly making integration of intermittent power sources into the electricity grid a problem of the past. With the capability to manage electricity flows in different directions, the system operators have the ability to manage production and supply in real-time.Though the traditional barriers of cost, intermittency, and grid integration are still present, they are not seen as deal-breakers in the long run, according to the report. Growing pains are inevitable, but they are surmountable for renewable energy, Awawdeh added.  First-movers such as Denmark, Germany, China, the UK, the US and Spain have addressed them, and the results of recent regulatory initiatives suggest that many other nations now believe it is necessary to do so. This indicates that perhaps alternative energy has not just entered the mainstream, but is quickly becoming the norm itself. \l"
"COP22","UAE","COP22_UAE23","King Mohammed VI of Morocco launches Noor PV I","April 2, 2017 Sunday","ConstructionWeekOnline.com","King Mohammed VI of Morocco has officially launched the Noor PV I Programme inOuarzazate.The programme relates to Phase 1 of photovoltaic (PV) power generation plants within the Noor Solar Plan.The launch ceremony of Noor Ouarzazate IV plant, which will boast a generating capacity of 72MW, follows the agreement that was inked in November 2016 at COP22 at Marrakech.The deal was signed by a consortium led by Saudi Arabia's ACWA Power, which will develop and operate the plant. The total cost of Noor PV I project is $220m.[[banner]]ACWA Power was selected through an international tender, and will be responsible for the development, construction and long-term operation of Ouarzazate plant under a build, operate, own, and transfer (BOOT) scheme.A consortium of Sterling & Wilson, Shapoorji Pallonji, and Chint Solar will undertake the delivery of the facilities under a delivery, procurement, and construction contract on behalf of the sponsors.In addition to its role as off-taker of the generated energy, and one of three shareholders in the project owning company, the Moroccan Agency for Sustainable Energy (Masen) will act as the sole lender to the project owning company.The programme forms part of the Noor Solar Plan, which aims to develop a combined solar capacity of approximately two Gigawatt by 2020 to meet the growing energy demand of the country.Chairman of ACWA Power, Mohammad Abunayyan, said:  ACWA Power is proud to be entrusted with yet another component of this ambitious target of the Kingdom of Morocco\' s visionary sustainable energy strategy. Just as in the case of the three Concentrated Solar Power (CSP) plant development projects at the NOOR Solar Complex at Ouarzazate, this program will not only focus on the delivery of green electricity at a low-cost, but it will also deliver on the strategy of employment creation and economic development from renewable energy capacity deployment. President and chief executive officer of ACWA Power, Paddy Padmanathan, added:  ACWA Power cherishes the trust of the Government of Morocco through its renewable energy agency Masen to expand its investments in the Kingdom to deliver significant renewable energy capacity at pace setting tariff levels in support of the country\' s unwavering commitment to decarbonize electricity generation without compromising the social and economic development of the kingdom. Also commenting on the programme, chief investment officer of ACWA Power, Rajit Nanda, stated:  As ACWA Power continues to expand its international portfolio, we are truly privileged to participate in a country like Morocco and partner with an agency like Masen with visionary world class leadership committed to doing what is best not just for themselves but for the future generations of the people of entire planet and as such we feel immense pride in when milestones such as this inauguration drive forward clean energy ambition. Construction on Noor PV 1 will begin in April 2017, and is expected to reach completion by end of April 2018. HYPERLINK http://imgs.syndigate.info/264/898/44/149116595170.jpgMorocco-Photo-2.jpg\l"
"COP22","UAE","COP22_UAE24","US-UAE Strategic Energy Dialogue takes place in Washington","October 30, 2016 Sunday","Emirates News Agency (WAM)","Strategic Energy Dialogue / US / UAEUS Deputy Secretary of Energy Dr. Elizabeth Sherwood-Randall and UAE Under-Secretary of Energy, Dr. Matar Al Neyadi, co-chaired the meeting to exchange ideas and review joint cooperative efforts for expanded cooperation in clean energy, carbon capture, utilisation and storage, and civil nuclear energy. Sherwood-Randall and Al Neyadi also launched a new work stream under the dialogue mandate devoted to exploring collaborative research opportunities on nuclear power.During the dialogue, the parties discussed the importance of addressing energy security and climate change challenges through public and private sector partnerships and investment to support the development and deployment of sustainable energy technologies, as well as mutual bilateral and multilateral initiatives.Key bilateral initiatives discussed included the first Solar Decathlon Middle East, a competition for university students to design and build solar-powered homes, due to take place in Dubai in late 2018. The Solar Decathlon programme has proved instrumental in promoting the deployment of cutting-edge renewable energy and energy efficiency technologies.Another bilateral collaboration is DOE's work with the UAE's Masdar group on innovative water desalination technologies, where the DOE's National Renewable Energy Laboratory experts provide technical assistance for Masdar's water desalination pilot programme through the Global Clean Water Desalination Alliance. A key focus of discussion was a white paper on the state of technology for energy efficient and renewable energy powered water desalination systems, and the potential for desalinisation systems to provide grid services. The alliance plans to present its findings during the 22nd Conference of the Parties, COP22, in Marrakech, Morocco in November 2016.Stressing the importance of multilateral cooperation, the delegation focused on expanding the UAE's leadership role in three key international initiatives: the Carbon Sequestration Leadership Forum, the Clean Energy Ministerial with a focus on the Clean Energy Education Empowerment Initiative, C3E, and Mission Innovation. The US and the UAE agreed to participate in programmes to highlight these efforts at COP22.At a luncheon at the UAE Embassy at the conclusion of the dialogue, Deputy Secretary Sherwood-Randall and Dr. Al Neyadi both agreed that the strategic energy dialogue between the two countries is crucial for further energy cooperation and represents a key element of the broader US-UAE partnership. Dr. Matar offered to host the next dialogue in Abu Dhabi in 2017.\l"
"COP22","UAE","COP22_UAE25","UAE discusses renewables' emerging role in climate change and sustainable development at IRENA's meeting","November 3, 2016 Thursday","Emirates News Agency (WAM)","UAE / IRENA / MEETINGABU DHABI, 3rd November, 2016 (WAM) -- The UAE joined 100 countries from around the world for the International Renewable Energy Agency's (IRENA) twelfth council meeting held in Abu Dhabi.The UAE delegation was led by Dr. Thani bin Ahmed Al-Zeyoudi, Minister of Climate Change and Environment and the Permanent Representative of the United Arab Emirates to IRENA.This meeting comes at a very significant time preceding COP22 where countries will meet in Marrakech from 7th to 18th November 2016 to set up the roadmap to implement the Paris Climate agreement, which will enter into force on the 4th of November 2016.IRENA's 12th council also comes after Habitat III summit that took place in Quito, Ecuador, from 17th to 20th October 2016, where 193 countries of the United Nations adopted a new urban agenda, which highlights the key role renewable energy in achieving sustainable development in cities. The UAE has served on the board that prepared the Habitat III summit and has partnered with Ecuador, Germany and IRENA to host the high-level day on renewable energy ""RE-energising Cities"" at the summit.""In COP22The council, which saw the highest country participation ever at an IRENA council meeting, met to discuss IRENA's progress in the implementation of its work programme and the framework for the Medium-term Strategy 2018-2022, in addition to the role of renewables in urban settings and the Sustainable Development Goals, and Climate Change National Intended Contributions.""We have seen impressive solar developments in the UAE this year with Mohammed bin Rashid Al Maktoum Solar Park in Dubai, and recently in Abu Dhabi where its planned 350MW solar PV plant in Sweihan received very competitive bids, with the lowest bid offering a new global record low price of 2.42 U.S. US cents/kWh."" Said Ali Alshafar, Deputy Head of Delegation of the United Arab Emirates to IRENA's council. ""The success of renewables in the world has been tremendous, with its costs falling even further accelerating its deployment. This fact accentuates IRENA's role as the global voice of renewables aiding countries in their energy transitions. As the host country of IRENA, we remain committed to fully support the agency on all fronts.""IRENA's council is accountable to the Assembly and is composed of 21 Members who are elected on a rotating basis to ensure the effective participation of both developing and developed countries, the fair and equitable geographical distribution and the effectiveness of the Council's work. The Council, among other responsibilities, facilitates consultations and cooperation among Members and considers the draft work programme, draft budget and annual report.\l"
