"COP","country","ID","title","date","source","text"
"COP22","Canada","COP22_Canada54","Let Taiwan join in climate change talks","October 15, 2016 Saturday","Ottawa Citizen","Re: A carbon tax isn't enough, Oct. 7.Canada's move to put a price on carbon and the support for this shown in a recent Nanos poll deserve applause. The Canadian government is fully aware of the consequences of climate change and acknowledges that something must be done soon. Like Canada, Taiwan has stepped up efforts in fighting climate change. Although not a member of the UN FrameworkConvention on Climate Change, Taiwan voluntarily enacted the Greenhouse Gas Reduction and Management Act in July 2015 to cut carbon emissions by 50 per cent below 2005 levels by 2050, making Taiwan one of the few countries to write its GHG reduction target into domestic law.This approach is in l"
"COP22","Canada","COP22_Canada55","Morocco's African Diplomacy Expands Eastward","October 31, 2016 Monday","Marketwire (Canada)","WASHINGTON, DC--(Marketwired - October 31, 2016) - Morocco's King Mohammed VI has concluded a tour of Rwanda and Tanzania, resulting in more than 40 bilateral agreements and marking the eastward expansion of Morocco's diplomatic efforts in Africa.The tour began on October 18 in Kigali, where King Mohammed VI met with Rwandan President Paul Kagame and chaired the signing of some 20 bilateral agreements, covering a broad range of sectors from agriculture to banking, to renewable energy and security cooperation. Among them was an agreement by Attijariwafa Bank, one of Morocco's biggest banks, to buy Rwandan bank Compagnie G\'e9n\'e9rale de Banque Limited (Cogebanque), a deal worth around $41 million. Morocco's Office Cherifien de Phosphate (OCP), the world's leading phosphate exporter, also committed to build a plant in Rwanda to ""produce fertilizers adapted to local soils,"" as reported in Reuters. While in the country, King Mohammed VI also paid his respects to the victims of the Rwanda genocide at Kigali Genocide Memorial.On October 23, King Mohammed VI arrived for a three-day visit to Tanzania, where he and Tanzanian President John Pombe Magufuli chaired the signing ceremony of 22 bilateral agreements in the capital of Dar es Salaam. While the agreements focused on a range of economic and development issues, including infrastructure development and energy policy, the King also launched the building of the King Mohammed VI Mosque in response to a request by Mufti Sheikh Abu-Bakr Ibn Zubayr Benali, President of the National Muslim Council of Tanzania, offering 10,000 copies of the Koran to the Council. The gesture follows the King's commitment to expanding Morocco's tolerant and moderate form of Islam.The East Africa tour comes just a few months after King Mohammed VI announced his intention for Morocco to rejoin the African Union (AU). Some thirty countries have already voiced their support for Morocco's bid, including Benin, Gabon, Liberia, Senegal, Egypt, and Ghana, to name just a few. Another East Africa visit, to includeEthiopia -- the home of AU headquarters -- is scheduled to take place following the 22nd session of the Conference of the Parties to the United Nations Framework Convention on Climate Change (COP22), which the Kingdom is hosting in Marrakech from November 7-18.Since ascending the throne in 1999, the King has made Africa a foreign policy priority, visiting 35 African countries and signing more than 320 bilateral agreements. Beyond his many trips, in late 2013 the King established a program to train imams from across the continent. In March 2015 in Rabat, he formally opened the Mohammed VI Institute for the Training of Imams, Morchidines, and Morchidates, which has already welcomed students from Mali, Tunisia, and France, among other countries. In April 2015, Morocco signed a memorandum of understanding with the Millennium Challenge Corporation ""with the goal of reducing poverty in Africa, including a focus on promoting adoption of new technologies and innovative business models to promote entrepreneurship."" The King has also vowed to represent Africa's interests on climate change policy at the COP22 summit.Ambassador Michael Battle at the US Department of State has said of Morocco's diplomatic efforts, ""Morocco is setting the pace by showing how African countries which are prosperous can be responsive to African countries which are in the process of becoming prosperous."" In a recent article highlighting Morocco's growing role in Africa, J. Peter Pham, Director of the Atlantic Council's Africa Center, wrote, ""US policymakers would do well to 'triangulate' -- or, at the very least, better coordinate -- their efforts with those of African allies like Morocco that are already providing home-grown solutions to the challenges faced by the continent, its nations, and their peoples today.""""The United States is lucky to have such a close and longstanding friend and ally, Morocco, expanding its influence and relationships in Africa, a continent on the rise and likely to be at the crux of future policy debates,"" said former US Ambassador to Morocco Edward M. Gabriel.The Moroccan Amercan Center for Polcy (MACP) is a non-profit organization whose principal mission is to inform opinion makers, government officials, and interested publics in the United States about political and social developments in Morocco and the role being played by the Kingdom of Morocco in broader strategic developments in North Africa, the Mediterranean, and the Middle East.Ths materal s dstrbuted by the Moroccan Amercan Center for Polcy on behalf of the Government of Morocco. Addtonal nformaton s avalable at the Department of Justce n Washngton, DC.Image Available: http://www.marketwire.com/library/MwGo/2016/10/31/11G120272/Images/Rwanda_Genocide_Wreath-2ed90e95381fb6a49fd99b85d76918f7.jpghttp://www.marketwire.com/library/MwGo/2016/10/31/11G120272/Images/Rwanda_Genocide_Wreath-2ed90e95381fb6a49fd99b85d76918f7.jpgJordana Merran202.470.2049\l"
"COP22","Canada","COP22_Canada56","Forestry offers opportunities for clean energy, expert says","November 25, 2016 Friday","Prince George Citizen (British Columbia)","The forestry sector can play a key role in creating a sustainable future that makes better use of leftover material, converting it to alternative fuel sources.Susan Wood-Bohm was the keynote speaker at UNBC's Doug Little Memorial Lecture Thursday night, named BioCleantech: New Opportunities for Canada's Forest Sector.""BioCleantech which is the concept of using biological carbon - so carbon that comes from agriculture or forestry, or municipal waste, organic stream - to help us offset the carbon that comes from fossil fuels in a way that helps us to reduce our net greenhouse gas emissions in the country,"" Wood-Bohm explained before her presentation.That's one piece of Canada's unique greenhouse gas profile, she said, that can focus on three key areas to meet its emissions targets.""Those things are based on the fact we have a very large landmass so to get goods, services and people from one end of the country to another generates a huge amount of transportation emissions,"" said Wood-Bohm, as well as distributed heating models and ways to address industry demand for process heat.""We're looking for ways to heat ourselves up and we have very large space heat demands and there's some approaches that we can use some of which Prince George actually leads the country in,"" she said, pointing to UNBC's distributed heating model that connects its buildings to the wood pellet plant.""That (heating system) works incredibly well, not only in a fairly small application which is what (is) appropriate here, but in other places around the world we have cities that heat 200,000 plus homes using distributed energy,"" Wood-Bohm said.As a resource-based economy, heavy industry creates large demand for process heat. That's the kind of heat needed to get the oil out of the oil sands, she said, or the heat needed to make cement or in steel manufacturing.""We can address all of those needs with different biomass technology,"" said Wood-Bohm, executive director of Emissions Reduction Alberta's Biological GHG Management Program, Sustainably sourced biogenic carbon from municipal wastes, agriculture and forestry could play a critical role, she said, while also supporting rural economies.And, linking big data, GIS, drones and other hightech tools to the drive for non-fossil carbons brings both fresh opportunities and potential risks for forest ecosystems, timber communities and traditional pulp and dimensional labour markets, the UNBC press release noted.For her Prince George audience, Wood-Bohm said she was ""pretty heavily focused"" on residue, like slash piles or mill waste.While she believes the forestry community is ahead of the game and makes efficient use of mill waste for electrical energy generation, some companies have said they're open to other approaches.Locally, she said Canfor has ""a really exciting opportunity"" through a recent agreement with Licella to manufacture a biocrude and potentially make higher value use of the residue steam.""That would be using waste residue to manufacture something which looks and feels and behaves just like crude oil and can be refined in a conventional refinery to a suite of products including high-value commodity chemicals and fuel,"" she said.The proposed low-carbon district energy system for Vancouver offers a good example of the discussions that are happening, she said, calling it a neat idea with potential benefits that also presents real challenges.""Financing is really difficult to get when the policy appears to change,"" she said. ""We're seeing the establishment of what should be long term policy signals and that then allows the company to have more financial flexibility to get the investments that they need to make change.""She said the talk is timely as countries met in Morocco in this month following up on the United NationsClimate Change Conference in Paris earlier this year.""We've got this backdrop now of a global community that accepts that climate change is real and we need to do something about it if we don't want to deal with catastrophic impacts,"" she said, adding she especially thinks a younger generation - like UNBC students at her lecture - need to be part of the discussion.""They come with fresh ideas and a creativity that we sorely need and so I'm always happy to talk about what our work has shown as examples and to get their perspectives on how to move forward."" \l"
"COP22","Canada","COP22_Canada57","No intention to act","November 19, 2016 Saturday","The Star Phoenix (Saskatoon, Saskatchewan)","Climate scientists say the Earth is in great danger of warming more than 2 C within two decades. There is increasing evidence of this warming, to the point that it could make living and farming conditions difficult even for the northern hemisphere and impossible for many coastal and low-lying areas.I greatly doubt that hundreds of scientists around the world are running a big climate change hoax, and think that human causes of global temperature increases need to be controlled.I would like to see a workable plan that won't destroy our lives economically while still making changes needed to halt climate change.We live in a market economy, and almost no one is selfsufficient in producing their own food, clothing and other necessities. Our economy is powered largely by using oil products. Most jobs today require oil products for whatever service they provide. The federal government recently announced its intention to impose a carbon tax on all Canadians, without saying how it will use the proceeds to combat climate change. Cap and trade proposals have also been discussed, but these only create a market for trading carbon credits and won't reduce warming.Is there any non-tax proposal to reduce warming? Is there a plan to actually reduce the carbon in the atmosphere? How can we transition to a non-fossil-fuel powered world and still ensure our economy doesn't die as a result?National governments have been discussing the problem for three decades and recently signed the COP22David BridgerSaskatoon !@COPYRIGHT=\£9 2016 Postmedia Network Inc. All rights reserved.\l"
"COP22","Canada","COP22_Canada58","Canada to ratify Paris climate deal","September 17, 2016 Saturday","Chatham Daily News","The Liberal government will ratify the international Paris climate accord this fall even before it reaches a deal with the provinces and territories on how to meet the country's 2030 emissions target.Senior government sources told The Canadian Press that Canada will deposit its ratification at the United Nations before Prime Minister Justin Trudeau meets the premiers for a promised first ministers meeting on a climate plan that has been under discussion for months.UN Secretary General Ban Ki-moon has been lobbying countries to ratify the Paris agreement before the Nov. 8 U.S. presidential election in hopes of locking in the accord's provisions for at least four years. The landmark pact, which calls for limiting global temperature increases this century to well below two degrees Celsius, comes into legal force only after 55 countries representing 55 per cent of global greenhouse gas emissions formally ratify.The timing of Trudeau's meeting with premiers is in flux, but it does not appear likely to take place before Canadian representatives are back at a UN climate conference in Marrakech, Morocco, Nov. 7-18, to discuss implementation of the Paris accord.The Marrakech meeting, known as COP22, is not considered a leader-level summit and Trudeau will not attend, the sources said.Canada has a consistent history under successive Liberal and Conservative governments of making international carbon-cutting promises that it fails to honour, first under the 1997 Kyoto accord and then again under the 2009 Copenhagen agreement.The Liberal government of Jean Chretien ratified the original Kyoto climate accord despite having no idea how to meet emissions-cutting pledges, a fact later acknowledged by Chretien's former chief of staff, Eddie Goldenberg. !@COPYRIGHT=\£9 2016 Osprey Media Group Inc. All rights reserved.\l"
"COP22","Canada","COP22_Canada59","Environment Minister Catherine McKenna confronted by pipeline protesters during speech downtown","November 1, 2016 Tuesday","Postmedia Breaking News","Environment Minister Catherine McKenna was forced to deal with four oil pipel"
"COP22","Canada","COP22_Canada60","Liberals call for debate on Paris deal","October 1, 2016 Saturday","Waterloo Region Record","The Liberal government will hold a debate and a vote in the House of Commons next week on whether Canada should ratify the international Paris climate accord.The debate by MPs is to begin Monday as federal Environment Minister Catherine McKenna sits down in Montreal with her provincial and territorial counterparts to begin negotiating a plan to meet Canada's Paris commitments.The outcome of next Wednesday's vote is a foregone conclusion - given the Liberal majority - but the outcome of the federal-provincial negotiations is not.""I think it's really important to have a debate, as does the prime minister,"" McKenna said Friday of next week's debate.""People want to see action on climate change, and I think it's a really important issue that Canadians see parliamentarians discuss the Paris agreement (and) the Vancouver Declaration. We know we need to move forward.""A report this week from the Pembina Institute found that Canada's emissions are currently two per cent below 2005 levels, but have been rising slowly for the last five years.McKenna has said Ottawa will impose a national floor price on carbon for provinces that do not adopt their own carbon tax and cap-and-trade market, a move that is opposed by Nova Scotia, Saskatchewan and territorial leaders.It was following Prime Minister Justin Trudeau's meeting with the premiers in March of this year that they issued the so-called ""Vancouver Declaration,"" a broad statement of support for establishing a ""pan-Canadian framework for clean growth and climate change.""""I've listened to all of the provinces and territories; I've had meetings, both individually and in groups, with all of the provinces and territories,"" McKenna said.""Everyone understands we need to move forward. Everyone understands, and through the Vancouver Declaration, this was part of it, putting a price on what we don't want - pollution - is something that's important.""According to Environment Canada's 2016 emissions report, Canada accounted for 1.6 per cent of global greenhouse gas emissions in 2012.Earlier this week, India announced it has ratified the Paris agreement and the European Union indicated it may do so within the next few days.That would mean countries accounting for nearly 65 per cent of the world's greenhouse gas emissions will have approved the accord, which is set to take effect 30 days after 55 countries accounting for 55 per cent of emissions deposit their ratification instruments with the UN. Currently, 61 countries accounting for nearly 48 per cent of emissions have joined the accord.Should the EU ratify before Oct. 7, the next UN conference on climate change in Marrakech would begin on Nov. 7 with the agreement already in force.\l"
"COP22","Canada","COP22_Canada61","New Mission Innovation challenges target ""solar fuels"", more clean technologies","November 15, 2016 Tuesday 12:28 PM EEST","SeeNews North America","November 15 (SeeNews) - Mission Innovation, a global initiative to speed up clean energy innovation, on Monday announced seven innovation challenges, including one to discover affordable ways to make ""storable solar fuels"".Mission Innovation was launched at the COP21 summit in Paris last year. As the Mission Innovation countries gathered at in Marrakech, Morocco on Monday, they welcomed two new members, Finland and the Netherlands, which increase the country count to 23, including the EU. The governments have pledged to double their clean energy research and development (R&D) funding over five years to around USD 30 billion (EUR 27.9bn) per year in 2021.The seven challenges focus on technologies that could play a significant role in combating climate change. The list is below:1. Smart Grids Innovation Challenge - to enable future grids powered by affordable, reliable, decentralised renewable electricity systems.2. Off-Grid Access to Electricity Innovation Challenge - to develop systems that enable off-grid households and communities to access affordable and reliable renewable electricity.3. Carbon Capture Innovation Challenge - to enable near-zero CO2 emissions from power plants and carbon intensive industries.4. Sustainable Biofuels Innovation Challenge - to develop ways to produce, at scale, widely affordable, advanced biofuels for transportation and industrial applications.5. Converting Sunlight Innovation Challenge - to discover affordable ways to convert sunlight into storable solar fuels.6. Clean Energy Materials Innovation Challenge - to accelerate the exploration, discovery, and use of new high-performance, low-cost clean energy materials.7. Affordable Heating and Cooling of Buildings Innovation Challenge - to make low-carbon heating and cooling affordable for everyone.""The Innovation Challenges give a clear focus for the collective efforts of public and private researchers, innovators and investors, which will help to accelerate innovation in these areas,"" commented Nick Hurd, UK Minister of State for Climate Change and Industry.The US Department of Energy (DoE) said the US will co-lead, with Mexico, the energy materials challenge. The US will also launch and lead a challenge focused on realising zero emissions for fossil fuels through the carbon capture innovation challenge.(USD 1.0 = EUR 0.928)\l"
"COP22","Canada","COP22_Canada62","Flights, camera, reaction! Critics slam taxpayers' $5,400 bill for Christy Clark's Paris pics","August 28, 2016 Sunday","Postmedia Breaking News","It was a pricey Paris photo-op for Premier Christy Clark at the United Nations - and B.C. taxpayers were the ones coughing up the euros.Clark attended the UN summit last November with a 17-member entourage, which included government photographer Kyle Surovy.Clark spent three days in Paris and taxpayers footed the bill for Surovy to follow her around and take pictures and videos.The total cost to taxpayers for the premier's Parisian photo shoot: $5,413.22, which included the photographer's airfare, hotel, meals and three days' salary. The amounts are contained in newly released budget documents.It's not a bill that will break the government's bank, of course.But this is a province where money is so tight, the government says it can't even afford to keep sick elderly couples together in provincial nursing homes. The heartbreaking separation of Surrey's Wolfram and Anita Gottschalk made headl"
"COP22","Canada","COP22_Canada63","Key dates this autumn for federal climate, energy decision-making; Key fall dates on climate, energy decisions","September 19, 2016 Monday 05:50 PM EST","Canadian Press","OTTAWA - The fall of 2016 is shaping up as a period of crucial decisions by the federal government on climate policy and energy infrastructure. Here are some key dates:Sept. 22 - The deadl"
"COP22","Canada","COP22_Canada64","Paris deal 'irreversible' French president urges; Trump to respect landmark deal on climate change","November 17, 2016 Thursday","Brantford Expositor","French President Francois Hollande on Tuesday urged the U.S. to respect the ""irreversible"" Paris Agreement on climate change, and said France will lead a dialogue on the topic with president-elect Donald Trump ""on behalf of the 100 countries, including Canada, that have ratified"" the deal.Speaking at a UN climate conference in Morocco, Hollande praised U.S. President Barack Obama for his role in getting the landmark pact adopted in the French capital last year.""The United States, the most powerful economy in the world, the second-largest emitter of greenhouse gases, must respect the commitments that were made,"" he said.""It's not simply their duty, it's in their interest.""Scientists say oil and other fossil fuels are the biggest contributors to man-made warming. Trump, however, has called global warming a ""hoax"" and pledged during his campaign to ""cancel"" the Paris deal.""The agreement was historic,"" Hollande said. ""But what we must say here is that this agreement is irreversible.""Earlier, UN Secretary-General Ban Ki-moon said he hopes Trump will shift his course on global warming and ""understand the seriousness and urgency"" of addressing the problem.""As president of the United States, I'm sure that he will understand this, he will listen and he will evaluate his campaign remarks,"" Ban told reporters in Marrakech.The Paris Agreement was signed by more than 190 countries and has been formally approved by more than 100 of them, including the U.S. and even oil-rich Saudi Arabia.Ban called international climate action ""unstoppable"" and said that no country, ""however resourceful or powerful,"" is immune from the impacts of global warming.""We have no right to gamble with the fate of future generations - or imperil the survival of other species that share our planet,"" Ban told the conference.Trump's election has created uncertainty about the U.S. role in the Paris deal, which calls on all countries to reduce or curb their greenhouse gas emissions and encourages rich countries to help poor ones deal with climate change.King Mohammed of Morocco urged delegates at the conference to translate their commitments into actions. !@COPYRIGHT=\£9 2016 Osprey Media Group Inc. All rights reserved.\l"
