"COP","country","ID","title","date","source","text"
"COP22","Canada","COP22_Canada84","'Very deep emissions cuts from every sector' needed, climate strategy says","November 19, 2016 Saturday","Prince George Citizen (British Columbia)","The federal government has released its long-term climate strategy with a caution that most Canadians - while sympathetic to the cause - don't yet understand the ""magnitude of the challenge.""The document suggests the country should find a way to cut emissions 80 per cent below 2005 levels by 2050 in order to match the ambition of the international Paris climate accord.That means ratcheting down Canada's entire output of greenhouse gases to 150 million tonnes a year. The most recent Environment Canada inventory assessed the country's carbon dioxide equivalent emissions at 732 million tonnes in 2014 - and slowly rising.""Most Canadians recognize the need to mitigate climate change and limit the increase in the global average temperature, but the magnitude of the challenge is less well understood, with a requirement for very deep emissions cuts from every sector by mid-century,"" says the 87-page plan, released Friday at an international climate conference in Morocco. Environment Minister Catherine McKenna was among those last year in Paris helping push for a target of limiting global warming to less than two degrees Celsius above pre-industrial levels and closer to 1.5 degrees.""Canada's Mid-Century Long-Term Low-Greenhouse Gas Development Strategy"" says global emissions reductions of between 70 and 95 per cent are required in order to have a better than 50-50 chance of hitting the 1.5-degree temperature target.It lays out a number of strategies, including a major move to electrification for everything from transportation to building heating and industrial power.Forestry, agriculture, municipal waste, technological innovation and energy efficiency - 38 per cent of all emissions cuts needed to reach two degrees Celsius can be achieved through energy efficiencies, notes the paper - all get their own chapters, but Canada's oil and gas sector does not.Nor does the strategy paper mention the current political debate over approval of new, long-term fossil fuel infrastructure, including pipel"
"COP22","Canada","COP22_Canada85","Trump casts pall over PM's Latin American trip","November 17, 2016 Thursday","The Toronto Star","One can run but not hide from the aftershocks of Donald Trump's presidential victory.Prime Minister Justin Trudeau is finding that out first-hand this week as his first trip outside Canada since the American election turns into a damage assessment mission.It is a testimony to the magnitude of the shift in the tectonic plates brought about by the U.S. outcome that there is not an international forum and precious few of the world's capitals that are not scrambling to pick up the post-election pieces.The questions raised by the imminent changing of the guard at the White House go well beyond the narrow scope of whether progressive governments such as Trudeau's can find productive common ground with a conservative president.Cuba was the first stop on the PM's itinerary this week. Until the U.S. vote, the prime minister might have expected to find some lingering buzz from President Barack Obama's historic visit to the island this spring. It was part of a thaw in the relationship between Cuba and the U.S.But in Havana, excitement has given way to trepidation. Uncertainty as to whether Trump will follow up on his predecessor's overtures has replaced momentum. On the campaign trail, the president-elect blasted Obama's visit to Cuba.Later this week Trudeau will land in Peru for the annual Asia-Pacific Economic Cooperation (APEC) summit.The organization's 12 member countries recently negotiated the Trans-Pacific Partnership.But the American election has sapped the impetus for the ratification of the massive free trade agreement. Last week, Obama formally abandoned plans to submit the deal to Congress for ratification before the end of his term in January. Trump wants no part of the TPP.The president-elect's shadow loomed large over this week's international climate change summit (COP22The accord's signatories - including Canada - argue that the changing of the guard in the White House will not diminish the political will to act in concert on climate change. Time will tell whether they are whistling past the graveyard of the Paris accord.A pivotal part of the infrastructure of the accord was an alliance between China and the U.S. They jointly agreed to a reduction in their carbon emissions. But Trump is not expected to hold to the American side of the bargain.On the heels of the U.S. election, Trudeau reaffirmed Canada's intention to lead a military deployment in Latvia as part of NATO's latest strategy to deter Russia. In Moscow, Trump's victory has been interpreted as an encouraging sign that could lead to NATO being forced to reconsider the deployment.A bit more than a week after Trump's victory, it has already become conventional wisdom that his installation in the White House will at least complicate, if not derail, Trudeau's Liberal agenda. There is truth in that.Under Stephen Harper, Canada took credit for playing host to the secret meetings that led to the U.S.-Cuba rapprochement.The Conservatives set the climate change targets that Trudeau is seeking to achieve as part of the obligations Canada contracted under the Paris agreement.One of the distinguishing features of Harper's foreign policy doctrine was his strong stance against Russian President Vladimir Putin's military goals. Trudeau's Latvia deployment fits into that doctrine, as does the ratification by the Liberals of the Canada-Ukraine free trade agreement initially negotiated under the Conservatives.And then, what would Harper - as a staunch champion of Israel - have made of the anti-Semitic undertones of some of the rhetoric of Trump's campaign?On Wednesday, interim Conservative leader Rona Ambrose offered her caucus a few positive thoughts about Trump's victory. But when all is said and done, the president-elect poses a greater threat to Harper's trade and foreign policy legacy than Trudeau ever did.Chantal H#233;bert is a national affairs writer. Her column appears Tuesday, Thursday and Saturday.\l"
"COP22","Canada","COP22_Canada86","AutoGrid Named Energy Productivity Innovation Challenge (EPIC) Winner","November 15, 2016 Tuesday","Marketwire (Canada)","MARRAKECH, MOROCCO and REDWOOD CITY, CA -- (Marketwired) -- 11/15/16 -- AutoGrid Systems, the Energy Internet leader, today announced that is has been was named a winner in the systems category of the Energy Productivity Innovation Challenge (EPIC). A global initiative devised and delivered by Energy Unlocked (a hub for innovation in global energy systems) and ClimateWorks, the winners were recognized at a ceremony hosted by the World Business Council for Sustainable Development on November 15 at the Low Emissions Solutions Conference, taking place during the COP22 UN climate summit in Marrakech, Morocco.Energy Unlocked's EPIC 2016 competition aims to discover and promote new market entrants who can help homes, industry and big business use less energy, at lower cost and with a lower carbon footprint. Advances in predictive analytics, real-time optimization, edge computing, fintech and battery storage are creating new demand-side flexibility and compelling opportunities to modernize the way the world produces, buys and consumes energy.Winners in the five EPIC categories -- homes, buildings, mobility, systems and finance -- were selected by an international jury assessing their impact on productivity, global transferability and innovation. Partners of the EPIC initiative include the Climate Group's EP100 initiative, the Global Alliance for Energy Productivity and the Alliance to Save Energy.Usng Flexblty Management to Increase Energy ProductvtyAutoGrid was recognized for its suite of flexibility management applications, AutoGrid Flex , which enable utilities and energy service providers to use the Energy Internet to predict, optimize and control any networked distributed energy resource (DER) -- including Combined Heat and Power (CHP) units, demand response (DR) programs, distributed solar, industrial lighting systems, battery storage systems and smart thermostats -- in real time and at scale. By enabling them to maximize the energy productivity of these DERs, utilities and energy service providers can better balance supply and demand on an increasingly complex, multi-directional and renewable energy powered grid.For example, with AutoGrid Flex, utilities and energy service providers can use DERs to account for the intermittency of renewable generation, allowing them to cost-effectively add more renewables into their energy system without impacting grid stability. In addition, AutoGrid Flex's advanced analytics and machine learning technologies deliver reliable, accurate, dispatch-grade demand response, making these programs more efficient while improving system reliability.""The distributed energy world will require us to not just generate more power from renewable resources, but also use the Energy Internet to maximize the productivity of every energy asset we have if we want energy to be clean, cheap and reliable,"" said Dr. Amit Narayan, CEO of AutoGrid. ""This recognition further validates our conviction that flexibility management is essential if utilities and energy service providers are to be successful in building renewable-friendly, flexible energy networks that maximize the productivity of any type of DER.""About EPICEPIC -- the Energy Productivity Innovation Challenge -- is a global initiative devised and delivered by Energy Unlocked with funding from ClimateWorks. Entries were invited from global technology companies and innovators between June and September 2016. A jury of clean energy pioneers and experts including -- ClimateWorks Foundation, Rocky Mountain Institute, International Energy Agency, World Green Buildings Council, Bloomberg New Energy Finance and the B Team -- announced 21 regional finalists on October 13, 2016 at the IEA's Innovation in Energy Efficiency event.Partners of the EPIC initiative include the Climate Group's EP100 initiative, the Global Alliance for Energy Productivity, and the Alliance to Save Energy. Global media partners include: GreenBusiness Media and Bloomberg New Energy Finance. Please visit EPIC.energyunlocked.org for more information.About AutoGrd SystemsAutoGrid builds software applications that enable a smarter Energy Internet. The company's suite of Energy Internet applications allows utilities, electricity retailers, renewable energy project developers and energy service providers to deliver cheap, clean and reliable energy by managing networked distributed energy resources (DERs) in real time and at scale. AutoGrid applications are all built on the AutoGrid Energy Internet Platform (EIP), with patented Predictive Controls technology that leverages petabytes of smart meter, sensor and third-party data, along with powerful data science and high-performance computing algorithms, to monitor, predict, optimize and control the operations of millions of assets connected across global energy networks.The world's leading energy companies, including E.ON, Bonneville Power Administration, Florida Power & Light, Southern California Edison, Eneco, Portland General Electric, CPS Energy, New Hampshire Electric Cooperative, NextEra Energy and CLEAResult, are using AutoGrid's software to improve their operations, integrate renewables and drive deeper engagement with their customers. AutoGrid has been recognized with several prestigious industry awards including Greentech Media's Grid Edge Award 2016, Bloomberg New Energy Pioneer 2016, World Economic Forum Technology Pioneer 2015, Red Herring Top 100 North America 2015, Cleantech Global 100 for 2015 and 2014, and Industrial Innovation Company of the Year 2014 by the Cleantech Group.\l"
"COP22","Canada","COP22_Canada87","Five Ways Morocco is a Climate Change Champion","November 7, 2016 Monday","Marketwire (Canada)","WASHINGTON, DC--(Marketwired - November 07, 2016) - Today, the 22nd Conference of the Parties to the UN Framework Convention on Climate Change (COP 22) opened in Marrakesh, Morocco -- a ""perfect place for the world's biggest climate change conference,"" according to Quartz.Indeed Morocco's decades-long commitment to clean and sustainable energy is widely recognized, most recently by the 2016 Climate Change Performance Index, which ranked Morocco alongside Denmark, Sweden, and Belgium in the top ten most climatically conscious countries and number one in the developing world, based on criteria including CO2 emissions, renewable energy development, efficiency, and climate policy.To mark the start of this historic conference, which Morocco has dubbed ""the COP of action"" and which King Mohammed VI has vowed to make ""a conference for Africa,"" here are the five ways Morocco is a climate change champion:""Morocco has made clear -- not just in words but in deeds -- for decades that it takes the issue of sustainable energy seriously,"" said former US Ambassador Edward Gabriel. ""As the COP 21 signatories look to implement the policies put into place last year in Paris, the have much to learn from this year's host country.""For more on Morocco's envronmental ntatves, take a look at our fact sheet.The Moroccan Amercan Center for Polcy (MACP) is a non-profit organization whose principal mission is to inform opinion makers, government officials, and interested publics in the United States about political and social developments in Morocco and the role being played by the Kingdom of Morocco in broader strategic developments in North Africa, the Mediterranean, and the Middle East.Ths materal s dstrbuted by the Moroccan Amercan Center for Polcy on behalf of the Government of Morocco. Addtonal nformaton s avalable at the Department of Justce n Washngton, DC.Jordana Merran 202.470.2049\l"
"COP22","Canada","COP22_Canada88","Canada Is \u732 Moving Forward As Is The World On Combating Climate Change: McKenna","November 18, 2016 Friday","Daily Oil Bulletin","Regardless if U.S. President-elect Donald Trump pulls back on his countrys federal commitments to combating climate change, Canada is moving forward as is the world on taking measures that strive to limit global warming to 1.5 C above pre-industrial levels, says Environment Minister Catherine McKenna . I was at the Major Economies Forum with China, the EU, South Africa, UK, Japan and France, and everyone is absolutely committed to climate action, she told a media conference call on Thursday from the 22nd United Nations Conference of the Parties (COP 22) in Marrakech, Morocco. McKenna added: Canadians know that climate change is among the greatest challenges of our time, and they also recognize the opportunity it brings. According to the environment minister, companies such as Suncor Energy Inc., TransCanada Corporation, Enbridge Inc., ATCO and TransAlta Corporation have representation at COP 22, as they understand the benefits of Canadian leadership within a global conversation on reducing emissions, protecting the environment, and enhancing Canadas competitiveness and access to global markets in a low-carbon economy. We are in a transition period. We all know that and the world knows that. We have committed to action. We have put a price on carbon pollution and every province by 2018 must have a price on pollution. We will be announcing additional measures in the lead up and at the [next] first ministers meeting, and we know we need to do more. However, she added, the transition to a low-carbon economy will not occur immediately. Therefore, the federal government must take thoughtful action to ensure it is working with business, environmentalists, indigenous leaders, and all Canadians. We are going to come back [to COP]  as every country is going to come back  in five years, because we know we need to improve. But the market is clearly moving in a direction of a low-carbon future. Earlier this week, the federal government announced that it will contribute $14 million to reduce short-lived climate pollutants such as methane through partnerships with Mexico and Chile, assisting these countries to adopt clean technologies and employ Canadian expertise to reduce methane emissions ( HYPERLINK http://www.dailyoilbulletin.com/article/2016/11/15/albertas-climate-plan-controls-competing-business-/DOB, Nov. 15, 2016 ). As part of Canadas commitment of $2.65 billion over the next five years to help countries and communities worldwide pollute less, be better equipped to resist the effects of climate change, and make positive contributions to a global clean economy, funding to Mexicos oil and gas sector will reduce gas flaring from  plant operations, which is responsible for harmful emissions causing climate change and air pollution. In Chile, the funding aims to capture methane as it escapes from decomposing landfill sites, as well as diverting organic matter from the waste through composting. We are working extremely closely with all the countries in the world, because we know that we all need to do our part, McKenna said on Thursday. I have had a number of very good bilateral meetings with small island states and countries that need our support, and I am proud that Canada is stepping up, and we are stepping up at home. She added: When it comes to particular projects, we have an environmental assessment process, we announced transitional measures that will rebuild confidence in our environmental assessment process. With all projects, we take into account the emissions, and we make decisions based on science, evidence and facts, and when it comes to all projects, they also need to fit in with our climate plan  they need to take into account those emissions. On Wednesday, McKenna, along with Marie-Claude Bibeau, minister of international development and La Francophonie, also announced that Canada will invest nearly $1.8 billion to mobilize private-sector support for developing countries efforts to transition to cleaner, more sustainable economies.Leveraging private-sector investments in areas such as clean technology, climate-smart agriculture, sustainable forestry, and climate-resilient infrastructure, Canada will deliver support via a range of trusted partners  multilateral development banks with demonstrated expertise in innovative finance solutions to address climate change.Canadas bilateral support will focus, in particular, on female empowerment, and it will align with a commitment to support the UNs sustainable development goals.In supporting a wide range of partners and programs, Canada is ensuring that the worlds poorest and most vulnerable have access to the right tools and opportunities to make a difference, Bibeau stated in a news release. With this investment, Canada is not only helping developing countries transition to low-carbon, climate-resilient economies, but we are also advocating for the empowerment of women and girls.Marrakech is hosting the first COP meeting since delegates reached last years Paris Agreement, which strives to limit global warming to 1.5 C above pre-industrial levels and calls for a transparent system to account for climate action while strengthening countries abilities to deal with climate impacts, recover from climate impacts, as well as support nations in building clean, resilient economies ( HYPERLINK http://www.dailyoilbulletin.com/article/2015/12/14/environmentalists-support-paris-agreement-call-can/#axzz45Wlyst75DOB, Dec. 14, 2015). \l"
"COP22","Canada","COP22_Canada89","One year in office, 3,000 spending announcements","November 21, 2016 Monday","National Post (f/k/a The Financial Post) (Canada)","$54M IN AID FOR HAITI DISASTER RECOVERY$158,173 IN PART, TO UPGRADE P.E.I. BOWLING ALLEYThe Trudeau government has just marked its 3,000th spending announcement and, in doing so, has shown itself to be much more adroit in getting its MPs to hand out cheques than its predecessor.The majority Harper government of the 41st Parliament didn't make its 3,000th announcement until nearly two years into its mandate, on March 11, 2013. During the four-year 41st Parliament, Conservative MPs made 7,307 spending announcements, a total that Liberal MPs, at their current pace, should easily eclipse early in the third year of their mandate.That said, the Harper Conservatives moved more money out the door even though they made fewer announcements. By end of day on Friday - 396 days since last fall's election - Liberal MPs had made 3,030 announcements funding projects worth a combined $18.9 billion.It took the Harper Conservatives just 72 days after the May 2, 2011, election for that government to eclipse $18.9 billion in spending announcements.The spending announcement figures are culled from a database maintained exclusively by the National Post that draws from the thousands of press releases issued by the government over the last eight years in which government MPs and ministers take credit for the allocation of a grant, contribution, or loan from the federal treasury. And it is always government MPs who get their names on the press releases when a cheque is handed out. Opposition MPs are never mentioned even when the project to be funded is in an opposition MP's riding.The 3,000th announcement to be registered in the database from the current government occurred Thursday when Environment Minister Catherine McKenna, at the COP22 climate-change conference in Marrakech, Morocco, announced a contribution of $3 million to the World Bank Transformative Carbon Asset Facility.Other recent spending announcements include $54 million in aid for Haiti, announced Friday by International Development Minister Marie-Claude Bibeau during a visit to Port-au-Prince; a new container terminal at the Port of Montreal built with a $44-million contribution from the federal government, opened Friday by Transport Minister Marc Garneau; and $1.5 million to expand a national diabetes prevention program, announced by Health Minister Jane Philpott last Monday.But the Trudeau government, like the Harper government before it, has plenty of money for smaller projects, the kind that helps a local MP get noticed back home. For example: ..In tiny Tyne Valley, P.E.I. (pop. 266), the Liberal MP Bobby Morrissey provided a grant of $158,173 that will help, among other things, upgrade a bowling hall, beloved by the community as ""a popular local venue for a variety of community events and ... home to several bowling leagues,"" according to a press release...Liberal MP Nick Whalen had a few cheques to hand out Friday in the Newfoundland and Labrador community of Torbay, near St. John's, including one for $150,250 for the local Kinsmen's club to build a splash pad for kids. ..Liberal MP Rene Arsenault, who knocked off Conservative incumbent and cabinet minister Bernard Valcourt last fall in the northwestern New Brunswick riding of Madawaska- Restigouche, brought home cheques for 25 maple syrup producers in his riding. The producers split more than $7 million in federal loans announced by Arsenault on Nov. 7. The money for Torbay's splash pad and Tyne Valley's bowling hall were drawn from a $300-million Parliament-approved pool of money to fund all sorts of projects to mark Canada's 150th anniversary in 2017.The fund was established by the Harper Conservatives in its 2015 budget and was, at the time, denounced by Liberal MPs Adam Vaughan and Judy Sgro as nothing more than a ""slush fund"" for Conservative MPs to dip into to improve re-election chances.But once in office, the Liberals kept the Canada 150 fund going and have been busy dipping into it.In their first year in office, the Trudeau Liberals have made 207 announcements that draw money from the Canada 150 fund and the vast majority has gone to fund projects in ridings held by Liberal MPs.The National Post database has logged 155 Canada 150 spending announcements worth a combined $27.9 million for projects in Liberal ridings. Just 15 announcements worth a combined $876,000 have been announced for projects in ridings held by Conservatives and 21 Canada 150 announcements worth $1,078,780 have been announced for NDP ridings.Louis Plamondon is the only BQ MP to have seen any Canada 150 cash come his way. The feds will spend $47,087 for some new playground equipment in Grand-Saint-Esprit in his riding of B\'e9cancour-Nicolet-Saurel.Just a handful of Canada 150 projects are for initiatives where the spending will occur over several ridings held by MPs of different political persuasions. !@COPYRIGHT=\£9 2016 Postmedia Network Inc. All rights reserved.\l"
