"COP","country","ID","title","date","source","text"
"COP24","Ireland","COP24_Ireland1","Many issues still undecided on last day of COP24","December 14, 2018 Friday 8:18 PM GMT","RTE News","After two weeks of haggling negotiators at the COP24 climate talks in Katowice in Poland entered their last scheduled day with many issues still undecided. At issue is the precise rule book for how the Paris Climate Change Agreement agreed three years ago will be implemented, including how a country's emissions and commitments are to be measured and interpreted. There are also big arguments to be resolved about where the $100bn per year of climate finance promised by richer developed countries is to come from. With the United States pulling out of the Paris accord that issue of climate finance is now proving very difficult to resolve. The third main issue at stake is how to ensure that nations ratchet up their commitment to take action to reduce their greenhouse gas emissions. This was made particularly urgent by the publication of the IPCC report on the impact of 1.5 degrees of warming two months ago. This showed that hundreds of millions of people and countless species face climate devastation if global warming is not contained to 1.5 degrees and also that greenhouse gas emissions need to be reduced three times faster than previously expected. There is a growing expectation that the negotiations in Poland, which are due to finish later today, could yet spill over into the weekend. Sources close to the COP24 talks said that delegates from nearly 200 nations were still far apart on several issues, from adopting the latest environmental science to how future climate action is funded. The Conference of the Parties (COP) is the supreme body of the United Nations Framework Convention on Climate Change (UNFCCC). \"
"COP24","Ireland","COP24_Ireland2","ESB subsidiary coal contract in the Phillippines criticised","December 13, 2018 Thursday","The Irish Times","The Government should cancel a 10 -year contract won by ESB International to run a new coal-fired electricity power station in the Philippines, environmental campaigners have demanded. The ESB subsidiary signed a contract last December with the Philippines' largest electricity supplier, Manila Electric Company, to run the Atimonan power, once it is built in Quezon province. However, environmental campaigners, speaking on the margins of a major United Nations climate change conference in Katowice in Poland, are now lobbying Dublin to back away from the deal. The Government should cancel the contract since Ireland is a member of the international ""Power Past Coal"" alliance, which pledges to stop burning coal for electricity. The Atimonan project is being fought by a range of civil-society organisations in the Philippines, which remains committed to coal-burning even it is suffering the detrimental effects of climate change. ""We cannot allow our communities to suffer from the double whammy of coal-fired power plant projects that come in the form of negative health and environmental impacts,"" said Ian Rivera of the Philippine Movement for Climate Justice, who is attending the UN climate conference in Katowice, Poland. Clean power generation In a letter this week to Minister for Climate Action and Environment Richard Bruton, he urged the Government to honour its commitment to phase out unabated coal power generation and to support clean power generation through its policies. Part of Ireland's commitment to climate action and decarbonisation is the planned shutdown of the Moneypoint coal-burning plant by 2025, said Ian Lumley of An Taisce. ""However, ESB International, a State-owned company subsidiary under the Minister's direct control, is providing the engineering and project-management services for a new 1,200 megawatt coal-fired power plant in the Philippines,"" he said. ""The damage caused by this proposed project is undermining international solidarity on climate action and decarbonisation of energy eclipses the increased climate funding announced [at the UN summit] by the Minister"", said Mr Lumley, who also attending the COP24 conference. Mr Bruton said he was not aware of the project, its context and the extent of involvement by ESB International. The decision to build the Atimonan power plant and its fuel mix in the Philippines would be made by the Philippine authorities, an ESB spokeswoman said. ""ESB International does not have any influence or input in those decisions."" ESB International agreed the contract in 2017 to operate and manage the power plant on behalf of Meralco PowerGen Corporation, she confirmed. \"
"COP24","Ireland","COP24_Ireland3","Difficult end to first week of COP24 negotiations","December 10, 2018 Monday","The Irish Times","Four big oil and gas producer states have attempted to block the UN climate talks in Poland from welcoming the most stark climate science report in years, marking a difficult end to the first week of negotiations. The COP24 The response met with a backlash from a broad range of other rich countries, as well as poor and developing ones. The standoff was over whether to ""note"" or ""welcome"" the findings of the Intergovernmental Panel on Climate Change (IPCC) report published in October. Saudi Arabia, the US, Kuwait and Russia wanted the final statement to merely ""note"" the report on the effects of a 1.5-degree rise in the global temperatures, which warned of climate chaos in less than 20 years unless more meaningful decarbonisation was pursued. An alliance of small island states pushed to ""welcome"" the findings. The standoff arose during a long plenary session on Saturday, at the end of which negotiators were still aiming to have simplified a draft for high-level ministerial debate starting today. ""We still have a lot to do,"" Michal Kurtyka, Polish president of the COP24 , told a news conference. ""It is very technical, very complex, very difficult."" Delegates continued to flag another major outstanding issue: how to reassure developing countries that richer nations would deliver on promises to help finance the cost of shifting to a lower-carbon economy. Environmental campaigners and NGOs are concerned the talks outcome will lack ambition in the wake of the planned withdrawal by the US from the Paris agreement, as an increasing number of countries who have fossil fuels at the heart of their economies are failing to scale up ambition as required under the pact. ""It's a question of 'who wins' - the likes of the EU and China, with economies deeply invested in climate action and dependent on multilateralism for global trade, or the likes of Saudi dissenters on climate science, with vested interests that put us all in the firing line?"" said Camilla Born, senior policy advisor with E3G, a non-governmental organisation. The plenary chair's attempt to find a compromise fell flat, setting the scene for a larger political row when ministers arrive in Katowice. Earlier, Africa stood firm as UN officials tried to finalise a draft of the rules that will govern the agreement. ""You can't bully Africa, it's 54 countries,"" one negotiator said. These obvious issues will mean new proposals could come this week for consideration. On the streets of Katowice, the capital of Poland's Silesian coal-mining region, hundreds of demonstrators marched to demand a global deal to limit temperature rises to no more than 1.5 degrees. School striker Swedish teenage climate activist Greta Thunberg, who sat outside her country's parliament when on ""strike"" from school in September in an attempt to get politicians to act, and self-described ""recovering climate negotiator"" Yeb Sa\'f1o - now director of Greenpeace Southeast Asia - addressed the gathering in Plac Wolnosci. The demonstration stayed upbeat in the face of a large presence of police with riot shields and a water cannon. Many delegates in Katowice have stressed the French yellow vests protests were unrelated to the UN climate debate, but US president Donald Trump seized on the protests to call for an end to ""the ridiculous and extremely expensive Paris Agreement"". Tensions are expected to be further heightened tonight, when the small US delegation is due to stage a side event promoting fossil fuels as part of the solution to global warming. The title of the briefing is ""US innovative technologies spur economic dynamism"". The US State Department said it was meant to showcase ways to use fossil fuels as cleanly and efficiently as possible, as well as the use of emission-free nuclear energy. Last year the delegation gave a pro-coal presentation. ""It is beyond absurd for the administration to sponsor an international event purporting to discuss ways to use fossil fuels as cleanly as possible"" while attempting to cut Obama-era rules to make fossil-fuel use less polluting, World Resources Institute director Dan Lashof told the Washington Post . Meanwhile, leading climate campaign group 350.org has outlined its ""deep concern"" that increasing numbers of colleagues, volunteers and climate activists attempting to attend the talks are being denied entry and/or deported. ""There are currently at least 15 members of civil society groups that were due to attend, who are being held at the borders or who have been removed. They are from Ukraine, Germany, Belgium and Kyrgyzstan,"" said spokeswoman Svitlana Romanko.- Additional reporting: Reuters \"
"COP24","Ireland","COP24_Ireland4","A stark, eloquent challenge to all; David Attenborough at COP24","December 8, 2018 Saturday","The Irish Times","'Right now, we are facing a man-made disaster of global scale. Our greatest threat in thousands of years. Climate change. If we don't take action the collapse of our civilisations and the extinction of much of the natural world is on the horizon Leaders of the world, you must lead. The continuation of our civilisations and the natural world upon which we depend, is in your hands."" David Attenborough's speech to the COP24 climate change conference in the Polish city of Katowice this week starkly and eloquently dramatises the challenge facing humanity from climate change. It falls to this generation and its leaders to take the necessary action to mitigate and reverse the damage already done. We must also find new ways to care for the natural world and humanity's place in it. Unless this message gets through to ordinary people and leaders alike we face breakdown in our ways of living, according to the best scientific research and advice available to this United Nations gathering and the global process it represents. For progress to be made these threats must be communicated accurately and repeatedly to bring them into popular consciousness and prepare for the radical action required. Attenborough spoke on behalf of the public in Katowice as part of an agreed programme to include civil society in the UN process. He publicised the new online ActNow.Bot urging individual action to reduce our carbon footprint, such as taking public transport and eating less meat. Many people feel overwhelmed and immobilised by the scale of the challenge. That is why it is so important that individual action to tackle it be linked to collective action and political leadership. It needs a message of hope and enablement that it can be overcome. We have the technology and knowledge to make that transition but lack the political will and public support to take the action needed. If that will and support are to be found individuals and peoples must be assured the transition to a carbon-free world will be just and fair. Those most vulnerable are among the poorest and most marginal communities and states in the world who are least responsible for producing greenhouse gases. Responsibility rests overwhelmingly with the richest and most privileged minorities in the world - within and between all the states party to the UN climate change process. The rejection of fuel-price increases by the gilets jaunes movement in France dramatises fairness in tackling this question and has implications throughout the world. Attenborough should be thanked for putting the existential challenge facing humanity so simply and well. We need many more such warnings if we are to find the will and resources to prevent our civilisations collapsing and our natural world being destroyed by the breakdown of our climate. \"
"COP24","Ireland","COP24_Ireland5","Climate change threatens collapse of civilisation, UN conference told; Attenborough calls on world leaders at COP24 in Katowice to 'act now'","December 4, 2018 Tuesday","The Irish Times","The collapse of civilisation and extinction of much of the natural world is ""on the horizon"" due to climate change, Sir David Attenborough declared at the opening day of UN climate talks in Poland. The naturalist and TV presenter called on global leaders and decision-makers, who have gathered in Katowice for the COP24 conference, to take charge on driving down greenhouse gas emissions as climate change was the greatest threat facing the world ""in thousands of years"". ""The world's people have spoken, their message is clear, time is running out, they want you, the decision-makers, to act now. They're supporting you in making tough decisions but they're also willing to make sacrifices in their daily lives,"" he added. 'You must lead' Sir David was speaking on behalf of the UN's ""People's Seat"" initiative to give ordinary people a voice at the international talks by gathering their thoughts, ideas and concerns through social media. He endorsed the ""ActNow.bot"" which helps people discover simple everyday actions they can take to tackle climate change. ""The people have spoken: leaders of the world, you must lead, the continuation of our civilisations and the natural world upon which we depend are in your hands,"" he added. UN secretary general Antonio Guterres warned negotiators at the meeting that the world was in deep trouble. ""Climate change is running faster than we are and we must catch up sooner rather than later, before it's too late. For many people, regions and even countries, this is already a matter of life and death,"" he said. Climate action was not just the right thing to do, it made social and economic sense, Mr Guterres said, pointing to how action to cut emissions would curb air pollution deaths, generate millions of jobs and trillions of dollars. Mr Guterres said he had four simple messages: Minister for Climate Action and Environment Richard Bruton, who attended the opening session, said: ""The decisions we take now will define the next century. I recently received Government approval to develop an all-of-government plan to make Ireland a leader in responding to climate change."" Ireland was fully committed to the implementation of the Paris Agreement, he added. ""Over the next two weeks, we will work with countries all over the world to put together a rule book to make sure we all fulfil our commitments. We also look forward to . . . getting an honest evaluation of our climate efforts to date. We need to be honest with where we are at so that we get to where we need to be,"" Mr Bruton said. Financing The World Bank announced it is doubling investments in climate action with $200 billion for 2021-2025, including $50 billion towards helping countries adapt to the impacts of global warming. World Bank president Jim Yong Kim said the poorest and most vulnerable people were at the greatest risk, and urged other financial institutions to follow its lead. Following Brazil's recent withdrawal as host for COP25, a spokeswoman for Mr Bruton said it would be relocated to a country in South America, as was required under UN rules. As to the possibility of Ireland hosting a COP, she said it was due to be staged in western Europe in 2020 but a conversation had yet to be had on where it would be staged. - Additional reporting Guardian \"
"COP24","Ireland","COP24_Ireland6","COP24 rulebook agreed in Katowice How will countries implement Paris?","December 17, 2018 Monday","The Irish Times","The Katowice summit has yielded a common rulebook that will apply across the world on implementing the historic Paris Agreement on climate change, including greater transparency on efforts to reduce carbon emissions contributing to global warming. Parties agreed to revise and enhance their commitments in the form of Nationally Determined Contributions (NDCs) before 2020, according to the 156-page rulebook. They must outline mitigation and adaptation measures as well as details of financial support for climate action in developing countries. Parties agreed how to undertake a 'global stocktake' of the effectiveness of climate action in 2023, and how to assess progress. Discussions on robust measures to ensure that countries are held to proper standards and find it harder to wriggle out of commitments dominated the final stages. As current pledges are not enough to limit warming to 1.5 degrees and to achieve the pact's goals, countries must commit to greater levels of climate action and support and follow through on those commitments. The final text omits a previous reference to specific reductions in emissions by 2030, and merely welcomes the 'timely completion' of the IPCC report; not its conclusions. nCLIMATE FINANCE A delicate balance was struck between concerns of the smallest, poorest and most vulnerable countries; the developed nations most responsible for global warming and the emerging economies wary of being saddled with a bigger burden. A process for establishing new targets on finance from 2025 onwards to follow-on from the current target of mobilising $100 billion per year from 2020 to support developing countries was agreed. The text urges developed-country parties to channel more grant-based resources for adaptation to climate change as against loans. There is some acknowledgment of the long-standing ""loss and damage"" issue; notably how to provide financial support to countries whose economies are too vulnerable to cope with the impact of climate change. Critical to this is how to finance and compensate losses and damages that have already occurred and are irreversible. \"
"COP24","Ireland","COP24_Ireland7","Norway allots  15m to combat illegal deforestation","June 27, 2018 Wednesday 02:23 PM GMT","BreakingNews.ie","Norway has pledged 145 million kroner ( 15.2m) towards an international partnership to combat illegal deforestation and help reach Paris climate accord goals. Climate and environment minister Ola Elvestuen said deforestation is a lucrative business for criminals who cut down invaluable tropical forests, adding ""their activities have detrimental consequences for sustainable development in rainforest nations and the global climate"". He said: ""Halting and reversing land degradation and tropical deforestation could provide up to 30% of the climate change solution."" Mr Elvestuen told the Oslo Tropical Forest Forum that the partnership includes Interpol, the United Nations Office on Drugs and Crime and a UN-supported centre combating illegal deforestation. The three institutions will work together to share expertise, networks and efforts to jointly support countries in Latin America and south-east Asia. The Oslo forum focuses on the role forests play in achieving the Paris accord goals to keep global temperatures below 1.5C. Interpol secretary-general Jurgen Stock said: ""Environmental crime has surged in recent years, generating billions in illicit profits for criminals, who are also involved in corruption, money laundering and other forms of trafficking. ""Protecting the environment's precious resources is our collective responsibility toward future generations."" [quote]The conference said organised criminals make up to 152 billion dollars ( 129bn) a year on illegally cutting down tropical forests. [/quote] Key rainforest countries have estimated illegal logging rates at 50% to 85%. The event comes ahead of the Global Climate Action Summit in September in San Francisco and the United Nations Climate Change conference in December in Poland. <strong> - Digital Desk</strong> \"
