"COP","country","ID","title","date","source","text"
"COP25","Ireland","COP25_Ireland16","IRELAND THE 'CLIMATE LAGGARD'; World leaders gather in Madrid next week for COP25, the annual bargaining on climate action. Ireland has a lot to do to improve i....","November 30, 2019 Saturday","The Irish Times","This was a year when faith in humanity was restored by the ability of protesters across the globe to raise a collective voice amid political chaos, and to demand global action on the climate crisis. Sometimes engaged citizens can shout loudest, as happened in September when millions of activists stood up to climate deniers and made the case for moving away from fossil fuels. There was no greater articulation of a plea for more urgency in addressing an overheating world than young people leaving schools and protesting on Fridays, fired by the radicalism of Swedish teenage activist Greta Thunberg.It got political results: national commitments to achieve net-zero emissions by 2050; many declarations of a climate emergency, the EU seeking that Europe becomes the first carbon-neutral continent. The latest manifestations of a physical world under immense pressure surfaced repeatedly: the Earth's lung (the Amazon) ravaged by fire, Arctic ice sheets melting like never before, 40-degree summer heatwaves in the heart of Europe, autumn floods overwhelming Venice, droughts and unprecedented cyclones underlying the vulnerability of Sub-Saharan Africa.Climate science's latest findings and emission figures that don't lie capped it all. Understandably in such circumstances, hope evaporates and feelings of eco-anxiety re-emerge.World leaders gather in Madrid next week for COP25 (relocated to Spain after civil unrest in Chile), their annual bargaining on averting a climate catastrophe. The most recent alarm bells will be making them more anxious, and there is an ominous and widening gap between commitment and delivery on emission reductions. Reliable people are said to have a high ""say/do"" ratio on things they say they will do relative to the things they follow through on and do. The world has an appallingly low climate say/do ratio - which is forcing many activists to ask which bit of the climate science do those leaders not get?Even if every country fulfils current pledges - and many including Ireland are not on track to do so - the latest UN emissions gap report predicts an intolerable 3.2 degree rise this century. Meanwhile, they have dithered on nailing down how to ensure full implementation of the 2015 Paris Agreement, the best mechanism to bring about action.Climate activist and Maynooth University academic Dr Lorna Gold is well placed to assess the latest science and growing climate inequality, and to determine what needs to happen, especially in the context of a possible green new deal in Ireland.Such a deal harks back to the US response to the great depression of the 1930s and to the Marshall Plan to rebuild Europe after the second World War, but Gold prefers to focus on what happened during that war, when governments suspended normality and reorientated society under a unified objective. It may be an unfortunate analogy but war has to be declared on emissions. Climate change can lead to the breakdown of society, she notes, but equally it can lead to the unifying of human action. War on emissions is often mistakenly regarded as a war on economic development and on the freedom to dream of a better future, says Gold. ""That is a very comfortable middle-class viewpoint.""Ten per cent of the richest and most powerful economies are responsible for 50 per cent of emissions and for exporting the notion of private wealth and luxury. ""That 10 per cent haven't yet experienced the crushing effects of climate change"" and associated poverty so evident in developing countries.""We need to go to war on our emissions but cannot do that without restructuring and redistributing income,"" Gold says. ""We are facing two competing logics leading us in different directions - the logic of growth, of extraction, of profit - and there's a logic of sufficiency, of conservation. But these two logics are now conflicting increasingly in everyday life.""Global trend In some countries emissions may have peaked but the global trend is upwards. Timel"
"COP25","Ireland","COP25_Ireland17","Bruton wants zero emissions by 2050","December 12, 2019 Thursday","The Irish Times","Ireland is firmly aligned with countries pursuing a course of high ambition to ensure they decarbonise their economies by 2050, Minister for Climate Action and Environment Richard Bruton has told the UN climate talks.In an address to COP25 by way of national statement, Mr Bruton said Ireland was enshrining a ""net-zero emissions"" target for 2050 in law and confirmed it was joining the Carbon Neutrality Coalition (CNC), a global alliance of countries intending to decarbonise and to lead others in the transition. Ireland over the past 12 months, in underpinning its ambitions, had put ""concrete policy instruments"" into the Government's climate action plan, he said. How this was achieved provided lessons relevant to others because it was built on the foundation of a citizens' assembly, which ""has given us leverage across our community"".A road map was in place with concrete actions and a governance structure embedded in law that would ensure accountability and require policymakers to achieve set goals. On what had been delivered, he cited an end to oil exploration; commitment to an increased carbon tax while ring-fencing resulting revenues for climate actions in communities; and a just transition mechanism to support those adversely affected.Existential threat Mr Bruton said his generation was at risk of passing on a world in worse condition, which placed huge responsibilities on COP25. He said civilisation reached its most creative and collaborative level when faced with an existential threat. ""This is such a time,"" he added.Referring to a simultaneous protest by young climate activists in an adjoining venue, Mr Bruton said: ""We hear the call of the coming generation ringing in our ears from next door."" They were owed a debt of gratitude, he believed, for highlighting the real damage that climate disruption was causing, confirmed by hardening science.\l"
"COP25","Ireland","COP25_Ireland18","Thunberg plans zero-carbon journey to US climate summit","July 29, 2019 Monday 6:18 PM GMT","RTE News","Swedish climate activist Greta Thunberg has said that she would cross the Atlantic on a racing sailboat to attend a UN climate summit in New York in September.""I've been offered a ride on the 60 ft (18-metre) racing boat Malizia II. We'll be sailing across the Atlantic Ocean from the UK to NYC in mid August,"" the 16-year-old said on Twitter.It will be her first visit to the US since she launched her environmental drive a year ago.Ms Thunberg, who has inspired thousands of her peers in many parts of the world to press their elders to act on climate change, refuses to fly owing to the negative impact on the environment.German Boris Herrmann and the Monaco-based founder of the Malizia team Pierre Casiraghi will steer the boat, which is to carry a sail marked ""#Fridays for future"".The phrase stems from Ms Thunberg's decision to skip school on Fridays so she could push for action against climate change in front of the Swedish parliament.""After months of research and considering different options for her journey, Greta will sail across the Atlantic in a zero-carbon racing boat called Malizia II, a foiling sailboat built in 2015, which is fitted with solar panels and underwater turbines to generate electricity on board the vessel,"" Mr Herrmann said on his website.Once in the US, she is to take part in ""large-scale climate demonstrations on September 20 and 27 and speak at the United Nations Climate Action Summit, hosted by Secretary General Antonio Guterres,"" he added.COP25) in Santiago, Chile, in early December, Mr Herrmann said, with other South American stops also planned.Her spokesman could not be reached for confirmation of the complete itinerary, but people close to Greta have already said that she would attend the COP25 conference.The Guardian newspaper said she would also be accompanied by her father Svante, and a filmmaker.Casiraghi, the grandson of Monaco's late Prince Rainier III and US-born actor Grace Kelly, has said the boat's name was taken from the Moneguesque language and meant ""the wily one.""\l"
"COP25","Ireland","COP25_Ireland19","Give Me a Crash Course In ... Climate talks","December 21, 2019 Saturday","The Irish Times","What climate talks were taking place in Madrid? The annual UN conference of the parties (COP) is a gathering of almost 200 states, all signatories to the 2015 Paris Agreement on limiting the global temperature rise to 2 degrees this century, and preferably 1.5 degrees, to avoid the worst effects of climate disruption. All countries that attend - high-polluting big economies, developing countries, and small island states of the South Pacific - are experiencing climate shocks of varying degrees. This is the only system for global action to counter the effects of an over-heating planet caused by human activity. Does it work? The gathering of more than 20,000 people, including negotiators, experts, lobbyists, NGOs, business and media, can be chaotic. Nevertheless, it often delivers results, though not urgently enough given the scale of the challenge now facing us. The heavyweight heads of state and environment or energy ministers usually arrive in the final days, to inject political pragmatism. Were delegates moved by growing climate awareness? Many millions across the globe have taken to the streets over the past year, demanding politicians take a more urgent approach. Young people have established an unstoppable movement inspired by the stark message of Swedish teenager Greta Thunberg. They were a notable presence at COP25, but soon became disillusioned by the process. Meanwhile, a series of reports in advance of COP25 showed we are on course for a 3.2-degree rise, which would make vast tracts of the planet uninhabitable. Some 11 billion tonnes of Greenland ice melted in just one day this year - equivalent to 4 million Olympic size swimming pools - as many countries struggled to deal with extreme weather linked to climate disturbance. And did the meeting deliver? This year, there was high expectation of increased commitments: a deal on carbon trading to help reduce emissions and scale up of funds for vulnerable countries. But the weak final text, recognising the need for increased actions next year, emerged 40 hours after the deadl"
"COP25","Ireland","COP25_Ireland20","A failure on all fronts; UN climate talks","December 16, 2019 Monday","The Irish Times","There is a terrible empty feeling following the outcome of the UN climate talks in Madrid. It could - and should - have been different. National self-interest was allowed to prevail. The need for collective action in the best interests of Planet Earth had never been greater. The latest alarm bells from climate science rang loudly in the days before COP25 opened two weeks ago. The agenda was clear: a need for countries to declare bolder climate actions, to end abuses in the way big countries trade in carbon with the pretence of helping to cut global emissions, and to scale up funding for developing countries already experiencing climate shocks. This was to bolster the Paris Agreement as it goes into its critical implementation phase next year and to reinforce its environmental integrity.Joint hosts Chile and Spain failed on all three fronts. Moreover, the outcome underl"
"COP25","Ireland","COP25_Ireland21","Swedish teen Thunberg 'a bit surprised' as she's named 'Time' Person of the Year; :: Activist inspired four million people to join climate strike, says magazine","December 12, 2019 Thursday","Irish Independent","GRETA THUNBERG, the 16-year-old Swede who inspired millions of young people to take action against climate change, has been named 'Time' Magazine's Person of the Year for 2019.Thunberg launched a grassroots campaign when she was 15 by skipping school every Friday to demonstrate outside the Swedish parliament, pushing for her government to meet its ambitious goals to curb carbon emissions.""In the 16 months since her protests began, she has addressed heads of state at the UN, met the Pope, sparred with the president of the United States and inspired four million people to join the global climate strike,"" the magazine said. She is the youngest individual to have won the accolade.""Margaret Atwood compared her to Joan of Arc. After noticing a hundredfold increase in its usage, Collins Dictionary named Thunberg's pioneering idea, climate strike, word of the year,"" 'Time' added.""For sounding the alarm about humanity's predatory relationship with the only home we have, for bringing to a fragmented world a voice that transcends backgrounds and borders, for showing us all what it might look like when a new generation leads, Greta Thunberg is Time's 2019 Person of the Year.""Thunberg, who turns 17 next month, was in Madrid yesterday, and addressed negotiators at the UN's COP25Thunberg was blunt in her assessment of politicians' efforts, telling the Madrid audience: ""It seems to have turned into some kind of opportunity for countries to negotiate loopholes and to avoid raising their ambition.""I'm sure that if people heard what was going on and what was said during these meetings, they would be outraged.""Former US vice-president Al Gore, a long-time environmentalist, said the magazine made a ""brilliant choice"" in choosing the reluctant celebrity.Thunberg, who said her Asperger's syndrome can be an advantage in her campaigning, sailed across the Atlantic to get to the Madrid event in order to avoid travelling by air.Thunberg's uncompromising stance has brought her into confrontation with some of the world's most powerful people. A video of her giving Donald Trump what media described as a ""death stare"" at a UN climate summit in New York in September went viral.During a speech at around the same time, Thunberg bristled with anger, saying: ""I shouldn't be up here. I should be back in school on the other side of the ocean, yet you all come to us young people for hope. How dare you? ""You have stolen my dreams and my childhood with your empty words.""\l"
"COP25","Ireland","COP25_Ireland22","Climate striker criticises deliberate 'jargon'","December 11, 2019 Wednesday","The Irish Times","One of Ireland's first student climate strikers has accused member nations at the UN climate talks of failing to take on board the profound worry of young people about the fate of the planet,In a blistering attack, Saoi O'Connor said powerful countries were pursuing a course that was deliberately confusing to hide lack of action.Speaking at a FridaysForFuture press briefing at , the teenager from Skibbereen, Co Cork, said negotiators ""are not putting value on our lives, our countries, our futures"".Instead, big wealthy countries, responsible for by far the most carbon emissions, were attempting to ensure they continue to live comfortable lives while pursuing ""a system of carbon trading to make them look good"".Ordinary people attending the COP were incredibly confused and alienated from the process because ""it's all article 6.4, whatever it is. It's incredibly jarring; the amount of jargon thrown around in here,"" added the teenager who has been protesting outside Cork City Hall on Fridays for almost a year.""For too long, because we have not been able to understand what has been going on, because we have been kept out, we have allowed ourselves to be passive here, [and] in places like my country, because we have assumed action was happening and that we just didn't understand what £rticle 6.whatever' was.""Article 6 of the Paris Agreement is about trading carbon, she noted. ""Essentially, I offset some of my carbon so that you can burn more. Effectively, the countries that are here, despite what they're talking about, despite their wonderful speeches - truly wonderful speeches - still thinking that our past, present and future is something that can be bought and sold. And I don't think we're going to take that.""Speaking afterwards to The Irish Times, she said fellow striker Alexandria Villasenor from New York had protested for months with a poster saying, ""COP24 failed us"".""That is pretty much right. That is what COP25 is going to do,"" she added. ""The real COP is on the streets. The power is with the people - they are redefining politics.""She confirmed Greta Thunberg, a friend, was always talking about coming to Ireland. But after three weeks on the Atlantic, she believed the Swedish teenager probably wants to go home and see her family and dogs - including Roxy, rescued from a pound in Cork some time ago.Irish people ""have a big appetite for what she has to say"", she added, though schools strikes had already achieved ""an attention shift on the climate issue"".\l"
"COP25","Ireland","COP25_Ireland23","UN chief urges action ahead of global climate summit","December 1, 2019 Sunday 4:48 PM GMT","RTE News","Devastating impacts of global warming that threaten humanity are a pushback from Nature under assault, UN chief Antonio Guterres has warned ahead of a key climate conference.""For many decades the human species has been at war with the planet, and now the planet is fighting back,"" he said, decrying the ""utterly inadequate"" efforts of the world's major economies to curb carbon pollution.Mr Guterres flagged a UN report to be released on Tuesday confirming the last five years are the warmest on record, with 2019 likely to be the second hottest ever.""Climate-related disasters are becoming more frequent, more deadly, more destructive,"" he said on the eve of the 196-nation climate change talks in Madrid.Human health and food security are at risk, he added, noting that air pollution associated with climate change accounts for seven million premature deaths every year.The Paris Agreement calls for capping global warming at under 2 degrees Celsius, but recent science has made clear that the treaty's aspiration goal of 1.5 degrees Celsius is a far safer threshold. \l"
"COP25","Ireland","COP25_Ireland24","Threat to marine life as oxygen levels drop; Climate talks hear humanity is destroying planetary support system","December 9, 2019 Monday","The Irish Times","Oxygen in the world's oceans is depleting at an unprecedented rate, leaving species gasping for breath and devastating marine habitats, a report issued at the annual UN climate talks in Madrid has warned. The International Union for Conservation of Nature (ICUN) study by 67 scientists from 17 countries found oxygen levels in oceans fell by about 2 per cent between 1960 and 2010. The deoxygenation is largely attributed to climate disruption, although other human activities are contributing to the problem, notably nutrient run-off, when too many nutrients from fertilisers used on farms and lawns wash into waterways. Large fish species are at particular risk, the study warns, with many vital ecosystems in danger of collapse. Dead zones - where oxygen is effectively absent - have quadrupled in the past half-century, and there are also at least 700 areas where oxygen is at dangerously low levels.ICUN acting director general Grethel Aguilar said the health of oceans should be a key consideration for the talks.""As the warming ocean loses oxygen, the delicate balance of marine life is thrown into disarray. The potentially dire effects on fisheries and vulnerable coastal communities mean that the decisions made at the conference are even more crucial."" Rising tide of plastics The problem is being compounded because the world's oceans are already being overfished, and assailed by a rising tide of plastics, as well as other pollutants. ""A healthy ocean with abundant wildlife is capable of slowing the rate of climate breakdown substantially,"" said Dr Monica Verbeek, director of Seas at Risk. ""Ending overfishing is a quick, deliverable action which will restore fish populations, create more resilient ocean ecosystems, decrease CO2 pollution and increase carbon capture, and deliver more profitable fisheries and thriving coastal communities.""UN special envoy for the oceans Peter Thomson, speaking during Oceans Action Day on Saturday, said the latest evidence supported the view of UN secretary general Ant\'f3nio Guterres that ""humanity is knowingly destroying the planetary support system"". Critical year A series of major international gatherings on oceans, biodiversity loss and COP26 would make 2020 the critical year to ""get it right for the next decade"" in reversing decl"
"COP25","Ireland","COP25_Ireland25","Greta Thunberg sails in for climate summit","December 3, 2019 Tuesday 12:55 PM GMT","RTE News","Swedish teen activist Greta Thunberg has arrived at a port in Portugal after crossing the Atlantic in a catamaran to attend a UN climate change summit in Madrid.The 16-year-old has become the face of young people's demands for climate action and made a point of making the journey back from September's New York climate summit by sea rather than by plane. She had expected to be heading for Chile, but the South American nation passed the hosting of the COP25 summit meeting to Spain following violent anti-government protests.WATCH: Greta Thunberg arrives in Lisbon for UN climate conference | Read more: HYPERLINK https://t.co/zQrSxLaotHhttps://t.co/zQrSxLaotH HYPERLINK https://t.co/WEdIG6ztVQhttps://t.co/WEdIG6ztVQ RT\'c9 News (@rtenews) December 3, 2019Greta set sail on the 14m La Vagabonde catamaran on 13 November from Hampton, Virginia, to return to Europe.She, along with British navigator Nikki Henderson and the Australian family who own the vessel, have arrived in Portugal's capital Lisbon after a voyage of more than 5,500km.Greta is scheduled to hold media interviews then take an overnight train to Madrid, Portuguese sources said.The climate summit, which opened yesterday and runs to 13 December, brings together representatives of some 200 signatory nations to the 2015 Paris accord.\l"
"COP25","Ireland","COP25_Ireland26","Greta Thunberg in Twitter spat with German rail firm","December 16, 2019 Monday 7:34 AM GMT","RTE News","Swedish teenage climate activist Greta Thunberg was forced to defend herself in a Twitter spat with German railway service Deutsche Bahn (DB).The 16-year-old provoked a testy reaction from Germany's oft-maligned rail operator when she tweeted from a DB train on her journey home from the COP25 climate summit in Madrid.""Traveling on overcrowded trains through Germany. And I'm finally on my way home!"" she wrote, above a picture of herself sitting on the floor of a carriage surrounded by suitcases.DB responded testily, pointing out that Greta had travelled in first class during her journey through Germany.""Dear Greta, thanks for supporting us railway workers in our fight against climate change. We are happy that you travelled with us on the ICE 174 on Saturday,"" tweeted DB's official account in German.""It would have been nicer if you had also mentioned the friendly and competent manner in which you were treated by staff at your seat in first class,"" they added.The company then followed up the tweets with a press release, in which they added that Greta's travel companions ""were sitting in first class from Frankfurt onwards"".Greta hit back on Twitter, claiming she had found a seat at a stop after Frankfurt, which she said was ""no problem"".\l"
"COP25","Ireland","COP25_Ireland27","Thunberg highlights rights of world's indigenous peoples","December 10, 2019 Tuesday","The Irish Times","Greta Thunberg turned a spotlight on the struggles of the world's indigenous peoples when she appeared at the UN climate conference alongside young campaigners experiencing the consequences of an overheating world first-hand. The Swedish teenager, who arrived at COP25 in Madrid after crossing the Atlantic by catamaran, said she was availing of ""some media attention"" to give a voice to people whose stories needed to be listened to, including those from Africa and places where climate activism is actively suppressed.She stayed largely silent during her first official appearance at the summit to allow a young Native American, a Chilean, a Pacific islander, a Russian and a Filipino to speak. ""Their rights are being violated across the world, and they are also among the ones being hit the most and the quickest by the climate and environmental emergency,"" she said.Their testimonies indicated the emergency was not an issue for today's children when they grow up, Ms Thunberg said. ""People are suffering and dying from it today.""Failed Rose Whipple of the Santee Dakota, native to Minnesota in the US, said: ""The climate crisis is a spiritual crisis for our entire world. Our solutions must weave science and spirituality and traditional ecological knowledge with technology."" She described the decl"
